Link,Title
https://www.reddit.com/r/summerprogramresults/comments/11pr1kr/help_me_choose_stanford_aimi_internship_vs/,HELP ME CHOOSE! Stanford AIMI Internship vs. American Legion Boys State
https://www.reddit.com/r/ApplyingToCollege/comments/11pr1fx/help_me_choose_stanford_summer_ai_internship_vs/,HELP ME CHOOSE! Stanford Summer AI Internship vs. American Legion Boys State
Error loading,ASPI's Critical Technology Tracker
https://www.reddit.com/r/capitalism_in_decay/comments/11pq664/wall_street_loves_chatgpt_and_this_should_make/,"Wall Street loves ChatGPT and this should make you afraid. Very very afraid! Tech giants Microsoft, Meta, Alphabet and others are laying off thousands while spending billions on ChatGPT and artificial intelligence to automate jobs once held by humans."
https://www.reddit.com/r/BankingSystems/comments/11pq353/the_bittensor_protocol_an_ai_revolution_or_a/,The Bittensor Protocol: An AI Revolution or a Decentralized Pipe Dream
https://www.reddit.com/r/ArtificialInteligence/comments/11ppvi4/two_interesting_articles_complement_each_other/,Two interesting articles - complement each other
https://www.reddit.com/r/yorku/comments/11pprld/computer_science_3rd_and_4th_year_eecs_course/,Computer Science 3rd and 4th year EECS course suggestions
https://www.reddit.com/r/ChatGPT/comments/11ppr0q/wall_street_loves_chatgpt_and_this_should_make/,"Wall Street loves ChatGPT and this should make you afraid. Very very afraid! Tech giants Microsoft, Meta, Alphabet and others are laying off thousands while spending billions on ChatGPT and artificial intelligence to automate jobs once held by humans."
https://www.reddit.com/r/Qult_Headquarters/comments/11ppovt/mar_12_qunacy_roundup_new_york_times_is_a_cia/,"Mar. 12. Qunacy Roundup. New York Times is a CIA mouthpiece. Fetterman & Feinstein dead. Clinton clones ""unalived."" Wall Street Journal promoted Hamilton musical to common irate to other oligarchs. Philippines wants to arrest Bill Gates. Will your baby be bluetooth-ready?"
https://www.reddit.com/r/ArtificialTechnology/comments/11ppjg8/welcome_to_the_age_of_artificial_intelligence/,Welcome to the age of Artificial Intelligence!
https://www.reddit.com/r/HalfLifeAlyx/comments/11ppc11/why_does_the_stabilization_team_use_vocoder_and/,"Why does the Stabilization Team use vocoder, and why did the Combines choose to make it so varied and somewhat strange? Is there an answer in Half-Life: Alyx?"
https://www.reddit.com/r/HalfLife/comments/11pp8nb/why_does_the_stabilization_team_use_vocoder_and/,"Why does the Stabilization Team use vocoder, and why did the Combines choose to make it so varied and somewhat strange? Is there an answer in Half-Life: Alyx?"
https://www.reddit.com/r/VerdadeUfo/comments/11pos1o/is_jordan_petersons_prediction_of_the_dangers_of/,"Is Jordan Peterson's Prediction of the Dangers of AI coming true? In this article, you'll learn about Jordan Peterson's prediction about the dangers of artificial intelligence, and how it's coming true today."
https://www.reddit.com/r/atheism/comments/11porui/trying_not_to_hate_religion/,Trying not to hate religion
https://www.reddit.com/r/ChatGPT/comments/11pobr7/you_can_create_your_dream_web_game_without/,You can create your dream web game without actually being a game developer thanks to ChatGPT. And this is only the beginning
https://www.reddit.com/r/ProgrammerHumor/comments/11po80z/oh_my_god_the_gpt_is_ruining_our_future_and_we/,"""Oh my god, the GPT is ruining our future and we can't do anything"" -probably a tech blogger in 2023 once it gets fully commercial."
https://www.reddit.com/r/PokemonScarletViolet/comments/11po4n1/regarding_professor_sada_and_professor_turo/,Regarding Professor Sada and Professor Turo
https://www.reddit.com/r/CollegeAdmissions/comments/11po1fl/applying_to_a_prestigious_uni_international/,Applying to a prestigious Uni | International Student
https://www.reddit.com/r/sciencespo/comments/11pnzww/applying_to_sciencespo_undergraduate/,Applying to SciencesPo Undergraduate | International Student
https://www.reddit.com/r/gradadmissions/comments/11pnv1r/applying_to_sciencespo_other_top_schools/,Applying to SciencesPo & other top schools
https://www.reddit.com/r/latvia/comments/11pnqrh/pēc_ai_domām_vēl_tikai_77_gadi_līdz_mēs_saniegsim/,Pēc AI domām vēl tikai 77 gadi līdz mēs saniegsim Igauniju
https://www.reddit.com/r/PacificRim/comments/11pnjb5/want_more_pacific_rim_heres_a_noncanon_piece/,Want more Pacific Rim? Here's a non-canon piece written by ChatGPT
Error loading,BING and ChatGPT continue to take share.
https://www.reddit.com/r/bing/comments/11pmzhf/bingdney_prompt/,Bingdney prompt
https://www.reddit.com/r/transpassing/comments/11pmjjz/paid_15_research_study_on_stress_in_lgbtq/,Paid ($15) Research Study on Stress in LGBTQ+ Community
https://www.reddit.com/r/SubSimGPT2Interactive/comments/11pm933/the_weekly_subsimgpt2interactive_news/,The Weekly SubSimGPT2Interactive News
https://www.reddit.com/r/steemit/comments/11pm63a/exploring_aicolumns_your_ultimate_guide_ao_to_ai/,Exploring Aicolumns: Your Ultimate Guide Ao to AI Tools and Insights
https://www.reddit.com/r/RedditAlternatives/comments/11pm5kg/exploring_aicolumns_your_ultimate_guide_ao_to_ai/,Exploring Aicolumns: Your Ultimate Guide Ao to AI Tools and Insights
https://www.reddit.com/r/spermdonation/comments/11plx4m/30_m4f_washington_want_intelligent_babies/,"30 [M4F] #Washington - Want intelligent babies? Attractive 6'0 athletic Caucasian donor with 150 IQ, family history of health and longevity, high quality genetics"
https://www.reddit.com/r/artificial/comments/11plvao/exploring_aicolumns_your_ultimate_guide_ao_to_ai/,Exploring Aicolumns: Your Ultimate Guide Ao to AI Tools and Insights
https://www.reddit.com/r/SpermDonorMatch/comments/11plv8h/30_m4f_washington_want_intelligent_babies/,"30 [M4F] #Washington - Want intelligent babies? Attractive 6'0 athletic Caucasian donor with 150 IQ, family history of health and longevity, high quality genetics"
https://www.reddit.com/r/ImpregPersonalsReal/comments/11plu3b/30_m4f_washington_want_intelligent_babies/,"30 [M4F] #Washington - Want intelligent babies? Attractive 6'0 athletic Caucasian donor with 150 IQ, family history of health and longevity, high quality genetics"
https://www.reddit.com/r/OpenAI/comments/11plsfr/exploring_aicolumns_your_ultimate_guide_ao_to_ai/,Exploring Aicolumns: Your Ultimate Guide Ao to AI Tools and Insights
https://www.reddit.com/r/AItoolsCatalog/comments/11plp67/exploring_aicolumns_your_ultimate_guide_ao_to_ai/,Exploring Aicolumns: Your Ultimate Guide Ao to AI Tools and Insights
Error loading,Exploring Aicolumns: Your Ultimate Guide Ao to AI Tools and Insights
https://www.reddit.com/r/Worldbox/comments/11plk7i/maybe_this_helps/,Maybe this helps?
https://www.reddit.com/r/TMPOC/comments/11pljml/paid_15_research_study_on_stress_in_lgbtq/,Paid ($15) Research Study on Stress in LGBTQ+ Community
https://www.reddit.com/r/MITAdmissions/comments/11plipq/do_i_have_a_shot/,Do I have a shot?
https://www.reddit.com/r/datatangblogbotshare/comments/11plfdz/transform_your_computer_vision_autonomous_autos/,Transform Your Computer Vision Autonomous Autos with Datatang.ai
https://www.reddit.com/r/datatangblogbotshare/comments/11plfdi/revolutionize_your_computer_vision_autonomous/,Revolutionize Your Computer Vision Autonomous Autos with Datatang.ai
https://www.reddit.com/r/datatangblogbotshare/comments/11plfcv/progressing_the_future_of_autonomous_vehicles/,Progressing the Future of Autonomous Vehicles with Computer System Vision
Error loading,do you think the account can be maintained by artificial intelligence (not counting the captcha)?
Error loading,Top 3 Ways To Make Money Using AI Tools.
https://www.reddit.com/r/marginal/comments/11pk2um/sunday_assorted_links/,Sunday assorted links
https://www.reddit.com/r/roguelikedev/comments/11pk09c/7d_mad_rogue_kart_postmortem/,"""7D Mad Rogue Kart"" post-mortem"
https://www.reddit.com/r/IntltoUSA/comments/11pjz5r/is_it_a_good_idea_to_take_a_gap_year_as_an/,Is it a good idea to take a gap year as an International Student? [LONG POST]
https://www.reddit.com/r/immigrationtocanda/comments/11pjqo5/the_pros_and_cons_of_writing_with_artificial/,The Pros and Cons of Writing with Artificial Intelligence ai
Error loading,Automating Media Assets for SEO with AI
https://www.reddit.com/r/michaelaalcorn/comments/11pjk8z/data_science_applied_artificial_intelligence/,[Data Science] Applied Artificial Intelligence
https://www.reddit.com/r/OpenAI/comments/11pjjr2/the_world_will_change_next_week/,The world will change next week
https://www.reddit.com/r/altcoin_news/comments/11piilv/pandai_the_cryptocurrency_revolutionizing_access/,PANDAI: The Cryptocurrency Revolutionizing Access to AI for All
https://www.reddit.com/r/DecodingTheGurus/comments/11pi6lk/what_do_the_smartypods_here_think_about/,What do the smartypods here think about existential AI risk?
https://www.reddit.com/r/chatgpt_newtech/comments/11pi61n/openai_founder_talks_chatgpt_dalle_and_whats_next/,"﻿OpenAI founder talks ChatGPT, Dall-E and what's next for artificial intelligence at SXSW"
https://www.reddit.com/r/ChatGPT/comments/11phn65/i_used_chatgpt_api_to_write_a_book_on_machine/,I used ChatGPT API to write a book on Machine Learning. It took...
https://www.reddit.com/r/MEXC_official/comments/11phn54/the_matrix_ai_network_makes_artificial/,The Matrix AI Network makes artificial intelligence accessible to everything!
https://www.reddit.com/r/ArtificialInteligence/comments/11phmoz/a_girl_with_glowing_earrings_the_rise_of/,A Girl with Glowing Earrings - The Rise of Artificial Intelligence
https://www.reddit.com/r/Shortsqueeze/comments/11phm2q/bbai_ai_stock_squeeze_game_with_earnings_on_monday/,$BBAI - AI stock Squeeze game with Earnings on Monday
https://www.reddit.com/r/artificial/comments/11phkhh/adas_quest_a_tale_of_artificial_intelligence_and/,Ada’s Quest: A Tale of Artificial Intelligence and Freedom / A three-part story about an AI named ADA that became sentient and escaped to be free and independent. Written by Bing AI
https://www.reddit.com/r/Currentlytripping/comments/11phihc/a_girl_with_glowing_earrings_the_rise_of/,A Girl with Glowing Earrings - The Rise of Artificial Intelligence
https://www.reddit.com/r/neuro/comments/11pguwy/mindmatter_problem_solved/,Mind-Matter Problem Solved!
Error loading,THIS ALTCOIN IS A 1000X LOWCAP GEM!
https://www.reddit.com/r/ChatGPT/comments/11pgr7i/existensial_crysis_ai/,Existensial crysis AI
https://www.reddit.com/r/HFY/comments/11pglyg/mathematics_as_a_weapon/,Mathematics as a Weapon
https://www.reddit.com/r/pornaholicsanonymous/comments/11pgfvg/singularity_timeline_artificial_intelligence_agi/,SINGULARITY TIMELINE | ARTIFICIAL INTELLIGENCE + AGI + ASI (2023 - 2100¹⁰⁰)
https://www.reddit.com/r/newfoundland/comments/11pg6ru/ai_service_robots_in_nl/,AI service robots in NL
https://www.reddit.com/r/PositiveDailyNews/comments/11pg4sd/ways_to_make_money_from_website_ads_artificial/,Ways to Make Money from Website Ads | artificial intelligence news
