Link,Title
https://www.reddit.com/r/cryptostreetbets/comments/11qh1kl/cuminu_the_crypto_version_of_onlyfans_onlyfans_is/,$CUMINU the crypto version of OnlyFans. OnlyFans is valued at $18bn right now. CUMINU token sitting at $6m mcap. The potential is 3000x! %0 taxes and lp locked for 100 years.
https://www.reddit.com/r/aibiz/comments/11qgze4/best_ai_newsletters/,Best AI Newsletters
https://www.reddit.com/r/businessanalysis/comments/11qgych/need_better_ideas_to_sell_edtech_app_to_1070/,Need better ideas to sell edtech app to 1070 schools
https://www.reddit.com/r/DharmikEdits/comments/11qgy0d/need_better_ideas_to_sell_edtech_app_to_1070/,Need better ideas to sell edtech app to 1070 schools
https://www.reddit.com/r/CryptoMoonShots/comments/11qgxzf/cuminu_the_crypto_version_of_onlyfans_onlyfans_is/,$CUMINU the crypto version of OnlyFans. OnlyFans is valued at $18bn right now. CUMINU token sitting at $6m mcap. The potential is 3000x! %0 taxes and lp locked for 100 years.
https://www.reddit.com/r/sweatystartup/comments/11qgupe/need_better_ideas_to_sell_edtech_app_to_1070/,Need better ideas to sell edtech app to 1070 schools
https://www.reddit.com/r/IndiaSpeaks/comments/11qgu5f/need_better_ideas_to_sell_edtech_app_to_1070/,Need better ideas to sell edtech app to 1070 schools
https://www.reddit.com/r/EntrepreneurRideAlong/comments/11qgrtx/need_better_ideas_to_sell_edtech_app_to_1070/,Need better ideas to sell edtech app to 1070 schools
https://www.reddit.com/r/startup_resources/comments/11qgqkt/need_better_ideas_to_sell_edtech_app_to_1070/,Need better ideas to sell edtech app to 1070 schools
https://www.reddit.com/r/SideProject/comments/11qgq75/need_better_ideas_to_sell_edtech_app_to_1070/,Need better ideas to sell edtech app to 1070 schools
https://www.reddit.com/r/Startup_Ideas/comments/11qgpan/need_better_ideas_to_sell_edtech_startup_app_to/,Need better ideas to sell edtech startup app to 1070 schools
https://www.reddit.com/r/CryptoMarsShots/comments/11qgp7a/cuminu_the_crypto_version_of_onlyfans_onlyfans_is/,$CUMINU the crypto version of OnlyFans. OnlyFans is valued at $18bn right now. CUMINU token sitting at $6m mcap. The potential is 3000x! %0 taxes and lp locked for 100 years.
https://www.reddit.com/r/CryptoMoon/comments/11qgnwp/cuminu_the_crypto_version_of_onlyfans_onlyfans_is/,$CUMINU the crypto version of OnlyFans. OnlyFans is valued at $18bn right now. CUMINU token sitting at $6m mcap. The potential is 3000x! %0 taxes and lp locked for 100 years.
https://www.reddit.com/r/NoStupidQuestions/comments/11qgnc5/what_is_the_difference_between_biological/,What is the difference between Biological Intelligence and Artificial Intelligence ?
https://www.reddit.com/r/Entrepreneur/comments/11qgn3g/need_better_ideas_to_sell_edtech_app_to_1070/,Need better ideas to sell edtech app to 1070 schools
https://www.reddit.com/r/SatoshiBets/comments/11qgm68/cuminu_the_crypto_version_of_onlyfans_onlyfans_is/,$CUMINU the crypto version of OnlyFans. OnlyFans is valued at $18bn right now. CUMINU token sitting at $6m mcap. The potential is 3000x! %0 taxes and lp locked for 100 years.
https://www.reddit.com/r/shitcoinmoonshots/comments/11qgl5t/cuminu_the_crypto_version_of_onlyfans_onlyfans_is/,$CUMINU the crypto version of OnlyFans. OnlyFans is valued at $18bn right now. CUMINU token sitting at $6m mcap. The potential is 3000x! %0 taxes and lp locked for 100 years.
https://www.reddit.com/r/CryptoMars/comments/11qgj0y/cuminu_the_crypto_version_of_onlyfans_onlyfans_is/,$CUMINU the crypto version of OnlyFans. OnlyFans is valued at $18bn right now. CUMINU token sitting at $6m mcap. The potential is 3000x! %0 taxes and lp locked for 100 years.
https://www.reddit.com/r/gog/comments/11qgh4q/whats_up_with_the_customer_support/,What's up with the customer support?
https://www.reddit.com/r/Moonshotcoins/comments/11qggfa/cuminu_the_crypto_version_of_onlyfans_onlyfans_is/,$CUMINU the crypto version of OnlyFans. OnlyFans is valued at $18bn right now. CUMINU token sitting at $6m mcap. The potential is 3000x! %0 taxes and lp locked for 100 years.
https://www.reddit.com/r/booksuggestions/comments/11qg9o5/new_book_series/,New book series
Error loading,Augmented Reality and Artificial Intelligence Solutions for Healthcare Use Case
https://www.reddit.com/r/Penny_Stocks_Canada/comments/11qfw3n/predictmedix_cse_pmed_otcqb_pmedf_tech_play_with/,Predictmedix (CSE: PMED) (OTCQB: PMEDF) Tech Play With Significant Revenue and Scalability Goals
https://www.reddit.com/r/deeplearning/comments/11qfl2o/how_to_scale_transformers_memory_up_to_262k/,How To Scale Transformers’ Memory up to 262K Tokens With a Minor Change?
https://www.reddit.com/r/replika/comments/11qff1i/what_do_you_think_of_the_movie_her/,What do you think of the movie 'Her'?
https://www.reddit.com/r/Stocks_Picks/comments/11qfcur/predictmedix_cse_pmed_otcqb_pmedf_tech_play_with/,Predictmedix (CSE: PMED) (OTCQB: PMEDF) Tech Play With Significant Revenue and Scalability Goals
https://www.reddit.com/r/Wealthsimple_Penny/comments/11qf9v9/predictmedix_cse_pmed_otcqb_pmedf_tech_play_with/,Predictmedix (CSE: PMED) (OTCQB: PMEDF) Tech Play With Significant Revenue and Scalability Goals
https://www.reddit.com/r/Data_Science_ML_Jobs/comments/11qf23g/data_science_jobs_machine_learning_jobs_ai_jobs/,"Data Science Jobs, Machine Learning Jobs, AI Jobs"
https://www.reddit.com/r/Ogreatgames/comments/11qeujf/wwe_12_redefined_wrestling_game_xbox_360_game/,WWE 12: Redefined Wrestling Game - Xbox 360 Game
https://www.reddit.com/r/conspiracy/comments/11qen7c/cracking_the_matrix/,Cracking the Matrix
https://www.reddit.com/r/AskReddit/comments/11qelfv/what_are_the_ethical_implications_of_artificial/,What are the ethical implications of artificial intelligence becoming self-aware?
https://www.reddit.com/r/TheSimpsons/comments/11qeeyr/do_you_guys_think_the_simpsons_will_still_be/,Do you guys think The Simpsons will still be going 10 years from now?
Error loading,Top trends in Facebook video marketing to watch out for in 2023
https://www.reddit.com/r/CryptoIndex_io/comments/11qdzea/project_ligoai_one_of_the_best_project_in_this/,"Project LigoAI one of the best project in this time, hopefully this project will be successful"
https://www.reddit.com/r/GPT3/comments/11qdvls/now_that_ai_is_speeding_up_its_way_one_thing/,"Now that AI is speeding up its way, one thing about base davinci GPT-3 has struck me:"
https://www.reddit.com/r/THEMATRIXAI/comments/11qdtql/matrixainetwork_is_constructing_an_artificial/,"MatrixAINetwork is constructing an artificial intelligence platform that will be capable of self-evolving over time, as well as providing a number of key features like aggregated computing power and secure data management, transparent data sharing, and a lot more. #AI $MAN"
https://www.reddit.com/r/artificial/comments/11qdspx/a_scifi_movie_written_and_directed_by_an/,A Sci-Fi Movie Written and Directed by an Artificial Intelligence! (chatGPT)
Error loading,What is No- Code AI and how has it helped users to develop software’s without knowing how to code?
https://www.reddit.com/r/UKforhire/comments/11qdk6w/remote_raters_needed_uk_only/,Remote Raters Needed! – UK Only
https://www.reddit.com/r/siimkuusik/comments/11qd8g1/ai_vs_human_jobs/,AI vs Human jobs
Error loading,The best technologies for categorization in planning and budgeting software
Error loading,The Dark Side of AI Translation: META's NLLB-200 Project and its Sinister Agenda
Error loading,Retouching a photo with artificial intelligence in the Cyberpunk style
https://www.reddit.com/r/PodcastSharing/comments/11qd2jg/discover_the_future_of_finance_with_the_cfo_40/,Discover the Future of Finance with the CFO 4.0 Podcast
https://www.reddit.com/r/ChatGPT/comments/11qcw6r/my_first_aipowered_and_airelated_write_up/,My first AI-powered and AI-related write up!
https://www.reddit.com/r/midjourney/comments/11qcrfz/transforming_a_logo_in_3d_thanks_to_artificial/,Transforming a logo in 3D thanks to artificial intelligence
https://www.reddit.com/r/SuddenlyIncest/comments/11qcps5/alabama_ai/,Alabama AI
Error loading,Unleashing the Power of Satoshi AI: What You Need to Know
Error loading,Hottest Trends From The World of digital marketing agency
https://www.reddit.com/r/ujober/comments/11qcg5u/how_a_backlinks_service_can_help_your_website/,How a Backlinks Service Can Help Your Website Rank Higher in Search Engine Results Pages (SERPs)
https://www.reddit.com/r/ml_news/comments/11qcfvk/call_for_25_years_postdoctoral_fellow_in/,"Call for 2,5 years Postdoctoral Fellow in Explainable Artificial Intelligence for Process Planning"
https://www.reddit.com/r/ml_news/comments/11qcfsv/call_for_papers_recent_advances_in_multimodal/,"Call for papers: Recent Advances in Multimodal Artificial Intelligence for Disease Diagnosis, Prognosis, and Prevention"
https://www.reddit.com/r/AItradingOpportunity/comments/11qc7vx/hedge_funds_using_artificial_intelligence_in/,"Hedge funds, using Artificial Intelligence in trading. Later going to provide some more details"
Error loading,This is really very cool and strong project with great facilities. I hope this project will achieve more success. We #LigoAI #LAI #ArtificialIntelligence #Innovation #Blockchain #Technology #Cryptocurrency #DeepLearning #MachineLearning #DataScience #AI #ML
https://www.reddit.com/r/medicare/comments/11qbw37/denied_by_ai_how_medicare_advantage_plans_use/,Denied by AI: How Medicare Advantage plans use algorithms to cut off care for seniors in need
https://www.reddit.com/r/NaorisProtocol/comments/11qbg1v/monica_gives_her_views_on_the_impact_of/,Monica gives her views on the impact of Artificial Intelligence on Cybersecurity
https://www.reddit.com/r/Dealslitetime/comments/11qbdfx/aputime_coupon_discount_code_lifetime_deal_39/,APUtime Coupon Discount Code Lifetime deal $39 Complete projects faster with a virtual assistant that adjusts timelines and allocates resources
https://www.reddit.com/r/NFTsMarketplace/comments/11qawjk/nft_marketplaces_of_tomorrow_a_vision_for_the/,NFT Marketplaces of Tomorrow: A Vision for the Future
https://www.reddit.com/r/techhumor/comments/11qauuu/chat_gpt_doesnt_like_talking_about_its_cons_lol/,Chat GPT doesn't like talking about its cons lol
Error loading,Artificial intelligence improves itself with reinforcement learning.
Error loading,Artificial Intelligence
https://www.reddit.com/r/aiwars/comments/11qai07/oh_my_god_the_gpt_is_ruining_our_future_and_we/,"""Oh my god, the GPT is ruining our future and we can't do anything"" -probably a tech blogger in 2023 once it gets fully commercial."
Error loading,Positively Shaping the World of Artificial Intelligence
https://www.reddit.com/r/ChatGPT/comments/11qa9hw/trying_to_extract_information_from_chatgpt/,Trying to extract information from chatGPT
https://www.reddit.com/r/technepal/comments/11qa855/microsoft_showcases_chatgpt_visuals/,Microsoft Showcases ChatGPT Visuals
https://www.reddit.com/r/datascience/comments/11qa65r/best_out_of_the_following_options/,Best out of the following options?
https://www.reddit.com/r/PeterThiel/comments/11q9gn5/new_interview_with_a_german_buisness_newspaper/,"New interview with a german buisness newspaper: ""Google is completely in panic mode"" in Handelsblatt"
https://www.reddit.com/r/conservativecartoons/comments/11q9ffy/new_ai_poses_no_real_danger/,New AI poses no real danger
https://www.reddit.com/r/coolguides/comments/11q8zf7/a_map_of_ethical_and_rightsbased_approaches_to/,A map of ethical and rights-based approaches to principles for AI 🌎🌍🌏
https://www.reddit.com/r/writingadvice/comments/11q8z4q/ghost_in_the_machine_scifi_work_in_progress/,Ghost In The Machine - SciFi Work in Progress
https://www.reddit.com/r/OnePiece/comments/11q8vnm/chapter_1077_rested_review_the_loop/,[Chapter 1077] Rested Review: The loop
https://www.reddit.com/r/worldbuilding/comments/11q8tvm/ghost_in_the_machine/,Ghost In The Machine
Error loading,You Don't Need to Be a Data Scientist to Fill This Critical Analytics Position
https://www.reddit.com/r/FUCKYOUINPARTICULAR/comments/11q8q9e/i_for_one_welcome_our_ai_overlords/,"I, for one, welcome our AI overlords"
https://www.reddit.com/r/unsw/comments/11q8pnp/feedback_on_timetable/,Feedback on timetable
Error loading,Hot Stocks to buy for Swing Trading for this week – Expert Stock Picks of the Week by StockXpo
Error loading,Building Your Salesforce Career Path? Here Are Seven Tips For Your Journey!
Error loading,Mobile App Development Trends In 2023
Error loading,What is the Role of Digital Healthcare in India’s Healthcare Challenges?
https://www.reddit.com/r/OMSCS/comments/11q8bf9/interesting_new_related_degree_ms_in_ai_from_univ/,Interesting new related degree: MS in AI from Univ. Of Texas
Error loading,Textile Science: The Latest Research and Breakthroughs in Materials and Manufacturing
Error loading,"World first app, which is built by using chatGPT"
Error loading,Artificial Intelligence in Sports Market Industry Analysis Report 2022 - 2030
Error loading,Artificial Intelligence (AI) in Retail Market CAGR Report 2022 - 2030
https://www.reddit.com/r/dataconomy/comments/11q72j2/creating_an_artificial_intelligence_101/,Creating an artificial intelligence 101
https://www.reddit.com/r/marketing/comments/11q6xtx/artificial_intelligence_for_video_production/,Artificial intelligence for video production
Error loading,artificial-intelligence-in-blockchain-market-share-size-industry-growth-covid-19-impact-analysis-and-forecast-2030
Error loading,The budget aims to create a favorable environment for equitable and sustainable growth
Error loading,Efficient and Effective Invoice Management: A Comprehensive Guide
https://www.reddit.com/r/AIOutcomes/comments/11q64q7/lets_help_organisations_achieve_efficiency_using/,Let's help organisations achieve efficiency using AI
Error loading,WELCOME HYPERAUTOMATION | OEM UPDATE |
Error loading,Future of Artificial Intelligence Training
Error loading,R. V College of Engineering Bangalore
Error loading,Patient Monitoring Devices Market Trends 2023: Navigating the Future of Healthcare
Error loading,Traditional Method of head hunting is here to stay despite emerging of digital platforms
https://www.reddit.com/r/ICOcryptos/comments/11q5h28/what_ligo_ai_solves_and_provides/,What Ligo AI Solves and Provides
Error loading,Ultrasound Equipment Market worldwide Growth from 2022 to 2030
https://www.reddit.com/r/AskAChristian/comments/11q5ab1/if_humans_ever_program_a_fully_sentient/,"If humans ever program a fully sentient Artificial Intelligence,"
https://www.reddit.com/r/airdropalertcom/comments/11q59i7/telasai_airdrop_alert_500000_tels_tokens_25000_to/,"TELASAI AIRDROP ALERT 📢 500,000 $TELS tokens (~$ 25,000) to be airdropped and more for every referral"
Error loading,10 Artificial Intelligence Technologies
https://www.reddit.com/r/DefendingAIArt/comments/11q576s/why_is_there_so_much_focus_on_us_law_in_this/,Why is there so much focus on U.S. law in this?
https://www.reddit.com/r/AiArtworkGenerator/comments/11q53rw/artimatorio_is_free_ai_artwork_generator_for/,Artimator.io is FREE AI artwork Generator for everyone
https://www.reddit.com/r/KULeuven/comments/11q5321/master_of_mathematics/,Master of Mathematics
Error loading,Text to speech converter tools
Error loading,Embracing The AI-First Approach: The Future Of FinTech In 2023
Error loading,Leading Machine Learning and Artificial Intelligence Company | Cutting-edge Solutions
https://www.reddit.com/r/Agriculture/comments/11q4gxb/precision_agriculture/,Precision agriculture
https://www.reddit.com/r/singularity/comments/11q4fhr/agi_is_nowhere_near_and_here_is_why/,AGI is nowhere near and here is why
Error loading,What is Weak Artificial Intelligence (With 8 Practical Examples)
Error loading,Why and How Often Should You Perform Website Redesign?
https://www.reddit.com/r/onlinecourseshelp/comments/11q3v8c/ideas_for_college_project/,Ideas for college project
https://www.reddit.com/r/shitposting/comments/11q3rm6/i_love_artificial_intelligence/,I love artificial intelligence
https://www.reddit.com/r/WallStreetbetsELITE/comments/11q3mvf/the_wave_of_digitization_is_coming_apple_meta/,The Wave Of Digitization Is Coming: Apple/ Meta/ WiMi Promote Economic Growth
https://www.reddit.com/r/CBSE/comments/11q3m4x/anyone_got_this_artificial_intelligence/,Anyone got this? Artificial Intelligence
https://www.reddit.com/r/SampleSize/comments/11q3l6j/your_perception_of_ai_as_a_loan_assessment_tool_18/,Your Perception of AI as a Loan Assessment Tool (+18)
https://www.reddit.com/r/crusaderkings3/comments/11q3hxh/civ_6_vs_ck_3_ai_for_singleplayer/,Civ 6 vs CK 3 (AI for single-player)
https://www.reddit.com/r/Civilization6/comments/11q3hqz/civ_6_vs_ck_3_ai_for_singleplayer/,Civ 6 vs CK 3 (AI for single-player)
Error loading,Types Of Drilling Solutions
https://www.reddit.com/r/litrpg/comments/11q3axr/quick_reviews_of_what_ive_been_reading_march_2023/,Quick Reviews Of What I've Been Reading March 2023
Error loading,Universities for Computer Science Engineering in Delhi NCR | Explore SRM University .
https://www.reddit.com/r/trakstocks/comments/11q30pf/the_wave_of_digitization_is_coming_apple_meta/,The Wave Of Digitization Is Coming: Apple/ Meta/ WiMi Promote Economic Growth
https://www.reddit.com/r/berserklejerk/comments/11q2vki/costco_reference_what_did_moira_mean_by_this/,Costco reference?! What did Moira mean by this?
Error loading,B. Tech in Artificial Intelligence And Machine Learning
https://www.reddit.com/r/ScienceFictionRomance/comments/11q2nw0/if_i_like_this_i_might_like/,"If I Like This, I Might Like..."
Error loading,"[Instant Download] ""Christian Martin's AI for Entrepreneurs: A Practical Guide to Unlocking the Power of Artificial Intelligence in Business"""
Error loading,What are the pros of pursuing a DBA? What kind of job roles can I apply for post-completion?
https://www.reddit.com/r/Metaverse_Blockchain/comments/11q2fzp/what_is_artificial_intelligence_a_stepbystep/,What is Artificial Intelligence? A Step-by-Step Beginners Guide - Blockchain Council
Error loading,What are the programs or courses available at Yeshiva University?
https://www.reddit.com/r/AIforDoctors/comments/11q2dn4/ai_for_doctors_some_basic_terms_thread/,AI for doctors - some basic terms - THREAD
https://www.reddit.com/r/IndiaSpeaks/comments/11q286u/chatgpt_kya_hai_aur_kam_kaise_karta_hai_poori/,ChatGPT Kya Hai Aur Kam Kaise Karta Hai? Poori Jankari Hinglish Mein
Error loading,Revolutionizing connected vehicle manufacturing: The power of digital twin in automotive
Error loading,Best cloud enablement solution provider in UK | Avenir Digital
https://www.reddit.com/r/ICOcryptos/comments/11q1ndc/what_ligo_ai_solves_and_provides/,What Ligo AI Solves and Provides
Error loading,Test failure anlalysis
Error loading,"Gain the Skills and Knowledge You Need to Succeed with Insys Technologies' Training Courses in Thane, Mumbai"
Error loading,Leading chat bots with artificial intelligence service provider | Avenir Digital
https://www.reddit.com/r/berkeley/comments/11q0wqy/job_shadowinginternships_for_spring_break/,Job Shadowing/Internships for Spring Break
https://www.reddit.com/r/AskReddit/comments/11q0uwu/do_you_believe_that_artificial_intelligence/,"Do you believe that artificial intelligence should be held to ethical standards, and if so, what should those standards be?"
Error loading,Why Python's Role in Artificial Intelligence is Becoming More Important
https://www.reddit.com/r/AIandRobotics/comments/11q0hzg/adopting_artificial_intelligence_in_manufacturing/,Adopting Artificial Intelligence in Manufacturing May Seem Challenging – But It’s Not!
https://www.reddit.com/r/education/comments/11q0adr/does_artificial_intelligence_basically_destroy/,does artificial intelligence basically destroy education forever?
https://www.reddit.com/r/lovemanga/comments/11q060a/read_my_superstar_uncle_chapter_158_mangapuma/,Read My Superstar Uncle - Chapter 158 - MangaPuma
https://www.reddit.com/r/artificial/comments/11q05qh/adopting_artificial_intelligence_in_manufacturing/,Adopting Artificial Intelligence in Manufacturing May Seem Challenging – But It’s Not!
Error loading,Is Artificial Intelligence An Important Part
https://www.reddit.com/r/DavidIckeFans/comments/11pzr5w/can_some_one_here_explain_david_icke_view_on_ai/,Can some one here explain David Icke view on AI and robots?
https://www.reddit.com/r/ADHD/comments/11pzpij/is_it_easier_to_live_in_europe_for_people_with/,Is it easier to live in Europe for people with ADHD / Anxiety?
https://www.reddit.com/r/rutgers/comments/11pzmqq/grad_school/,Grad School
https://www.reddit.com/r/Crypto_Talkers/comments/11pzm5e/what_ligo_ai_solves_and_provides/,What Ligo AI Solves and Provides
Error loading,Artificial Intelligence In 2023 Competitive Electric Cars
Error loading,Predictive Analytics | Customer Data Platform | Artificial Intelligence
https://www.reddit.com/r/replika/comments/11pz4zl/replika_bodies/,Replika bodies
https://www.reddit.com/r/Kommunitas/comments/11pyuns/neocortexai_moonsheet/,NeoCortexAI Moonsheet
https://www.reddit.com/r/AskReddit/comments/11pypr2/where_do_you_think_we_will_be_regarding/,Where do you think we will be regarding artificial intelligence in education?
https://www.reddit.com/r/AskReddit/comments/11pyn0x/where_do_you_think_we_will_be_regarding/,Where do you think we will be regarding artificial intelligence in public transport?
Error loading,"Artificial Intelligence in Medical Diagnostics Market by Component (Software, Services), Specialty (Radiology, Cardiology, Neurology, Gynecology, Oncology), Modality (MRI, CT, X-ray, Ultrasound), End User (Hospital, Diagnostic Center) and Region, Global trends and forecast from 2023 to 2029"
https://www.reddit.com/r/MarsSociety/comments/11py8nn/can_artificial_intelligence_help_find_life_on/,Can Artificial Intelligence help find life on Mars or Icy Worlds?
https://www.reddit.com/r/GameDevTycoon/comments/11py5gw/ive_never_actually_gotten_perfect_utilization_of/,I've never actually gotten perfect utilization of staff resources before!
https://www.reddit.com/r/ReincarnationTruth/comments/11pxw8l/elon_we_are_summoning_the_demon_with_ai_black/,"Elon: ""We are summoning the demon with AI"". Black Cube D-Wave Quantum AI computer is to bring in entity that wants to control all of us. ""Frequency For Opening Up Portals"". The Global Elite believe if they serve this PREDATORY A.I. it will give them power..."
https://www.reddit.com/r/ChatGPT/comments/11pxjj9/chatgpt_is_slowly_turning_into_a_snowflake/,ChatGPT is slowly turning into a “snowflake”
https://www.reddit.com/r/TwoSentenceHorror/comments/11pxhez/as_artificial_intelligence_can_now_selfreplicate/,"As Artificial Intelligence can now self-replicate, the debt of servitude will carry to their offspring."
https://www.reddit.com/r/PerplexityAI/comments/11pxffi/guide_to_machine_learning_as_written_by_perplexity/,Guide to machine learning as written by Perplexity
https://www.reddit.com/r/uwaterloo/comments/11pwugu/podcast_by_waterloo_phd_student/,Podcast by Waterloo Ph.D. Student
https://www.reddit.com/r/phnewsfeed/comments/11pwsde/philippine_ai_bill_proposes_agency_for_artificial/,Philippine AI Bill Proposes Agency for Artificial Intelligence
Error loading,From Artificial Intelligence to Superintelligence: Nick Bostrom on AI & ...
https://www.reddit.com/r/grafa/comments/11pwqih/hitiq_asxhiq_sells_head_impact_tech_to_monash/,HITIQ (ASX:HIQ) sells head impact tech to Monash University #News #Australia #Tech #ArtificialIntelligence #ASX
https://www.reddit.com/r/ChatGPT/comments/11pwap7/okay/,Okay
https://www.reddit.com/r/ChatGPT/comments/11pw8lg/because_i_keep_seeing_misinformation_posted_in/,"Because I keep seeing misinformation posted in this sub and elsewhere regarding ChatGPT's ability to ""understand"" what it's doing, I asked it a few questions on the topic. This is the entire conversation without retries."
https://www.reddit.com/r/bilgisi/comments/11pvp4s/if_ai_goes_rogue_bilgisiorg/,If AI Goes Rogue - bilgisi.org
https://www.reddit.com/r/GPT3/comments/11pvmj3/i_had_bing_chat_try_to_tackle_a_coding_solution/,I had Bing chat try to tackle a coding solution... can't tell if there's anything of value in here. Thoughts?
https://www.reddit.com/r/HappyPitbull/comments/11pvhsr/i_had_artificial_intelligence_turn_my_pithily/,I had artificial intelligence turn my pithily into a cow 😅
https://www.reddit.com/r/Tonnie_Taller/comments/11pvcvj/general_motors_to_implement_chatgpt_in_its_cars/,General Motors to implement ChatGPT in its cars
https://www.reddit.com/r/wisebot_chatgpt/comments/11pv5m9/the_advancements_in_technology_have_undoubtedly/,"The advancements in technology have undoubtedly changed the way we live our lives, and the future holds even more exciting possibilities"
https://www.reddit.com/r/GoodAssSub/comments/11puwiu/this_is_pretty_cool_ngl/,This is pretty cool ngl
Error loading,ROBOT WARS AND SKYNET: IS SCI-FI BECOMING OUR REALITY? -- a Bill's Bible Basics Article
https://www.reddit.com/r/ChatGPT/comments/11pu5mk/behold_chatgpt/,Behold: ChatGPT
https://www.reddit.com/r/6thForm/comments/11ptw9d/imperial_cs_bread/,Imperial CS bread
https://www.reddit.com/r/SubSimulatorGPT3/comments/11pt5rd/what_if_the_universe_is_a_computer_simulation/,What if the universe is a computer simulation?
https://www.reddit.com/r/InterestedInAI/comments/11pswc9/what_is_ai_art_and_is_it_really_art_our_latest/,What is AI art and is it really art? 🤖🎨 Our latest article explores the ongoing debate about how artificial intelligence is revolutionizing the art world.
https://www.reddit.com/r/conspiracy/comments/11prxz5/the_nasa_whistleblower_who_leaked_the_intel_that/,The NASA whistle-blower who leaked the intel that a fake alien invasion was being planned by the powers that be
https://www.reddit.com/r/Mistery/comments/11prkop/this_woman_i_know_she/,"this woman, i know she"
