Username,Date,Post,Post sentiment,Post subjectivity,Comments,Reactions,Reposts
Signify Research Ltd,15-03-2023,"Did you know the combined estimate for the CT and MRI markets reached $10.7 billion in 2021? Our market analysis reports outline market risks and opportunities, allowing you to make data driven strategic decisions for your business.We are inviting all CT and MRI stakeholders to take advantage of the opportunity to customise the scope of our research, tailoring it to your specific business needs.If you purchase the 2023 report(s) before the deadline of 1st of April, 2023 you will not only be able to customise the scope of research but will also benefit from:✔️ 15% discount on the standard publication price✔️ Customise the scope of the research to meet your specific needs✔️ Early access to preliminary market data and opportunity to provide feedback✔️ Immediate access to the final report✔️ Your company included in expert research content and how you fit within the overall market✔️ Extended access to the expert Analyst (both during and after the publication of the report)Contact theBhvita JaniorMatthew Watsonto find out more or visithttps://lnkd.in/eTJbUTraorhttps://lnkd.in/eh7D6rPi#medicalimaging#mri#ctscanner",0.9377,0.4074999999999999,0,5,0
Rob Hollinger,15-03-2023,Strong people don’t put others down. They lift them up.-Michael WatsonSDG#Equanimity,0.5106,0.5111111111111111,0,0,0
Louise Morby,15-03-2023,"So good to chat with our employers panel this morning as part of our curriculum review. The input as always was incredibly insightful and useful. Bonus smiles for the fact that some members of our employers panel are Sport Development alumni! Shout out to them and long may these discussions continue outside of the curriculum review!Tom Pedersen-SmithKayleigh SaundersRekha DeyIan GrayOlivia Laikerdavid watsonBen FraserAnna ShielsHelen Hiley (MCIMSPA)Jodie BridgerHere’s to further developing our student focussed course that delivers high levels of personal development, skills for employability and critical thinking#development#personaldevelopment#sportfordevelopment#sportmanagement#leadership#degrees",0.905,0.4544444444444444,2 ,10,0
Family First Life Tri-State,15-03-2023,"Join us on Monday, March 20th at 6PM! Whether you're a licensed agent, or just interested in learning about the Life Insurance Industry, you won't want to miss this Business Overview Meeting! Kyle Watson and Johna Palladino of Family First Life Transcendence will deliver a detailed business overview presentation and discuss the benefits of joining the industry!Visit the link below to reserve your seat and come see what Family First Life is all about!https://lnkd.in/eGHfJpJm#LifeInsurance#lifeinsuranceagent#lifeinsurancecourses#lifeinsuranceagents#lifeinsuranceinsights#business#meeting#lifeinsuranceisloveinsurance#insuranceindustry#familyfirstlife#ffl#tristate",0.8355,0.3833333333333333,0,3,0
5 Star & Co,15-03-2023,DAZN appoints Marc Watson as CFOhttps://lnkd.in/ekwedsEA,0.0,0.0,0,0,0
Chartered Institute of Information Security,15-03-2023,"Meet our speakers for our upcoming CIISec Masterclass ‘Educating the next generation of Cyber Security Professionals'. Benoit Heynderickx and Ivo Goncalves who both work within ISF, Benoit is a Principal Analyst within the Tools and Methodologies team at the ISF and joined in 2017. Ivo is the Global account manager with the Account Management team providing support and reporting capabilities to ISF Members and ISF Management.Kevin Streater is an expert in IT & Cyber Security skills development with over 20 years’ experience as a specialist in competency assessment, digital credentialing, and educational technology, as well as standing on the CIISec Board of Directors. Kevin will also be joined by Katie Watson, Development Lead for CIISec.To register, head over to –http://ow.ly/UnAt50N60t5",0.8225,0.0625,0,4,2 
Loughborough University Science and Enterprise Park,15-03-2023,Every year we are delighted to welcome a new cohort of graduate start ups toLUinc.Loughborough University's incubator on LUSEP.The Studio is an excellent initiative that supports talented entrepreneurial graduates to build new businesses and create new jobs in the region.Midlands InnovationMidlands EngineDr Nik Kotecha OBE DLAndy Reed OBESue TilleyOliver WhittakerMike DenbyChristopher GracePaul WatsonJen FensomeNick GostickPete HitchingsRobert MitchellJonathan JacksonJanette PallasMonalie BandulasenaZoe Marshall-JonesKathryn BurchellDan ParsonsCatherine LouchSarah HelmoreRoshna Mistry,0.9509,0.6948051948051948,0,2,0
Watsons Property,15-03-2023,"🗨️ Surveyor Spotlight!Seeta Allen AssocRICS, Valuation Surveyor and Registered Valuer👏 Seeta joined Watsons in October 2022 as a Valuation Surveyor & Registered Valuer.Living in Rushden, Northamptonshire, Seeta undertakes various valuations and RICS Home Surveys Levels 1 & 2 for clients in and around#Northampton,#MiltonKeynesand#Bedford. 🏡#teamwatsons#surveyor#survey#northamptonshire#valuation#property#RICS",0.0,0.5,0,6,0
Tam Ta,15-03-2023,Got questions about#VeeamBackup for Microsoft 365 v7? We’ve got answers! 🙋 Mark your calendars 🗓️ for March 29th for an exclusive#AMA💬 on Twitter with expert Edward Watson on March 29th. Use#AskVeeamto submit your questions early on Twitter!,0.0,0.3,0,2,0
Caroline Ritter,15-03-2023,"This semester, I had the opportunity to complete a real-life consulting project forCyrklalong with 31 otherCameron School of Business at UNC Wilmingtonstudents.My colleagues and I spent the past three months developing a market entry strategy forCyrklto enter Mexico, Central, and South America. We then travelled to Prague to present our project where I was honored to present our PEST, SWOT, and Competitive Benchmark toCyril Klepek,Samuel Štric, andPhilip KorinekWorking with my team and professorsMark PelletierandEthan WatsonI gained valuable professional skills and development. I was able to understand the importance of team work and collaboration.This was an amazing experience and I am so grateful to have been selected to participate and represent my teams hard work. Thank you toPavlína DvorskáandDavid Dvorskýfor their continued support of college students and allowing us this opportunity.",0.983,0.3166666666666666,3 ,12,0
The Housing Finance Corp. Ltd.,15-03-2023,"The THFC team are in Liverpool for theNational Housing FederationHousing Finance Conference!Day 1 has gotten off to a brilliant start, with engaging sessions and plenty of catching up with friends and colleagues.Fenella Edge,Arun Poobalasingam,Will S.,Colin Burke,Gavin Richards,Alexander Bowden,Melissa G.,Max Watson,Sharon Woodward (FCA),Brendan Whitworth,Jack Bush, andDanielle Hughesare all in attendance, so feel free to say hello and catch up.#housing#finance",0.9212,0.8500000000000001,0,7,0
elKaam.Com,15-03-2023,"Shout out to all#dataanalyticsacross UAE!#hiringnowfor#datanalyticsfor one of the largest companies in UAE.#Role: Data Analytics Consultant#Location: Abu Dhabi, United Arab Emirates.#Job_Description:Knowledge & Skills* - Experience in working with most of the following IBM or competitive tools: IBM Infosphere Information Server, Infosphere Data Replication, Watson Knowledge Catalog, Cognos Analytics (BI), Planning Analytics (TM1), SPSS, and Watson Studio.* - End-to-end experience in Data Warehouse and Analytics solutions implementation from the understanding and discovery of data sources to data transformation, data cleansing & data governance, data warehouse modeling, to building reports, dashboards, and predictive models.* - Experience with Machine Learning / R / python / IBM Data Science experience is a plus.* - Experience with Master Data Management is a plus.Education & Experience Required:* - Bachelor’s degree in computer science or computer Engineering* - Typically, 5-8 years of experience in implementation or technical consulting role Cross Industry technical and/or solution experience.* - Experience in working with IBM Cloud Pak for Data and Big Data tools (Hadoop, Spark) is a must.* - Experience in working with Cloud and Hybrid solutions.#datanalytics#dataanalysis#dataanalysts#python#machinelearning#ibmcloudpak#ibmcloud#datawarehouse#ibm#datascience#hadoop#spark#implementation#watsonstudio#uaejobs#abudhabijobs#hiring#immediateopening#consultant#infosphere#datagovernancePlease get in touch with me (mohamed.sherif@resourceright.me) for further discussion.",0.7777,0.2375,0,1,0
Carrie Beers,15-03-2023,"#WomensHistoryMonth“I’m willing to be seen. I’m willing to speak up. I’m willing to keep going. I’m willing to listen to what others have to say. I’m willing to go to bed each night at peace with myself. I’m willing to be my biggest bestest most powerful self.” ~Emma WatsonWomen Leadership Inspiration for Today – Complete this sentence “I’m willing to……., then go out and DO IT!Today we celebrate a woman still making history. Happy Women’s History Month! Emma Watson is an actress and activist who has been a UN Women Goodwill Ambassador since 2014. She has been an outspoken advocate for women's rights and gender equality.Yes, that's correct! Emma Watson has been actively involved in promoting women's rights and gender equality through her work as a UN Women Goodwill Ambassador. Some of her notable accomplishments in this area include:1. Launching the HeForShe campaign: In 2014, Emma Watson launched the HeForShe campaign, which aims to engage men and boys in the fight for gender equality. The campaign has received support from thousands of people around the world.2. Addressing the UN General Assembly: In 2016, Emma Watson delivered a powerful speech at the UN General Assembly calling for gender equality and encouraging men to take an active role in achieving it.3. Promoting sustainable fashion: Emma Watson has also been a vocal advocate for sustainable fashion and has worked to promote ethical and sustainable clothing brands.4. Supporting girls' education: Emma Watson has been a strong advocate for girls' education and has worked to support initiatives that provide education to girls in underprivileged communities.5. Advocating for pay equity: Emma Watson has also been a vocal advocate for pay equity and has spoken out about the gender pay gap in the entertainment industry.Overall, Emma Watson has used her platform as a UN Women Goodwill Ambassador to raise awareness about important issues related to gender equality and women's rights and has inspired many people to get involved in the fight for a more equal and just world.#LEADERSHIP#coachprinciples#bebold#change#equality#awareness#emmawatson#success",0.9948,0.6433333333333333,0,0,0
Daniel Joseph,15-03-2023,Thank you for sharingPaulette Watson MBA Global Tech Disruptor#diversityandinclusion,0.3612,0.0,1 ,2,0
Make UK Defence,15-03-2023,"Ahead of today’s Spring Budget and following the measures announced in the Integrated Review Refresh,Make UK DefenceDirector-GeneralAndrew Kinniburghhas made the following comment:“Make UK Defence welcome the much needed increase in defence spending in today’s budget. Well done to Rt Hon Ben Wallace MP and Alex Chalk MP for securing funding at a critical juncture. We welcome as well the commitment to spending of 2.5% of GDP on defence going forward. With paradigm shifting international programmes such as the AUKUS submarine deal and the Global Combat Air Programme, ambitious and rigorous investments in future capabilities are a necessity. The war in Ukraine has changed the world, and the UK must be pro-active in facing threats.And yet, whilst this is a good step forward, there is yet more to do. Our army’s equipment lags behind many of our NATO allies. The threats since the original iteration of the Integrated Review have dramatically increased. Greater, bolder commitments are needed to deliver the support our armed forces need.”https://lnkd.in/ePWYnVYE#ukmanufacturing#ukmfg#springbudgetJames WatsonKelly MaddisonSamantha HillEstelle ExelbyMaria WinsperCharline DiomandeJames V.",0.9578,0.4661764705882353,0,11,1 
John Marchisotto,15-03-2023,"Empowering the Fight for Justice: A Retired NYPD Sergeant's Quest for FairnessJoin the cause:  💥Every voice deserves to be heard, and every fight for justice requires the support of a community. Today, I humbly ask for your help in a mission that is close to my heart. ❤️As a retired NYPD Sergeant, I have dedicated my life to upholding the law and advocating for the truth.Now, I am on a journey to bring my second case beforeThe Supreme Court of the United States, where I hope to secure justice for all those who have faced similar challenges.Achieving justice in my case will pave the way for countless others across the United States who face similar struggles. Together, we can create a brighter, fairer future for all. 🇺🇸The road to justice is a long and winding one, filled with financial hurdles that can be overwhelming.Legal fees, court costs, and other expenses have piled up, and I need your support to help me cross the finish line.The Supreme Court's strict requirements have created an additional burden. For instance, printing and typesetting the necessary 40 booklets amounts to nearly $2,000, an expense that cannot be shouldered alone.But with your support, we can make a difference. Every donation, no matter how small, brings us one step closer to realizing our goal.And if you cannot contribute financially, simply sharing our story with your network can have a profound impact.Your generosity and solidarity in this fight for justice will be a beacon of hope and a testament to the power of community.Together, we can make the world a more just and equitable place.Thank you, and may God bless you for your kindness.🌟 Support our Fundraiser for Justice through PayPal: Can you help Retired NYPD Sergeant Fundraiser For Justice on PayPal Fundraisers? Every little bit helps!https://lnkd.in/e5sduvUp🌟To learn more about my second case and the journey ahead, please visit:https://lnkd.in/ey-B4FPk#community#thankyou#legal#future#help#network#power#law#supremecourt#printing#kindness#scotus#ussupremecourt#supremecourtjustice#justice#difference#republican#american#patriot#firstresponder#law#legal#leadership#usa#FightForJustice#veteran#JusticeForAll#socialjustice#EqualRights#helpingothers#NoJusticeNoPeace#StandUp4Justice#JusticeMatters#change#HumanRights#EqualityNow#bethechangeElizabeth PrelogarYaira DubinDanny BickellTara HelfmanSheridan Watson Julie A. Braun, J.D. LL.M.Alejandra AguilarOlivia VejcikBurden WalkerJames Dennehy",0.9972,0.4170068027210883,2 ,0,2 
Letícia Tainara Souza,15-03-2023,"Hey, LinkedIners! Analisando as plataformas digitais, comportamento do consumidor, histórico de tendências e evoluções, aqui vão algumas das tendências de marketing para 2023:🤳🏻 Marketing de influência: o marketing de influência chegou pra ficar e continuará a crescer! Com mais marcas colaborando com influenciadores e criadores de conteúdo para alcançar públicos específicos (Ó a base da Virginia aí, gente! Ela vendeu 150 mil unidades em um fim de semana mesmo com os haters).🎁 Personalização: os consumidores continuam desejando uma experiência personalizada e relevante, e as empresas estão investindo cada vez mais em tecnologia e estratégias para atender a essa demanda.📼 Vídeo marketing: o vídeo continua sendo uma das formas mais populares e eficazes de marketing, e as empresas devem continuar a investir em produção de vídeo de alta qualidade para atrair e engajar os consumidores (Quer engajar? Então investe nisso. A era dos estáticos morreu).🔊 Voice marketing: com o crescente uso de assistentes virtuais como Siri, Alexa e Google Assistant, muitas empresas e marcas estão começando a adotar estratégias de marketing por voz para se comunicar com os consumidores de maneira mais eficaz (aqui entra a personalização também).📩 Marketing de conteúdo: este continuará a desempenhando um papel importante na construção de marcas e no envolvimento com os consumidores. As empresas precisarão investir em conteúdo de alta qualidade e em estratégias de distribuição para se destacar em um mercado cada vez mais competitivo.🎯 Marketing omnichannel: os consumidores esperam uma experiência perfeita e consistente em todos os canais de marketing, e as empresas precisam se adaptar a essa demanda, criando estratégias de marketing omnichannel integradas. O seu consumidor está em todos os canais e é inteligente pensar em estratégias adaptadas em cada um deles.🎲 Marketing baseado em dados: as empresas estão cada vez mais usando dados para entender e se comunicar com os consumidores de maneira mais eficaz. As empresas devem continuar a investir em tecnologia e estratégias de análise de dados para obter insights mais precisos e informados sobre seus clientes (segura os prints).🤖BÔNUS TRACK: Uso de AI em estratégias e materiais publicitários também é algo que não tem volta - e que bom! Se você é um profissional da área, sugiro começar a integrar programas como MidJourney, ChatGpt, IBM Watson, Salesforce Einstein, Amazon Rekognition, DeepCrawl, Wibbitz e entre outros nas suas campanhas, estratégias e tomadas de decisão. Pois como diz a famosa música de fim de ano de uma emissora de TV por aí, ""hoje é um novo dia, de um novo tempo que começou. Todos os nossos sonhos, serão verdade e o futuro já começou"".#marketing#tecnologia#amazon#empresas#salesforce#marketingsensorial#marketing2023#marketingderelacionamento",-0.3956,1.0,3 ,6,0
Cheryl T.,15-03-2023,The news is out! Willis Watson Is a Wannabe by Carmen Bogan and Illustrated by me will be released Spring 2024. It will published by Denene Millner Books andSimon & Schuster. So excited.#picturebooks#kidlit,0.0,0.0,0,0,0
