Username,Date,Post,Post sentiment,Post subjectivity,Comments,Reactions,Reposts
"Shannon ""Sope"" Watson",15-03-2023,"This is a Snippet  of   1st day of the Meac 2023 Tournament  Game 2 Men's Bball  University of Maryland Eastern Shore vs Morgan State with Jody.... working alongside my Hits  family Tyshawn, Source, Adelle, Lateef, Chantell, Jacques,  My L2 family Iggy from Texas, Steven of Seven Venues and the Ops Crew Ed, Ira, Tre and JT And many more ... 🤘 😎🤘#onenationonelove#teamvirgo#thestrugglemademe#teamfitness#Sope#fitcameraman#fitness#fitlifestyle#motivation#dmvnetwork#videographer#ihvideo#cameraman#indieheat#vegan#videowork#videolife#meac2023#cali#california#atlanta#newyork#meac#norfolkva#positivevibes#esi#centerstagevideoHttps://sope.le-vel.comHttp://YouTube.com/c/SopeWatson",0.3885,0.4666666666666666,0,0,0
Mercer Portugal,15-03-2023,"🗓️ O Simpósio de Investimentos da Mercer está de volta! Será a 7.ª edição e vai realizar-se no dia 14 de abril, no EPIC Sana Marquês Hotel.👉 À luz do ambiente económico e político, iremos debater as melhores estratégias para enfrentar a incerteza, refletindo sobre oportunidades e tendências futuras.👥 Junte-se aRodrigo Simões de Almeida, Nuno Silva,Rui Guerra,Charles de Lezardiere,Matthieu Mougeot, CAIAe aRupert Watsonpara conhecer os principais temas relativos a Private Markets e ESG.🔗 Inscreva-se aqui:-🗓️ Mercer’s Investment Symposium is back! To be held on April 14th, the 7th edition will take place at the EPIC Sana Marquês Hotel.👉 Looking to the economic and political environment, we will discuss the best strategies to face uncertainty, reflecting on opportunities and future trends.👥 JoinRodrigo Simões de Almeida, Nuno Silva,Rui Guerra,Charles de Lezardiere,Matthieu Mougeot, CAIAandRupert Watsonto learn about the main topics regarding Private Markets and ESG.🔗 Sign up here:https://bit.ly/3Lp94wE#Portugal#Investments#Event",0.3786,0.2608333333333333,0,1,0
Society of Petroleum Engineers Permian Basin - SPE PB,15-03-2023,"Join us for an enlightening symposium featuring exper speakers and thought-provoking discussions on cutting-edge topics in the field. Expand your knowledge, network with like-minded professionals, and gain valuable insights at this not-to-be-missed event!#permianbasin#permian#spe#production#spepb#productionmanagement#management#learning#conference#networking#professionaldevelopment#industryinsights#innovation#learningopportunitiesShivani VyasTaylor Montoya, P.E.Paul BrownMazaruny (Nuny) RinconesAndrea SwitzerRyan Yarger, P.E.Ryan Smith, P.E.James HaestSara BoothYogashri Pradhan, M.S., P.E.Eli Montoya, P.E.Gustavo GonzalezLibby EinhornJoe BrandenburgAkinfolami AkintunjiCathy HarrisRyan BhagwandassBrett KeitgesMatt WatsonBilly HarrisMatt LippmanJay YoungRitthy Son, P.E.Justin MoosVictoria KuzmichVincent Doczy",0.9273,0.35,0,3,0
UK News Group,15-03-2023,"Free employment law seminar available to allA free employment law seminar next week will help business owners navigate how to manage their workforce in 2023.The virtual seminar, at 10am on Wednesday 22 March, is an annual event run by Kettering-based HR consultancyBusiness HR Solutions (Consultancy) Limitedand looks at the upcoming developments and expected challenges in the world of HR.Click here to read more ->http://bit.ly/3ldiKjl->Sue Watson,Victoria Templeton->#HR#EmploymentLaw#Legal#Law#Webinar#Event#UKNewsGroup#EastMidlands#Northamptonshire",0.8834,0.4833333333333333,0,0,0
Josipa Brkic,15-03-2023,"A perspective is a specific way of looking at something. A psychological perspective is a specific approach to observing and understanding human behavior.All behavior, no matter how complex, can be reduced to a stimulus-response association. (Stimulus-any feature of the environment that affects behavior, a response-the behavior elicited by the stimulus).""Psychology as a behaviorist views it is a purely objective experimental branch of natural science. Its theoretical goal is … prediction and control” (Watson, 1913, p. 158).That being said, announces that any perspective can be altered, however, it is quite imperative (in order for the alteration to succeed in a quick manner) to understand why the behavior started in the first place. Like in this simple example, switching the perspective:#psychology#environment#behavioralmarketing#behaviour",0.7269,0.2533730158730159,0,0,0
Watson Realty Corp.,15-03-2023,We're happy to have so many talented professionals joining our team each month. Welcome to Watson!#WeAreWatson,0.8903,0.825,0,1,0
"Technicote, Inc.",15-03-2023,"We are looking forward to the upcoming theAWA Alexander Watson Associates2023 Global release Liner Exhibition and are proud to be part of the Beontag team — official sponsors of this year’s event. We'll be there to share all of the latest information regarding our wide portfolio, short lead times, and low MOQs. See you in Denver!",0.5411,0.4833333333333332,0,5,1 
Jordan Smart,15-03-2023,"Great be a headline partner at this yearsCold Chain FederationClimate Summit and Sustainability Awards.Zestec Renewable Energyis committed to supporting its members transition to a more sustainable buisness model. Thanks toWill Watson,Joanne MooreandLisa Rowbothamfor sharing their thoughts and expertise on Decarbonising Cold Storage.#renewableenergy#sustainable#coldstorage#coldchainlogistics",0.93,0.54,0,5,0
"Meica Alexandria Hatters, MHRM, MS, SHRM-CP, PHR",15-03-2023,"Orgs know that preparing leaders with the tools for growing their employees is essential. But, how many employers are thinking about the systems in which employees grow? How many orgs are thinking about inclusivity?At From Day 1 Utah,Benjamin Gross,Emma E Houston,Weslie Porter, MPA,Mike Harmer,Michael Watson, andMekenna Malanshared insights, experiences, and tools for supporting inclusive career growth.You all didn't make it seem easy, but you helped us see how the effort supports long- and short-term organizational success. Thank you!#leadership#inclusion#belongingatwork#career#careerpaths#careerpathplanning#growth#thankyou",0.9692,0.3976190476190476,0,1,0
Infinity Health,15-03-2023,We're at#Rewired23day 2!Elliott EngersPaul RenshawandKim Watsonare there to discuss how Infinity can be used for...- Bleep replacement- Outpatients transformation / PIFU- Virtual wardsAnd all things care coordination and task management in healthcare.Drop us a DM and we look forward to seeing new and old connections!,0.5837,0.3272727272727272,0,5,0
Louis Bragg,15-03-2023,"⏰ Attention all Executive Search professionals! ⏰Are you open to new opportunities in the industry?As the job market continues to evolve, it's important to stay open to potential opportunities that can help you advance your career.Whether you're a seasoned veteran or just starting out, there are always new opportunities to explore.If you're interested in connecting with other professionals in the field, please feel free to reach out to me.Let's connect and explore the possibilities we have here at SW6 Associates!Contact the SW6 Associates Senior Team for more information:Leith MonroBen WatsonJohn BrownConor Hamilton#executivesearch#recruitment#careerdevelopment#opportunity",0.96,0.4949300699300699,0,6,1 
PinkHippoLondonPR LTD,15-03-2023,"#NewClientAward Winning Female Founder & Global Tech Disruptor Paulette Watson (MBA) has been changing the lives of children all around the world with her platform Academy Acheivers; the#BeMeproject focuses on#STEMeducation in the UK & across the global.We will be managing her PR, Social & Media enquiries.Drop us a DM if you'd like to know more.",0.7096,0.2966666666666667,0,0,1 
UNCW MSc Finance and Investment Management,15-03-2023,"Welcome back to our new and returningUniversity of North Carolina WilmingtonMSF students as we kick off another term with Fixed Income Investments withBill Sackleyand Financial Statement Analysis withEthan Watson.  Thanks, as well, toMiran Hossainand Claude Courbois, PhD, CFA, who wrapped up Equity Investments and Economics.  The world has been our classroom as a world events unfold.Whether you are a new or returning MSF student, did you know that you have FREE access to:1. The Wall Street Journal2. The New York Times, and3. The Washington Post?You can find them athttps://lnkd.in/gxY7bVNC.https://lnkd.in/euq6NmP",0.9008,0.3848484848484848,0,1,0
Stephen Firmes,15-03-2023,"It’s time to ask us anything about#VeeamBackup for Microsoft 365 v7! 🙌 Join#Veeam’s Edward Watson on Twitter, March 29th for an exclusive#AMA💬 all about the NEW#VeeamBackup for Microsoft 365 v7. Can’t wait? Submit your questions ahead of time here in the comments or on Twitter with#AskVeeam.",0.0,0.0,1 ,1,0
Esther Patrick,15-03-2023,"Brief thoughts from Health and Wellbeing at Work 2023. Nicholas Wardle, employee experience speaker, says:✅ Analysis of 250 organisations showed that those investing in the employee experience (EX) were FOUR TIMES more profitable.✅ A Willis Towers Watson survey showed strong EX was linked to a 4% growth in revenue.✅ A 2019 study showed strong EX gives back on average 100 hours p/a per employee and manager.What forms EX?✴️ The entire experience between employer (organisation and its stakeholders) including every touchpoint and interaction at every stage of the employee lifecycle.So...❓ Have you mapped out your employee lifecycle journey?❓ If not yet, when?#healthatwork2023#hww2023#employeeengagement#employeeexperience#leadershipKeystone Training Ltd",0.867,0.475,0,4,1 
Intito Norway,15-03-2023,"«Vi jobber for automatisering fordi vi har flinke ansatte», sier Alasaari. «De er smarte folk. Vi vil at de skal kunne se fremover, i stedet for å bruke tiden på kjedelig, manuelt arbeid som vi kan gjøre automatisk.» Løsningen med Planning Analytics with Watson kan gjøre jobben raskere, billigere og med større presisjon, ifølge Alasaari.Les Vaasas case story:https://lnkd.in/dH8ZcCYa#IBM#PlanningAnalytics#AI#automatization",0.0,0.0,0,3,0
Kennesaw State University Norman J. Radow College of Humanities and Social Sciences,15-03-2023,"Don’t miss this inspirational and motivational panel featuring professional women from the competitive fields of sports, marketing, and entertainment. They will share the career moves that have made them so successful! Join featured speaker and WNBA star, Angel McCoughtry, with panelists: Catherine Brewton VP, BMI, Creative, Head of Hip Hop, R&B, and Gospel; Robyn Watson VP, Communications, Gannett; Theresa Wenzel COO, CORE4 and former WNBA team president; and Dina Marto, a seasoned entrepreneur and Founder of C&D The Agency.A Professionals with Purpose event hosted by the Norman J. Radow College of Humanities and Social Sciences, we invite you to celebrate Women’s History Month by joining us for this panel of amazing women.#KSURCHSS#KSUEvents#WomensMonth",0.9811,0.5333333333333333,0,8,8 
Services Design Solution (SDS),15-03-2023,"With over 84.1% of women experiencing menstrual issues at some point in their life, it is important to be aware of the signs and symptoms and to also understand how the menstrual journey affects the female body.In recognition of Endometriosis and Ovarian Cancer Awareness Month, yesterday we hosted a women's menstrual wellbeing workshop for all our staff, with theBristol Menopause& Wellwoman Clinic.As a male-dominated industry, colleagues of all ages and genders were encouraged to join the talk to understand how they can better support the women in their lives, whether it's their partners, daughters, sisters or work colleagues.Thank you toHazel Hayden, Founder of Bristol Menopause and Wellwoman Clinic, for joining us today and providing an informative workshop on the menopause, endometriosis and female health.If you would like any further information on woman’s health please see the attached courtesy of the British Menopause Societyhttps://lnkd.in/eAaJGHMeShaun HoppinsMark PlantAlan WatsonJames LaughlinAdrian MontagueKatie WakeKate LowmanLucy B.",0.9001,0.369047619047619,0,4,0
Aberdeen Inspired,15-03-2023,"MEET THE LEVY PAYERS -LakelandLaunching our new series, MEET THE LEVY PAYERS, where we interview Levy Paying businesses to find out what they enjoy about running a business in Aberdeen and the benefits of being one of our Levy Payers.First up is John Dempster, Manager of Lakeland on Union Street, Aberdeen.Read Lakeland's MEET THE LEVY PAYERS interview here >https://lnkd.in/e3thfmqMMake sure to follow Lakeland on Facebook, Instagram and Twitter @LakelandUK for all the latest updates!More information about Levy Payers can be found here>https://lnkd.in/epE8H-w3#lakeland#meetthelevypayers#AberdeenAdrian WatsonShona ByrneInnes WalkerRoss GrantRoulè WoodKate TimperleyLisa McCormick",0.8122,0.6858585858585858,0,0,0
Renato Ferreira Monticelli,15-03-2023,Bomba Senoidal Certa sendo produzida para nosso cliente do ramo de Alimentos e Bebidas.Primeiro trimestre chegando ao fim e continuamos em melhoria contínua para dar o melhor atendimento possível para nossos clientes.Watson-Marlow - BrasilMasoSine Process Pumps#engenhariaindustrial#manutenção#alimentos#bebidas#atendimento,0.0,0.0,0,33,1 
Tyne Gangway (Structures) Limited,15-03-2023,"Tyne Gangway (Structures) Limitedwill be at this year'sDPRTE 2023in Farnborough on the 29th of March.Donna WatsonandJames Russellare looking forward to engaging with suppliers and buyers at this event. If any of our contacts are attending and interested in meeting, please feel free to contact us.#DPRTE2023#ukmanufacturing#supplychain",0.8658,0.6666666666666666,0,2,0
Vaculug Limited,15-03-2023,"We were delighted to deliver a Tyre Awareness Workshop withSUEZ UKyesterday.Chris Watson,Peter Roffey&Robert Baxteradvised best practice when it comes to fitting and inflating tyres, as well as signs of tyre wear and damage. L-RChris Watson, Gavin Blair (Suez), Tom Mcgloin (Suez), Rajesh Kumar Nagarajan (Suez),Robert Baxter&Peter Roffey#tyreawareness#sustainablethinking#offtheroad#otr#tyres#retread#wastesites#industrial#earthmover#workingtogether#healthandsafety",0.7506,0.5,0,5,0
Odette Jack,15-03-2023,"‘Be the woman that that fixes another woman’s crown without telling the world it was crooked’.  Before the last couple of days I have totally forgotten I even had a crown.  Being a part of the Women in Higher Education Career Acceleration Program I met the most amazing set of women I didn’t even know exist in the same institution that I work at.  Before this programme my aim was invisibility - get in to work, do my thing, get out.  It worked perfectly fine until I realised I was completely lost and was going nowhere (professionally) fast.The last couple of days have taught me the importance of visibility, self-accountability, self-awareness, emotional-intelligence, love of self (the list is endless).  Thank youWHEN: Women's Higher Education Network.  I am actually thinking about myself again - the first time in a very long time.  I am thinking about what I want to do and who I want to be when I grow up, annihilating that invisibility cloak, overcoming my social anxieties and allowing myself to be supported instead of always being the one supporting everyone else.Kate Faxen- my new spirit animal…I felt so drawn to you - it was as though our spirit have known each other in another life - thank you for being awesome.ToMarcia Hazzard  Dr Hon. DBA MSc Chartered FCIPDMiriam LynnEllie Rich-PooleRebekah WatsonJenny RamplingYou are all such an inspiration, thank you for sharing yourselves with us, for the love and support and most importantly, for igniting that spark (for some) or blazing that fire (for others) in our belly- we appreciate you.  Women supporting and appreciating each other, this is my happy place.AndJenny RamplingI WILL write that love letter to myself - I NEED to.To the phenomenal women atLondon Metropolitan University- where have you been all my life? Oh never mind, I am glad I’ve found you.  Let us continue to support and encourage each other’s professional and personal growth.  Iron sharpens Iron…let’s get this!!Joanna BabiczUna FairbrotherEbonie WilsonNadia RahabHannah AldwinckleRuqia OsmanCassandra TerryVictoria AllisonVanessa AirthPreetpal KainthCarmen WilliamsAmaechi Akpene (nee Echedolu)and the others that were with us yesterday",0.9962,0.4428787878787878,8 ,10,0
"NNW, INC.",15-03-2023,"Join NNW at the biggest decom conference in the GOM. This is your last chance to save $200 on registration before this Friday’s deadline -https://lnkd.in/gjSA7b4dWe are sponsoring D&A GOM 2023 (The Westin Galleria, Houston, April 19-20) which currently has over 300 confirmed attendees, so I hope to see you there!If you need any further information, reach out to Joseph Watson onjoseph@offsnet.com#decommissioning#abandonment#oilandgas#wells#offshore#network#energytransition",0.8893,0.4916666666666667,0,1,1 
Laura W.,15-03-2023,"There is little you can't achieve as a volunteer. Even more so, when dedicated, talented, generous individuals find joy in giving their time to the encouragement and inspiration of others and especially to young people.When I started out in#speechwriting, I couldn't have imagined learning from a line up like this without a massive paywall.It is with great thanks toHumanity in ActionAlfred Landecker FoundationUniversity of StirlingFaculty of Arts & Humanities, EmployabilityCharlotte Street PartnersNewsdirectand in particular down to the hours of work put in byElaine Knox WatsonandSharron Jackthat the inaugural Scottish Festival of Political Communication#ScotFestStirlingwill take place for students of University of Stirling and political staffers of the Scottish Parliament this year.Stirling looks forward to welcoming former First Minister Lord Jack McConnell,Malcolm RobertsonKirsty Peebles Chart.PRCatriona MathesonAssa Samaké-RomanJunaid AshrafGerald RichardsRodger EvansNasim Forootan, MScMartin WhitfieldMSPDr Vanessa CollingridgeClare EnglishTosin Ogunlesi MSc CSMRachel AmeryandZahra Hedgesto set new precedents in demystifying lesser known political career opportunities and to inspire new talent to consider taking up the meaningful and fulfilling work that will contribute to a renaissance in ethical and inclusive political communication.#democracy#diversity#employabilityLet's begin!",0.9944,0.4149831649831648,3 ,12,2 
Matt Roads,15-03-2023,I’m happy to share that I’m starting a new position as Architectural Designer atPascall+Watson!,0.7345,0.5181818181818182,2 ,4,0
Jaime Morales,15-03-2023,"New ways of approaching the unattended markets (Smart Cities, Stadiums, Arenas, Universities, etc.) with efficacy and responsibility, multiplying product delivery points and empty package collection stations creating the Coca-Cola Circular Vending Experience.Have a look and enjoy!The Coca-Cola CompanyCoca-Cola Europacific PartnersInterBeverage Services (InterBev)The Nuddo PlatformDeer Watson Films",0.1759,0.3993506493506493,0,3,1 
Nigel Roberts,15-03-2023,"Huge congratulations to theCommonwealth Lawyers Associationfor a truly amazing#CLC23in Goa! Top notch and insightful prohgrams throughout and a special thanks to myLexisNexiscolleagueVeronica Riosfor stepping in as a speaker on the UN Sustainability Development Goals session! Sincere thanks for all the on the ground support toBrigid Watson,Clare Roe,Leah Almeidaand Evie Wilson",0.9732,0.4785714285714286,0,5,0
Watson's Daily,15-03-2023,"Today, I narrowed down 185 articles from 5 newspapers to 31 articles and used 25 in today's Watson's Daily.✨WATSON'S DAILY SAVES YOU TIME!!!✨▫️What’s Nuance’s latest nightmare?▫️TELL US IN THE COMMENTS 👇🏻#news#dailynews#uknews#worldnews#todaysnews#watsonsdaily#business#retail#economics#businessnews#economicnews#commercialnews#commercialawareness",0.0,0.3962962962962963,0,1,0
Patricio Cerda Maldonado,15-03-2023,"It’s time to ask us anything about#VeeamBackup for Microsoft 365 v7! 🙌 Join#Veeam’s Edward Watson on Twitter, March 29th for an exclusive#AMA💬 all about the NEW#VeeamBackup for Microsoft 365 v7. Can’t wait? Submit your questions ahead of time here in the comments or on Twitter with#AskVeeam.",0.0,0.0,0,4,1 
Kate Faxen,15-03-2023,"My feed will be awash this week with images and posts celebrating theWHEN: Women's Higher Education Networkcareer accelerator programme we ran atLondon Metropolitan Universityover Monday and Tuesday.One of the things I love about my job, is the flexibility that comes with such a generous holiday allowance! Which means I can take time off to do the things I am passionate about, like supporting women to be more fulfilled at work.I am so privileged to be able to spend time supporting women in the workplace, helping them to understand what brings them joy at work, and learning to speak up about their achievements. This particular group of women were utterly spectacular! Such a high energy group, willing to trust the process, allowing us to gently guide them out of their comfort zones and visibly growing in confidence in front of our eyes!You all achieved so much over 2 days, imagine what else you can achieve!!Thank you to you all!Odette Jack,Hannah Aldwinckle,Preetpal Kainth,Carmen Williams,Ebonie Wilson,Una Fairbrother,Vanessa Airth,Joanna Babicz,Holly Thompson,Victoria Allison,Bettina Coleman-Schoels,Juli Le Page-Pezet,Nadia Rahab,Ruqia Osman,Cassandra Terry,Mary KellyAnd thank you to our amazing programme leadEllie Rich-Pooleand facilitatorsMiriam Lynn,Rebekah Watson,Jenny Rampling,Marcia Hazzard  Dr Hon. DBA MSc Chartered FCIPDAnd a special thanks toAmaechi Akpene (nee Echedolu)for all your support.#womenempowerment#careerdevelopment#womenempoweringwomen#womenhistorymonth#womenchangemakers",0.9966,0.5247243107769424,13 ,17,0
The Face Radio 🌎,15-03-2023,Did you miss the recent broadcast of DL21 with Mr Watson?Catch-up now on The Face Radio!,-0.2244,0.25,0,0,0
Dietz and Watson,15-03-2023,"Dietz & Watson is looking to hire an experienced Worker's Compensation/Leave of Absence Specialist to join our human resources team.  This is a full-time, onsite position in our Philadelphia facility.  Please visitwww.Dietzjobs.comto view job description and  apply online.",0.5423,0.3333333333333333,0,3,0
David Keniry,15-03-2023,"When Ireland's energy transition history is published, East Cork will likely be on the cover. I hope that story will be about how the opportunity the energy transition presented was seized, not missed.The delicious local delicacies on offer at Midleton Farmers Market should also not be missed!In an electrified society building a smart transmission and distribution network that can support harnessing the offshore wind resources available off the coast of Munster is not an optional extra.Fossil fuels defined economies by shaping transportation infrastructure and where people could live. Transmission, distribution, and storage infrastructure in an electrified society must be viewed the same way.David WatsonOhmeTemporis CapitalInis Offshore Wind#powerandenergy#EVs#Cork#infrastructure#offshorewind#greenhydrogen#climatetechBarry Walsh",0.8908,0.5239795918367347,2 ,39,6 
Carrie Tuttle,15-03-2023,Let’s talk all things#VeeamBackup for Microsoft 365! 💬 💙 Join expert Edward Watson and get your all your questions about V7 and M365 backup answered. Submit your questions with#AskVeeamand we'll see you on the official Veeam Twitter account on March 29th!,0.4184,0.0,0,2,1 
MS Lending Group,15-03-2023,"As you may know the first round of voting has opened for the 2023Bridging & CommercialAwards.Last year we were delighted to bring home two awards; Best Newcomer Lender and ESG Award.This year we have set our sights on:🏆Specialist Product of the year🏆 Service Excellence - Lenders🏆Green Product of the Year🏆 Bridging Lender of the YearWe know it’s a lot to ask for nominations, and you probably get inundated with requests but we would love it if you would consider nominating MS Lending Group.If you think we deserve your vote please type MS LENDING GROUP in the above categories.Finally we have an exceptional team. One of these members who we feel is really excelling in his career and gets all of your deals across the line in record speed isSamuel BryceWe would love it if you would nominate him for Underwriter of the Year.The link to vote is:https://lnkd.in/ebkTKKVTAs always, thank you for your continued support.Michael StrattonAlexandra StrattonRobert GoodallFay CrippsDanielle WithnellSabrina AmmariAmer WatsonLiam EcclestonEmily Bell",0.9865,0.4703703703703704,2 ,11,0
Watson-Marlow Deutschland,15-03-2023,"Besuchen Sie uns noch heute und morgen auf der MesseTAUSENDWASSERin Berlin. Erleben Sie unsere Lösungen für die Wasser- und Abwasserwirtschaft, wie unsere innovativen Dosierpumpen von Watson-Marlow Pumps und unsere robustenBredel Hose PumpsIndustrieschlauchpumpen.",-0.5994,0.0,3 ,15,0
Ultra PCS,15-03-2023,"We were delighted yesterday to welcomejon watson(First Secretary Defence Trade and Policy,British Embassy Washington),Nigel Yates(Defence Acquisition and Technology,British Embassy Washington) and Rino Imperiale (International Armaments Cooperation Staff Officer,US ArmyForeign Comparative Test Office) to meet withMike Clayton,TONY WHITE,John Puddy,Helen AustinandRichard Colombo.A chance to demonstrate our technology and collaborate with such an esteemed audience is always a pleasure.#innovation#engineering#defence#technology#collaborationLeft to right: John Puddy (Ultra PCS), Jon Watson (British Embassy Washington), Nigel Yates (British Embassy Washington), Helen Austin (Ultra PCS), Rino Imperiale, (US Foreign Comparative Test Office) and Tony White (Ultra PCS).",0.8225,0.2325892857142857,0,15,3 
