Username,Date,Post,Post sentiment,Post subjectivity,Comments,Reactions,Reposts
Nikolas Krawinkel,15-03-2023,"A big shout-out  to The Bank of London and it’s bid to buy SVB UK…Even if we lost vs. HSBC, I am very happy for the whole ecosystem - amazing outcome.I am also very much looking forward to see how AnthonyWatson Watson is continuing to innovate the banking industry",0.8655,0.532,0,1,0
Steve Shenbaum,15-03-2023,"THIS JUST IN!!!After 25 years of traveling the globe delivering teamwork and communication programs…we’re excited to host and deliver a LIVE event right here in our own backyard.Now Presenting YOU…is a game-changing, one-day training experience to enhance your presence, public speaking, and self-confidence. You will also discover a proven framework to enhance your presentation skills, giving you tan practical skills for the next level of your career.Now Presenting YOU…will provide a framework to enhance your public speaking and presentation skills through experiential learning and ourGame On Nationsignature S.P.O.T. communication framework.SET-UP and prepare for the presentation or conversation with excellencePRESENT with authentic confidence, charisma, and engagementOBSERVE and be present in the moment with the agility to adjustTAKE-AWAYS that inspire others to take actionSign up now and join us (Blair Bloomston,Jason Martinez,Erin Watson,Chris Friday,Laura Hahn) on MAY 19, 2023 - BRADENTON, FLLearn more and sign up here:https://lnkd.in/eMB5xgyE#communication#presentationskills#publicspeaking#teamwork",0.931,0.4169047619047619,0,1,0
"Justin Wiedle, CPA",15-03-2023,"Lifestyle spending accounts(LSAs) are an emerging benefit that can support employees' physical, mental, emotional, and financial health and wellness.With a recent Willis Towers Watson survey showing that >40% of employees value benefit options, this could be a way to give them what they desire.#employeebenefitss#lifestyleaccounts#wellness#choices#childcare#petinsurance#workfromhome",0.8934,0.2485714285714285,0,0,0
HMT Publicidad,15-03-2023,"Jenna Ortega tuvo miedo de ser una nueva Emma Watson: Jenna Ortega rechazó por meses hacer ""Merlina"" porque no quería ser encasillada. Estaba cansada de la TV y quería ""hacer películas"".",-0.296,0.0,0,0,0
Cappfinity,15-03-2023,"Join us next Wednesday, 22nd March, at the IHR Early Careers Conference for our panel discussion: Harnessing The Power of Tech to Recruit The Talent Of Tomorrow!Expert Panel:📢 Nicky Garcea, Co-Founder and President at Cappfinity📢 Hayley Bowd, Global Early Careers Recruiting Lead at Expedia Group📢 Camilla McBride, Head of Early Careers at Sky📢 James Gordanifar, Global Head of Talent Acquisition at Willis Towers WatsonWednesday 22nd March, 09:40 – 10:10 AM GMTRegister here:https://bit.ly/3ZALQYN#EarlyCareers#IHREarlyCareers23",0.7959,0.15,1 ,1,0
Seaport Search Partners,15-03-2023,"Meet the SSP Team!Meet Taylor Watson, SSP RecruiterAs a Talent Acquisition Consultant at Seaport Search Partners, Taylor loves getting to meet new people and figuring out what they want their next steps to look like. Whether that be working with a candidate to find their next job or working with a client to figure out what growing their team and organization looks like, Taylor loves finding the perfect fit for her candidates and clients.To learn more about Taylor, visit:https://lnkd.in/eNK9PkFf",0.9709,0.3924242424242424,0,1,0
"Dayle M. Smith, Ph.D.",15-03-2023,"Discssing innovative solutions on collecting waste materials and creating projects leading to retail on our EMBA immersion in Brazil this morning.  Talking w the founder/entrepreneur/designer ofRe-Roupa,Gabriela Mazepa, a leader doing labs for innovation in Brazil and around the world—she has captured an approach to the production of clothes and related textile goods and ideas that values a creative environment and the creation of culture in order to intervene in the logic of the fashion production system.   She talked about her designs, using discarded fabric, as well as what communities create thru her workshops —snowball effects and brands buying product. Later this afternoon we’ll be visiting Oficina Muda , a Multi-Brand Office of Upcycling Sustainable Fashion, exploring the distribution center and seeing the impact at one of their retail stores.  Todays theme?: Bringing “fashion for good” and systemic change around sustainability and up cycling to life.  From waste to beauty.  “Has to be good product first and foremost and then the story sells.”Kelly WatsonEllen Ensher, Ph.D.Loyola Marymount University, College of Business Administration",0.9517,0.4033333333333333,0,0,0
Rocki Howard,15-03-2023,"Last week I had the privilege of attending and speaking atStaffing Industry Analysts'#ExecForum. It was such an incredible event.A very special thank you toBarry Asin,Kersten Buck,Diana Finn,Francesca Profeta, CCWP,Subadhra Sriram,Ursula Williams, and the rest of the SIA team.It was great to see and reconnect with industry colleagues and friends likeJessica McDearman Ashcraft,Colleen Futvoye-Colburn,Kim Gottschalk,Lee Grant, Jeff johnson indeedDoug Leeby,Joyce Russell,Marcus Sawyerr,Andrea Sugden,Leslie VickreyVirginia Watson, just to name a few. Meeting new people likeDustin TalleyandNina Vacawas simply energizing.Equally energizing was spending time with myThe Mom Projectpeeps,Jessica Dominiczak,Dara Lubarsky Levy, CCWP,Allison Robinson,Gregory RobinsonandDonna Yelmokas.I learned something from each session I attended, so if you are in the staffing industry and didn't attend (you will want to next year) or maybe attended different sessions, I thought I would share my lessons learned through this debrief.#staffing#recruitment#vms#deib",0.9701,0.4471212121212121,2 ,6,0
Gardner-Watson Studs,15-03-2023,"Glad to be starting a new job at Destin High School.Safe, Precise, and ontime.#gardnerwatsonstuds",0.4588,0.5789090909090909,0,2,0
Meredith Fuller OAM,15-03-2023,"Great night out at FLESH DISEASE Dir Romi Kupfer at LA MAMA, then dinner with friends who accompanied us (avid theatre goers Kate Watson couples therapist &Prof Matthew Cuthbertson). Brian and I are looking forward to returning Sunday 19th to be on Q&A discussing mental illness (as psychologists and somatic psychotherapists) with Romi (in photo) and writer Dianne Stubbings. The 5 actors - impressive work from these professionals. A joy seeingLesley ColemanandAngelique Malcolm(Angelique Pascoe) 2 gorgeous colleagues, but also discovering 3 other talented actors Yoni Prior, Sasha Leong, and Sonia Marcon#theatre#mentalillness",0.9224,0.5916666666666668,0,0,0
Walsworth,15-03-2023,Susie Watson loves helping customers. We’re thrilled to have her on the Walsworth team and even more excited to share her#EmployeeSpotlightstory this week!#Print#Walsworthhttps://lnkd.in/giRabHzM,0.9224,0.65,0,0,0
Joe Mellor,15-03-2023,"We are lucky enough to meet new people and get involved in interesting projects working forSto Ltd.Great meeting today with our Northern Project Manager,Peter WatsonatAirbusin Chester.It was great to meet Darren Nelson ofGilling Dod ArchitectsandMichael Wilkinsonof Airbus to discuss some upcoming remedial works.Walking around site with a Baluga XL transport plane landing in the background makes a normal Wednesday a little more exciting (Pete is a big aviation fan so he gave me the details)Thanks for the hospitality and we look forward to working with you.Sto Ltd.- more than just render.",0.9339,0.5534435261707988,0,2,0
Esther Liu,15-03-2023,"I am delighted to have had the opportunity to host the remarkableMalina Ngai, JP, CEO of A.S. Watson Group, at ourS&P GlobalHong Kong office in celebration of International Women's Day.#embraceequityDuring an engaging hour filled with laughter, Malina captivated S&P WINS (Women's Initiative for Networking and Success) members with her personal stories on overcoming adversity, turning challenges into opportunities, and fostering trust and teamwork.Malina's story – how an Asian Games medalist overcame a career-impacting injury – showcased the courage required to transform setbacks into comebacks. Her encouraging message resonated with all: ""I believe I’m not a born winner; I just work harder than others and hold on for longer."" A truly inspiring and memorable session!",0.984,0.4363636363636363,0,3,0
Crayons to Computers,15-03-2023,"Thank you to Q102’s Mollie Watson and Natalie Jones for hosting our first Saved by the Bell trivia event. They’ll be spreading the Good Vibes from 6-10PM on April 15 atMadTree Brewing Company. Proceeds from this event directly support Crayons’ Teacher Resource Center, Hubbard’s Cupboards, and other programs. Join us to test your knowledge AND support a great cause. More information and tickets can be found athttps://lnkd.in/gmufHgNV#CrayonstoComputers#SavedByTheBell2023",0.9578,0.4369047619047619,0,0,0
"Shannon ""Sope"" Watson",15-03-2023,"This is a Snippet  of  1st day of the Meac 2023 Tournament  Game 2 Men's Bball  South Carolina State vs Howard with Jody.... working alongside my Hits  family Tyshawn, Source, Adelle, Lateef, Chantell, Jacques,  My L2 family Iggy from Texas, Steven of Seven Venues and the Ops Crew Ed, Ira, Tre and JT And many more ... 🤘 😎🤘#onenationonelove#teamvirgo#thestrugglemademe#teamfitness#Sope#fitcameraman#fitness#fitlifestyle#motivation#dmvnetwork#videographer#ihvideo#cameraman#indieheat#vegan#videowork#videolife#meac2023#cali#california#atlanta#newyork#meac#norfolkva#positivevibes#esi#centerstagevideoHttps://sope.le-vel.comHttp://YouTube.com/c/SopeWatson",0.3885,0.4666666666666666,0,0,0
Mark Vincent,15-03-2023,"Join me at the IRM Business Change and Transformation event where I’ll be talking with Sade Mokuolu from Watson Marlow Fluid Technology Solutions about their transformation journey. We’ll be discussing how they are using a mixture of communication channels and approaches designed to increase engagement in their multi-year strategy. Early on in their journey, an aspect they felt was important was measuring how colleagues feel about the changes being implemented as a result of the transformation. They use the Kubler-Ross change curve as a guide.Using the Change Journey Navigator insights tool, they are able to establish the impact of the changes by monitoring how the communication is landing with colleagues and thereby understand where to focus attention to improve clarity and increase engagement.An important end result is to have everyone across the company feeling they are part of the change, empowered to re-imagine their roles to better serve their customers, their suppliers and each other.Click for more info on the event:https://lnkd.in/eG8mNgr7For more information on Change Journey Navigator go to:https://lnkd.in/e8muSMGT",0.9643,0.565625,0,0,0
BRAINSCORP,15-03-2023,"Nossas pesquisas mostraram que a plataforma BRAINSCORP baseada no IBM WATSON alcança significativas, efetivas e produtivas contribuições aos serviços e soluções baseados nos pesquisadores e processos legais.Estes ganhos representam de 22.3% até 30.3% de redução do tempo de pesquisa implicando em significativas e substanciais melhorias no modo de coletar e utilizar as informações falando em um ranking de benefícios e obtivemos uma pontuação de .61 em 1.0 possíveis.Definições:Para modelar o caso de uso ideal identificado pela plataforma BRAINSCORP, restringimos as plataformas de pesquisa disponíveis para uso por cada grupo da seguinte forma:Pesquisadores Booleanos (GOOGLE, BING etc.): os pesquisadores participantes só podiam usar recursos de pesquisa de palavras-chave booleanos de plataformas de pesquisa legais atribuídas.Pesquisa de Linguagem Natural: os investigadores participantes só foram autorizados a utilizar as capacidades de pesquisa da Linguagem Natural das principais plataformas de investigação jurídica.A plataforma BRAINSCORP usou uma pesquisa com algoritmo booleano: os pesquisadores participantes foram direcionados para usar a plataforma WATSON e os recursos de pesquisa de palavras-chave em padrões booleanos das principais plataformas de pesquisa jurídicas, conforme achassem adequado.O Watson e a pesquisa em Linguagem Natural: os pesquisadores participantes foram direcionados para usar a plataforma BRAINSCORP e os recursos de pesquisa em Linguagem Natural das principais plataformas de pesquisa legal, como achavam convenienteA experiencia mostrou limitações claras utilizando métodos sem o uso de machine learning.Os participantes que utilizaram plataformas de lógica tradicional recuperaram menos de um terço dos processos relevantes identificados nos seus primeiros 20 resultados.Ao mesmo tempo, apenas 25,8% dos resultados produzidos por essas pesquisas foram processos relevantes, o que significa que 74,2% dos resultados obtidos com uma pesquisa tradicional representaram apenas ruído que não ajudou os participantes a responderem às questões legais apresentadas.Esses resultados foram superados pela busca via Linguagem Natural, que produziu uma porcentagem significativamente maior dos processos (52,4%), enquanto aproximadamente 30 mais dos resultados obtidos foram relevantes.A plataforma BRAINSCORP superou as duas tecnologias de pesquisa avaliadas nessas medidas, produzindo 55,8% relevantes dentro de seus 20 principais resultados, com 37,9% de todos os resultados recuperados representando processos relevantesRESUMO:O impacto demonstrado pelos participantes que usaram a plataforma BRAINSCORP para apoiar seus esforços de pesquisa legal são suficientemente significativos para reduzir que teremos as reduções globais de trabalho e tempo necessário para obterrespostas acertadas nas questões legais e atingir o ROI desejado",0.91,0.425,0,0,0
Victor Castro,15-03-2023,"Buy with prime fromAmazon...After a snarky comment in my friendRick Watsonpost this morning, I figured i should at least provide constructive feedback.I'm my opinion, BWP has a viable path to growth and scale. Their problem is that it only takes value from brands while providing no incrementally to a merchant. It says a lot about Amazon's lack of understanding of the D2C space - I think most folks don't realize how little Amazon knows in the space. Building a large successful marketplace is not the same skill setThere are 2 things Amazon can do and adoption would scale very quickly:1. Drive traffic: The fees paid for BWP should give you some credit/access to buy advertising on Amazon that pushes traffic to their owned ecom property2. Be a true commercial partner: share customer data from buyers of the brands products on Amazon. The customer data sharing can't be one way.BWP has the potential to be an interesting play for Amazon. You could squint and see a network of high quality merchants, that solve the merchandising quality problem Amazon currently has. BWP could be a subset marketplace of curated brands, that could then also drive an ad premium.I'm leaving aside the customer experience for now because honestly it's irrelevant until they can reach scale. I can't imagine any brand customer will use this more than once in it's current iteration.if you think this is a bad/negative take, wait until you hear what I think aboutShopifyShop... initiative.",0.9592,0.5407983193277311,1 ,4,0
BRT UNITED,15-03-2023,"¡Excelentes noticias! 🎉OpenAIacaba de presentar#GPT4, su último modelo de#inteligenciaartificialque promete llevar la creatividad y la resolución de problemas a niveles inimaginables. Este sistema representa un gran avance en el campo de la IA y tiene la capacidad de superar los límites de los modelos anteriores.#IA#OpenAI#GPT4Entre las mayores mejoras que ofrece GPT-4 se encuentran:A) Mayor capacidad para entender y producir lenguaje natural. 🗣️💬B) Habilidad para realizar tareas complejas de forma autónoma. 🤖🧠C) Capacidad para realizar múltiples tareas al mismo tiempo. 💻🕒D) Mayor precisión en la comprensión del contexto y la semántica del lenguaje. 📚🔍E) Capacidad para generar contenido original y creativo en diferentes formatos, como texto, imágenes y video. 🎨📷🎥F) Mejora en la capacidad de resolución de problemas y toma de decisiones. 🤔💡G) Mayor rapidez y eficiencia en la ejecución de tareas. ⚡🚀H) Mejora en la capacidad de aprendizaje y adaptación a nuevas situaciones y escenarios. 🧠📚La inteligencia artificial también está transformando la industria del deporte 🏆⚽🏀. Gracias a la IA, los entrenadores pueden analizar los datos de los jugadores y equipos para tomar decisiones más informadas y estratégicas.Un ejemplo es el equipo de baloncesto de losGolden State Warriorsde laNational Basketball Association (NBA), que utiliza un sistema de#IAllamadoShotTracker Inc.para analizar los movimientos de los jugadores y mejorar su precisión en los tiros.Otro ejemplo es la tenista#SerenaWilliams, quien ha utilizado la tecnología de análisis de datos deIBM Watson Mediapara mejorar su juego y aumentar su rendimiento en la cancha. Con estos ejemplos y muchos más, está claro que la IA está cambiando el juego en el mundo del deporte. 🏀🎾#IA#Deporte#TecnologíaEn resumen, GPT-4 tiene el potencial de revolucionar la forma en que interactuamos con la IA y de abrir nuevas posibilidades para la innovación y la creatividad. ¡EnBRT UNITEDya estamos aplicando el uso de la IA a nuestro día a día y estamos emocionados de ver lo que el futuro nos depara con este nuevo modelo de IA! 🚀🌟#Innovación#Creatividad#GPT4#BRTechnology#BRTUnited#BRTeam#BRThinkingFutureSi queréis más info enReason Whyos la amplían. 👇🏽 👇🏽https://lnkd.in/dmfDEegz",0.7772,0.7166666666666667,2 ,3,1 
Jeroen Diderich,15-03-2023,"We are always pleased to be able to participate in industry events like theAWA Alexander Watson AssociatesGlobal Release Liner conference, and discuss the future of the industry, innovative technologies and sustainability. Looking forward to this event in Denver next week#sustainablesolutions#labels#awa",0.8074,0.55,0,4,0
"Shannon ""Sope"" Watson",15-03-2023,"This is a Snippet  of   1st day of the Meac 2023 Tournament  Game 1 Men's Bball  University of Maryland Eastern Shore vs Morgan State with Jody.... working alongside my Hits  family Tyshawn, Source, Adelle, Lateef, Chantell, Jacques,  My L2 family Iggy from Texas, Steven of Seven Venues and the Ops Crew Ed, Ira, Tre and JT And many more ... 🤘 😎🤘#onenationonelove#teamvirgo#thestrugglemademe#teamfitness#Sope#fitcameraman#fitness#fitlifestyle#motivation#dmvnetwork#videographer#ihvideo#cameraman#indieheat#vegan#videowork#videolife#meac2023#cali#california#atlanta#newyork#meac#norfolkva#positivevibes#esi#centerstagevideoHttps://sope.le-vel.comHttp://YouTube.com/c/SopeWatson",0.3885,0.4666666666666666,0,0,0
Paul Morris M.Sc.,15-03-2023,"Excited about today's event!Day 2 of the free Soil Regen Summit 2023!https://www.srs2023.com/Today’s Live Panel Discussion starts at: 11 a.m. PT with Paul Morris, Alan Watson Featherstone, and Ernst Götsch.Short break before the individual Meet-n-Greet sessions start.My talk: Case Study of Wetland, Woodland and Grassland Restorations with Paul MorrisLive EventPaul will explore how he transformed a former tobacco farm into a thriving hotspot for biodiversity! Over 20 years, he restored ponds, creeks, wet meadow, prairie, savanna, and forest on this 40 Ha property, enhancing the ecological function of the ...15 MAR8:00 AM - 9:00 AMPACIFIC TIME (UTC -8)#ecology#ecologicalrestoration#generationrestoration#planethealers#soilfoodweb#biodiversity#event#earthconectioncenter",0.8854,0.4928571428571428,0,0,0
CHISU Program,15-03-2023,"CHISU ProgramDeputy Program Director Stephanie Watson-Grant moderated the webinar - Integrating Gender in Health Information System Strengthening: Experiences from Burkina Faso, Ghana, and Indonesia: ""Great presentations and so many interesting questions, including about what we understand about gender in different countries.""USAID",0.8828,0.5875,0,1,0
Shahana Knight,15-03-2023,"I have just finished chairing the Dubai wellbeing conference day forOptimus Education (part of Shaw Trust)and have loved every moment! Being asked to fly over and chair this conference was such a pinch me moment. Then actually being here and listening to the speakers, meeting delegates, and sharing my Therapeutic Teaching approach through the keynote, workshops and final talk has just been fantastic. A huge huge thank you to the whole Optimus education team who are just the BEST people to workZoe LlewellynRhys EdwardsSteph ReynoldsKaty Watson, to Dubai, and everyone who attended this event 🥰",0.9706,0.6700000000000002,1 ,7,0
Wisefour,15-03-2023,We have great news to share!TheALLIANCE_PROJECTtogether withWATSONthey brought#expertsin#foodfraudin order to exchange ideas on the subject.,0.6588,0.5416666666666666,0,2,0
SGR (Strategic Government Resources),15-03-2023,"Join SGR in wishing Paula Watson, Embedded Services Specialist, a very happy birthday today! Paula serves local clients by filling long-term HR needs on location as an 'embedded' team member.Happy birthday, Paula!Learn more about Paula:https://lnkd.in/dwanMfnz",0.8261,0.5,0,1,0
Emily Bray,15-03-2023,"The sun came out yesterday afternoon forComputer FuturesLondon who walked across London in support of the Red Cross in raising money for The Turkey & Syria appeal.The earthquake that happened on the 6th Feb affected 13 million people across ten provinces in Turkey. We have all seen the heartbreaking images of those families and children that have suffered unimaginable loss in the tragedy. Whilst life goes on and the media storm dies down these people are still faced with the challenge of rebuilding their lives.I am so proud of how seriouslySThreetake ESG, giving back to support those in need & welcomed the opportunity to join the team yesterday in support of this harrowing cause. By 20th March SThree London have pledged to reach 3000KM with a goal of raising £3000 to help these families and I don’t doubt that together, we will achieve it.Good luck to Huxley London & Real Staffing on their walks this week ( wear comfortable shoes 🥵) & special thanks toMatilda Ellis&Elizabeth Cutbillfor organising and pushing everyone daily to ‘get their Strava on!’.If you’d like to help please see the link below for more information.https://lnkd.in/eBycUqPCVaibhav MalaviyaNicholas PeaceyAdam WatsonDan HarrisJonny DemkoMatilda EllisElizabeth CutbillConor WhiteSachin Gupta",0.9768,0.2815628815628815,0,9,0
Payal Mehta Muchhala,15-03-2023,"We are hiring Chatbot Developer for a Leading Life Insurance Company.Required Skills: 4 Years of Experience in Chatbot Development.(IBM Watson, Microsoft Bot Framework, Dialog flow)Qualification: Any EngineerLocation: Mumbai, 5 Days Working (Work from Office)#hiringnow#hiring#jobpostings#jobopening",0.0,0.0,0,0,1 
Dipesh Muchhala,15-03-2023,"We are hiring Chatbot Developer for a Leading Life Insurance Company.Required Skills: 4 Years of Experience in Chatbot Development.(IBM Watson, Microsoft Bot Framework, Dialog flow)Qualification: Any EngineerLocation: Mumbai, 5 Days Working (Work from Office)#hiringnow#hiring#jobpostings#jobopening",0.0,0.0,0,1,0
Tokiwa T. Smith,15-03-2023,"#WorldWaterDayis Wednesday March 22, in order to expose teens to STEM Careers in Water, the speaker for my nonprofitScience, Engineering and Mathematics Link IncTeen Science Cafe on Tuesday, March 21st from 6-7pm EST at the College Park Branch of Fulton County Library is Hydrologist Debbie Gordon of the United States Geological Survey.#Parentsand#Educatorssign your teens up for this cafe where they can learn about#hydrologyand how and why STEM professionals study water.You can register via the link belowhttps://lnkd.in/gPhJh-qTKatrina WatsonMarvin Arrington JrAdero CarterPamela ReddSagirah JonesChristian HardenNicole Ford#BLACKandSTEM#BlackWomenNonprofitLeaders#UnveilingPotentialThroughExposure#STEMCareerExploration#STEMOutreach#STEMWorkforceDevelopment#CommunitySTEM",0.296,0.0,0,1,0
Vicki L.,15-03-2023,"Neurodiversity is authenticity, and it should be as welcomed and supported in the workplace as a neurotypical's ""authentic self.""Still, misconceptions about neurological differences create livelihood barriers and social repercussions. Only 1 out of every 3 neurodivergent Canadian is employed. ""Unhireable,"" they are deemed, or ""too expensive to accommodate.""So let's talk business:💡 A report by JPMorgan Chase found that professionals in its Autism at Work initiative made fewer errors and were 90% to 140% more productive than neurotypical employees.💡 A report by Deloitte found that companies with inclusive cultures were six times more likely to be innovative and agile.💡 Thanks to Silicon Valley, the technology that rules everything around you is in large part the product of ND ingenuity.Companies like SAP, HP, Microsoft, Willis Towers Watson, Ford, and EY have reformed their HR processes in order to tap into neurodiverse talent. Dell, Deloitte, IBM, JPMorgan Chase, and UBS have start-up or exploratory efforts underway.What does this mean? Well, if you ain't up on things, that's opportunity cost keeping you from being ahead of the game.#NeurodiversityCelebrationWeek#ThinkDifferent#NeurodiversityAtWork",0.9595,0.6211580086580087,0,2,0
