Username,Date,Comment,Comment sentiment,Comment subjectivity,Upvotes,Link
Kallyanna,17-01-2023,"My Siri once on my old iPhone 7 started talking without prompt!!! There were 3 of us in the room at the time and I didn’t (and never fking will now) have her voice activated. I’m a woman, the other 2 people in the room were my husband and a friend and this fking AI started some strange conversation with thin air!!!",0.5526,0.39375,11.0,https://www.reddit.com/r/nosleep/comments/10ap1ew/i_created_a_chatbot_it_said_some_deeply/
Plenty_Trust_2491,17-01-2023,"My cellular telephone’s Siri has never spoken without prompt, but the girlfriend’s Siri has.  Sometimes, it has even repeated back to us entire sentences we’ve said.",0.0772,0.3125,2.0,https://www.reddit.com/r/nosleep/comments/10ap1ew/i_created_a_chatbot_it_said_some_deeply/
Niniju,17-03-2018,I'm assuming that this is referring to Artifical Super Intelligence. Siri and Alexa are both Artifical Intelligence to some degree.,0.8779,0.6666666666666666,2.0,https://www.reddit.com/r/WritingPrompts/comments/7rv1eh/wpyoure_the_first_artificial_intelligence_created/
ironh19,17-03-2019,I can see it now. Hey Siri open up my calendar. “Why it’s not like you have any friends. “,0.2477,0.5,3.0,https://www.reddit.com/r/gadgets/comments/d3te19/cerebras_enormous_artificial_intelligence_chip_is/
,17-03-2021,Burn! Suck it siri,-0.4926,0.0,1.0,https://www.reddit.com/r/technews/comments/mhw95g/stop_calling_everything_ai_machinelearning/
jimbosdayoff,08-03-2023,"""Hey Siri, nuke my leftovers in the microwave.""",0.0,0.0,1.0,https://www.reddit.com/r/memes/comments/11ju1ww/peak_artificial_intelligence_moment/
,05-03-2023,Ai seems to be newest metaverse 😅😅 They been doing it for years. Hello Siri 👋,0.0,0.0,1.0,https://www.reddit.com/r/tech/comments/11ghzdi/move_over_artificial_intelligence_scientists/
JonMeadows,17-02-2023,"Can you imagine the possibilities AI can bring to video games? Chatting with NPC’s who use AI and something akin to Siri text to speech API’s, I mean it REALLY could be a possibility in the next decade or so.",0.0,0.2958333333333333,-2.0,https://www.reddit.com/r/PS5/comments/10w1z17/taketwo_ceo_doesnt_think_artificial_intelligence/
AMAIWasALizardPerson,17-02-2023,"AI is certainly getting a lot more press these days because of ChatGPT, but it's already very present in our daily lives and has been for a while. Machine learning has just become more eloquent than it has in the past. Examples of AI in your daily life include (but obviously go beyond these things): Google Maps, the crappy autocorrect on your phone, auto-complete when you search for something, Siri/Alexa/Bixby, all those damn ads you see everywhere, etc. and so on and so forth. Definitely signs of good and evil among these already present AI powered applications already.",-0.7925,0.3684523809523809,1.0,https://www.reddit.com/r/Futurology/comments/10qwlvc/the_steam_engine_changed_the_world_artificial/
