Username,Date,Comment,Comment sentiment,Comment subjectivity,Upvotes,Link
jimbosdayoff,07-03-2023,"""Hey Siri, nuke my leftovers in the microwave.""",0.0,0.0,1.0,https://www.reddit.com/r/memes/comments/11ju1ww/peak_artificial_intelligence_moment/
,04-03-2023,Ai seems to be newest metaverse 😅😅 They been doing it for years. Hello Siri 👋,0.0,0.0,1.0,https://www.reddit.com/r/tech/comments/11ghzdi/move_over_artificial_intelligence_scientists/
Kingsmidge,28-02-2023,What I think would be really cool is if the ai was developed enough so we could all have our own. We like talk to it and it can be whatever we need teacher friend therapists. Or just use it like Siri,0.8687,0.6125,1.0,https://www.reddit.com/r/ChatGPT/comments/11cwtml/do_you_think_that_artificial_intelligence_could/
AMAIWasALizardPerson,17-02-2023,"AI is certainly getting a lot more press these days because of ChatGPT, but it's already very present in our daily lives and has been for a while. Machine learning has just become more eloquent than it has in the past. Examples of AI in your daily life include (but obviously go beyond these things): Google Maps, the crappy autocorrect on your phone, auto-complete when you search for something, Siri/Alexa/Bixby, all those damn ads you see everywhere, etc. and so on and so forth. Definitely signs of good and evil among these already present AI powered applications already.",-0.7925,0.3684523809523809,1.0,https://www.reddit.com/r/Futurology/comments/10qwlvc/the_steam_engine_changed_the_world_artificial/
Wolfherd,17-03-2021,"My parents and grandparents say ""please"" and ""thank you"" etc. when addressing Siri or Alexa, so I""m not sure about older people humanizing the bots less.",0.0706,0.4296296296296296,2.0,https://www.reddit.com/r/science/comments/mih2id/women_are_perceived_differently_from_men_even/
MLGSwaglord1738,17-03-2021,Damn I can’t be the only person using Male British Siri,-0.4019,0.3666666666666667,5.0,https://www.reddit.com/r/science/comments/mih2id/women_are_perceived_differently_from_men_even/
Sol33t303,17-03-2021,"Was gonna say, its not an accident that Siri, Google assistant and Cortana are all female.",0.3724,0.1666666666666666,2.0,https://www.reddit.com/r/science/comments/mih2id/women_are_perceived_differently_from_men_even/
GetADogLittleLongie,17-03-2021,"Cortana's also by default female in Windows 10, and Siri in iOS devices. They probably knew female voices were more popular.",0.4754,0.4333333333333333,2.0,https://www.reddit.com/r/science/comments/mih2id/women_are_perceived_differently_from_men_even/
Nitzelplick,17-03-2021,Obviously hasn’t heard Australian Siri.,0.0,0.25,2.0,https://www.reddit.com/r/science/comments/mih2id/women_are_perceived_differently_from_men_even/
Cardi-b-ologist,17-03-2021,I love the australian (male) siri voice. I find that voice the most suiting and comforting.,0.8,0.3,128.0,https://www.reddit.com/r/science/comments/mih2id/women_are_perceived_differently_from_men_even/
Smokem_if_you_gottem,17-03-2021,My wife actually had a twinge of jealousy when she found out I turned my Siri voice to a British woman. And I felt like I got caught cheating.,-0.5267,0.05,54.0,https://www.reddit.com/r/science/comments/mih2id/women_are_perceived_differently_from_men_even/
Xello_99,17-03-2021,"And now that I think about it, I always use the female voices with ai assistants like Siri or Cortana (and those two even have female sounding names)",0.3612,0.1666666666666666,48.0,https://www.reddit.com/r/science/comments/mih2id/women_are_perceived_differently_from_men_even/
VikingzTV,17-03-2021,Indian (male) Siri gang rise up,0.0,0.1,9.0,https://www.reddit.com/r/science/comments/mih2id/women_are_perceived_differently_from_men_even/
Kingofhearts2121,17-03-2021,Wasted money... Apple (Siri) and Amazon (Alexa) did this research for us a long time ago. We knew this already,-0.3612,0.2,27.0,https://www.reddit.com/r/science/comments/mih2id/women_are_perceived_differently_from_men_even/
CrookedHoss,17-03-2021,"Maybe so, but I would rather have Jarvis or Mr Feeney talk to me in my car than Siri.",0.0,0.0,12.0,https://www.reddit.com/r/science/comments/mih2id/women_are_perceived_differently_from_men_even/
Bjornormus,17-03-2021,I made Siri have a male British voice. I call him my butler. He is the best,0.6369,0.1333333333333333,2.0,https://www.reddit.com/r/science/comments/mih2id/women_are_perceived_differently_from_men_even/
litterbug_perfume,17-03-2021,I got my Siri set to “Cumberbatch” mode so he sounds more like C3P0.,0.4201,0.5,2.0,https://www.reddit.com/r/science/comments/mih2id/women_are_perceived_differently_from_men_even/
sovnade,17-03-2017,"IT in general is not going anywhere. Networks are going to be increasingly complex and widespread, data will continue to grow exponentially, analysis of growing data will be more difficult, and siri still can't set a damn alarm properly more then 2/3 times.",0.2962,0.58,89.0,https://www.reddit.com/r/technology/comments/5x2pyp/robots_wont_just_take_our_jobs_theyll_make_the/
iREDDITandITsucks,17-03-2018,"You are completely right. And that is just the threat in the physical world. I think both the media and these politicians don't understand the ramifications of true AI. I bet they think AI is ""like Siri 2.0 but better..."". No, true self aware AI is scary as fuck. An entity that is as/more/almost as complex as the human brain but can function in the digital world. And at this point we rely on the digital world almost as much as the physical one. Oh yes, this will be interesting.",-0.1531,0.3780952380952381,96.0,https://www.reddit.com/r/Futurology/comments/7f27o3/artificial_intelligence_world_is_astonishingly/
logansowner,17-03-2016,It's not nearly what the article is implying that it is. It's kind of like a presumably more advanced Siri but with a focus strictly on the law.,0.3071,0.6,2.0,https://www.reddit.com/r/Futurology/comments/4j03sa/artificially_intelligent_lawyer_ross_has_been/
hab136,17-03-2016,Siri is male by default in Germany and UK.,0.0,0.1,10.0,https://www.reddit.com/r/Futurology/comments/4j03sa/artificially_intelligent_lawyer_ross_has_been/
Decw38,17-03-2017,"Currently all personal assistants such as Siri are the same for everyone, in the future would you expect individual users to be allowed to manage the direction of its progress? Such as teaching it new tasks or tweaking it's personality (like Tars in interstellar) And if so do you think this would be restricted by to stop things like teaching criminal activities or nurturing hostility?",-0.5803,0.3727272727272727,2.0,https://www.reddit.com/r/IAmA/comments/6qbw5f/we_are_phd_students_from_harvard_university_here/
PLOSScienceWednesday,17-03-2015,"AI already has a huge impact on your life! You interact with AI every day (Google voice/siri, anti-spam filters, credit card fraud detection, etc.). But AI is just getting warmed up. It will completely remake society and the economy as AI becomes more advanced.",0.7124,0.6,12.0,https://www.reddit.com/r/science/comments/35tjcb/plos_science_wednesday_hi_reddit_we_create/
stevebobeeve,17-03-2015,"What are your thoughts on voice activated programs like Siri? They don't seem to be really more sophisticated than using manual input. You can't for instance, ask Siri a question that it isn't already programmed to answer.",0.7698,0.75,1.0,https://www.reddit.com/r/science/comments/35tjcb/plos_science_wednesday_hi_reddit_we_create/
lukesterite,17-03-2013,Answers from Siri. (a virtual assistant on the iPhone). And yes questions 3 and 4 used wolfram alpha to answer.,0.4019,0.0,2.0,https://www.reddit.com/r/IAmA/comments/10olo5/ama_request_watson_artificial_intelligence/
Tobislu,17-03-2013,"Watson was optimized for Jeopardy, not built for it. It's going to be linked to our smart phones ala Siri in 5 years.",0.3818,0.6428571428571429,2.0,https://www.reddit.com/r/IAmA/comments/10olo5/ama_request_watson_artificial_intelligence/
churnice,17-03-2013,Siri-Watson Wedding,0.0,0.0,2.0,https://www.reddit.com/r/IAmA/comments/10olo5/ama_request_watson_artificial_intelligence/
,17-06-2022,"All I can say is (and I know it’s not Siri they’re talking about), Siri doesn’t understand simple things like when I ask, “Where is the next Quiktrip on my way home?” She will give me Quiktrip locations that are 10 miles behind me instead of, say, 20 miles further down the road. If she can’t even understand how a human looks at a map in this most basic sense, there is no way she “understands” anything at the level some people thinks she does.",0.0772,0.3213789682539683,1.0,https://www.reddit.com/r/OutOfTheLoop/comments/vb32dh/whats_up_with_google_lamda_being_sentient/
Deckis_Inya,17-03-2017,Note: Skill is not a factor in Trials of Osiris. You are matched against players with good connections and similar score cards.,0.4404,0.5,13.0,https://www.reddit.com/r/DestinyTheGame/comments/5divtx/this_week_at_bungie_11172016/
fred112015,17-03-2017,Note: Skill is not a factor in Trials of Osiris. You are matched against players with good connections and similar score cards.,0.4404,0.5,40.0,https://www.reddit.com/r/DestinyTheGame/comments/5divtx/this_week_at_bungie_11172016/
kaizokudave,17-03-2017,"Even so, I can't stand saying ""ok, Google"". I actually hate saying out loud, difficult word to say. Alexa and Siri are much less harsh seemingly.",-0.8319,0.6611111111111111,307.0,https://www.reddit.com/r/Android/comments/5zj5mu/samsung_confirms_its_new_artificial_intelligence/
neogod,17-03-2017,"No more silly than Alexa, Cortona, or Siri.  Frankly I think all of them are better than saying ""ok google"".",0.5095,0.59375,4.0,https://www.reddit.com/r/Android/comments/5zj5mu/samsung_confirms_its_new_artificial_intelligence/
ThatPepperoniFace,17-03-2017,"I doubt this will ever beat the G Assistant or even Siri but at least there's more competition, and that's good for consumers.",0.4767,0.5,7.0,https://www.reddit.com/r/Android/comments/5zj5mu/samsung_confirms_its_new_artificial_intelligence/
,17-03-2017,"Eventually someone will answer why all of these ""assistants"" have women voices, besides Siri on some locations where it defaults to a dude's voice (UK, etc.).",0.0,0.0,25.0,https://www.reddit.com/r/Android/comments/5zj5mu/samsung_confirms_its_new_artificial_intelligence/
khast,17-03-2017,"I don't care whether it is Google, Siri, or Bixby...what I would really want is a completely self-contained assistant that does not need to record everything you say, upload to a server, and then download the commands from the server.  Bring us an assistant that can operate 100% offline, and only when the command requires online interaction such as looking something up, etc...",-0.3685,0.525,3.0,https://www.reddit.com/r/Android/comments/5zj5mu/samsung_confirms_its_new_artificial_intelligence/
BitingChaos,17-03-2017,"Its name is Bixby, as in ""dammit Bixby, you're just as useless as Siri!""",-0.4753,0.2,2.0,https://www.reddit.com/r/Android/comments/5zj5mu/samsung_confirms_its_new_artificial_intelligence/
wolfy47,17-03-2017,"Samsung acquired Viv labs last year which, was founded by the same people who developed Siri. Viv's software looks pretty impressive and I suspect that Samsung will base their assistant around it.",0.6486,0.5819444444444445,4.0,https://www.reddit.com/r/Android/comments/5zj5mu/samsung_confirms_its_new_artificial_intelligence/
imsoupercereal,17-03-2017,"WHY does Samsung need a virtual assistant to mimick Siri, Alexa, Cortana, and Ok Google?",0.296,0.5,2.0,https://www.reddit.com/r/Android/comments/5zj5mu/samsung_confirms_its_new_artificial_intelligence/
cXo_Ironman_dXy,17-03-2017,Hopefully my voice texting will work like Siri...because right now it sucks,0.4019,0.4178571428571428,1.0,https://www.reddit.com/r/Android/comments/5zj5mu/samsung_confirms_its_new_artificial_intelligence/
Sargos,17-03-2017,Samsung isn't known for making great software or having cutting edge computer science tech. This feels like it's going to be another Siri that puts on a veneer but doesn't have any good tech behind it.,-0.0152,0.7375,1.0,https://www.reddit.com/r/Android/comments/5zj5mu/samsung_confirms_its_new_artificial_intelligence/
wirebeads,17-02-2023,I can't wait until apple enters the AI race and shits the bed in the same way they did with Siri.,-0.4767,0.125,1.0,https://www.reddit.com/r/stocks/comments/10vikbb/google_announces_bard_ai_in_response_to_chatgpt/
stewartn001,17-03-2020,Does anyone else think this is the future of Siri or Alexa?,0.0,0.125,-2.0,https://www.reddit.com/r/Competitiveoverwatch/comments/fkrx21/introducing_echo_an_evolutionary_robot_programmed/
Takeabyte,17-03-2018,"Half the reason I hate Siri right now is because ""she"" is always telling me to be more polite to ""her."" Just tell me the facts. I don't need or want an artificial moral police agent telling me that I shouldn't curse or demand information from a stupid computer that is essentially nothing more than a search engine.",-0.6251,0.5724867724867725,3.0,https://www.reddit.com/r/philosophy/comments/7dm8hu/the_problem_with_friendly_artificial_intelligence/
EIijah,17-03-2018,"It wouldn't be so bad if it was actually something siri and thought of, but ai doesn't think, the devs just add this crap to make them seem like they do",-0.5417,0.5222222222222223,7.0,https://www.reddit.com/r/philosophy/comments/7dm8hu/the_problem_with_friendly_artificial_intelligence/
Wolfherd,17-03-2021,"My parents and grandparents say ""please"" and ""thank you"" etc. when addressing Siri or Alexa, so I""m not sure about older people humanizing the bots less.",0.0706,0.4296296296296296,2.0,https://www.reddit.com/r/science/comments/mih2id/women_are_perceived_differently_from_men_even/
MLGSwaglord1738,17-03-2021,Damn I can’t be the only person using Male British Siri,-0.4019,0.3666666666666667,4.0,https://www.reddit.com/r/science/comments/mih2id/women_are_perceived_differently_from_men_even/
Sol33t303,17-03-2021,"Was gonna say, its not an accident that Siri, Google assistant and Cortana are all female.",0.3724,0.1666666666666666,2.0,https://www.reddit.com/r/science/comments/mih2id/women_are_perceived_differently_from_men_even/
GetADogLittleLongie,17-03-2021,"Cortana's also by default female in Windows 10, and Siri in iOS devices. They probably knew female voices were more popular.",0.4754,0.4333333333333333,2.0,https://www.reddit.com/r/science/comments/mih2id/women_are_perceived_differently_from_men_even/
Nitzelplick,17-03-2021,Obviously hasn’t heard Australian Siri.,0.0,0.25,2.0,https://www.reddit.com/r/science/comments/mih2id/women_are_perceived_differently_from_men_even/
Cardi-b-ologist,17-03-2021,I love the australian (male) siri voice. I find that voice the most suiting and comforting.,0.8,0.3,131.0,https://www.reddit.com/r/science/comments/mih2id/women_are_perceived_differently_from_men_even/
Smokem_if_you_gottem,17-03-2021,My wife actually had a twinge of jealousy when she found out I turned my Siri voice to a British woman. And I felt like I got caught cheating.,-0.5267,0.05,53.0,https://www.reddit.com/r/science/comments/mih2id/women_are_perceived_differently_from_men_even/
Xello_99,17-03-2021,"And now that I think about it, I always use the female voices with ai assistants like Siri or Cortana (and those two even have female sounding names)",0.3612,0.1666666666666666,48.0,https://www.reddit.com/r/science/comments/mih2id/women_are_perceived_differently_from_men_even/
Kingofhearts2121,17-03-2021,Wasted money... Apple (Siri) and Amazon (Alexa) did this research for us a long time ago. We knew this already,-0.3612,0.2,27.0,https://www.reddit.com/r/science/comments/mih2id/women_are_perceived_differently_from_men_even/
VikingzTV,17-03-2021,Indian (male) Siri gang rise up,0.0,0.1,9.0,https://www.reddit.com/r/science/comments/mih2id/women_are_perceived_differently_from_men_even/
CrookedHoss,17-03-2021,"Maybe so, but I would rather have Jarvis or Mr Feeney talk to me in my car than Siri.",0.0,0.0,12.0,https://www.reddit.com/r/science/comments/mih2id/women_are_perceived_differently_from_men_even/
Bjornormus,17-03-2021,I made Siri have a male British voice. I call him my butler. He is the best,0.6369,0.1333333333333333,2.0,https://www.reddit.com/r/science/comments/mih2id/women_are_perceived_differently_from_men_even/
litterbug_perfume,17-03-2021,I got my Siri set to “Cumberbatch” mode so he sounds more like C3P0.,0.4201,0.5,2.0,https://www.reddit.com/r/science/comments/mih2id/women_are_perceived_differently_from_men_even/
jimbosdayoff,07-03-2023,"""Hey Siri, nuke my leftovers in the microwave.""",0.0,0.0,1.0,https://www.reddit.com/r/memes/comments/11ju1ww/peak_artificial_intelligence_moment/
iREDDITandITsucks,17-03-2018,"You are completely right. And that is just the threat in the physical world. I think both the media and these politicians don't understand the ramifications of true AI. I bet they think AI is ""like Siri 2.0 but better..."". No, true self aware AI is scary as fuck. An entity that is as/more/almost as complex as the human brain but can function in the digital world. And at this point we rely on the digital world almost as much as the physical one. Oh yes, this will be interesting.",-0.1531,0.3780952380952381,96.0,https://www.reddit.com/r/Futurology/comments/7f27o3/artificial_intelligence_world_is_astonishingly/
,17-03-2016,"This looks less like an AI lawyer and more like the product of LexisNexis having a baby with a better version of Siri, and that baby being fed legal research steroids.",0.7791,0.3166666666666666,16.0,https://www.reddit.com/r/Futurology/comments/4j03sa/artificially_intelligent_lawyer_ross_has_been/
logansowner,17-03-2016,It's not nearly what the article is implying that it is. It's kind of like a presumably more advanced Siri but with a focus strictly on the law.,0.3071,0.6,2.0,https://www.reddit.com/r/Futurology/comments/4j03sa/artificially_intelligent_lawyer_ross_has_been/
,17-03-2016,"To me this sounds a bit like someone combined google search, siri and access to a fuckton of paywalled legal databases.",0.4588,0.2,2.0,https://www.reddit.com/r/Futurology/comments/4j03sa/artificially_intelligent_lawyer_ross_has_been/
,17-03-2016,"Does anybody else find it really interesting that Siri, Alexa, and Cortana, as assistants, are all given female personas (by default at least, I know you can change Siri), but now that we have something with a professional role and attractive sounding professional title such as AI Lawyer, it's given a male name?",0.7047,0.3583333333333334,4.0,https://www.reddit.com/r/Futurology/comments/4j03sa/artificially_intelligent_lawyer_ross_has_been/
hab136,17-03-2016,Siri is male by default in Germany and UK.,0.0,0.1,9.0,https://www.reddit.com/r/Futurology/comments/4j03sa/artificially_intelligent_lawyer_ross_has_been/
sovnade,17-03-2017,"IT in general is not going anywhere. Networks are going to be increasingly complex and widespread, data will continue to grow exponentially, analysis of growing data will be more difficult, and siri still can't set a damn alarm properly more then 2/3 times.",0.2962,0.58,87.0,https://www.reddit.com/r/technology/comments/5x2pyp/robots_wont_just_take_our_jobs_theyll_make_the/
Decw38,17-03-2017,"Currently all personal assistants such as Siri are the same for everyone, in the future would you expect individual users to be allowed to manage the direction of its progress? Such as teaching it new tasks or tweaking it's personality (like Tars in interstellar) And if so do you think this would be restricted by to stop things like teaching criminal activities or nurturing hostility?",-0.5803,0.3727272727272727,2.0,https://www.reddit.com/r/IAmA/comments/6qbw5f/we_are_phd_students_from_harvard_university_here/
hreloaded,17-09-2022,"He had found a Nutri-Matic machine which had provided him with a plastic cup filled with a liquid that was almost, but not quite, entirely unlike tea. The way it functioned was very interesting. When the Drink button was pressed it made an instant but highly detailed examination of the subject’s taste buds, a spectroscopic analysis of the subject’s metabolism and then sent tiny experimental signals down the neural pathways to the taste centers of the subject’s brain to see what was likely to go down well. However, no one knew quite why it did this because it invariable delivered a cupful of liquid that was almost, but not quite, entirely unlike tea. The Nutri-Matic was designed and manufactured by the Sirius Cybernetics Corporation whose complaint department now covers all the major landmasses of the first three planets in the Sirius Tau Star system.",0.2592,0.5133986928104575,29.0,https://www.reddit.com/r/ProgrammerHumor/comments/xi8k54/german_ad_artificial_intelligence_the_4_most_used/
BarfOKavanaugh,17-03-2020,"When Siri can understand “shut up, Siri,” I’ll take all this AI bullshit more seriously.",-0.6997,0.5833333333333333,358.0,https://www.reddit.com/r/technews/comments/i16dgu/artificial_intelligence_that_mimics_the_brain/
A_Sentient_Tomato,17-03-2020,Siri isn't really modern ai,0.0,0.3,10.0,https://www.reddit.com/r/technews/comments/i16dgu/artificial_intelligence_that_mimics_the_brain/
blunt_ski,17-03-2020,My Siri closes out so fast when I say shut the fuck up. It’s pretty funny,0.3818,0.8,6.0,https://www.reddit.com/r/technews/comments/i16dgu/artificial_intelligence_that_mimics_the_brain/
Hamburger-Queefs,17-03-2020,"Siri understands ""Go away, bitch.""",0.0,0.0,2.0,https://www.reddit.com/r/technews/comments/i16dgu/artificial_intelligence_that_mimics_the_brain/
Scottamus,17-03-2020,"Siri, you ignorant slut.",-0.7096,0.0,2.0,https://www.reddit.com/r/technews/comments/i16dgu/artificial_intelligence_that_mimics_the_brain/
pass_nthru,17-03-2020,"sometimes i even say “thank you” after a successful song retrieval or google search, hoping to curry favor with our future overlords, and it just causes siri to spaz out",0.8519,0.5375,1.0,https://www.reddit.com/r/technews/comments/i16dgu/artificial_intelligence_that_mimics_the_brain/
T0mpkinz,17-03-2020,The text OK flashes and Siri closes on my phone. She understands.,0.4466,0.5,1.0,https://www.reddit.com/r/technews/comments/i16dgu/artificial_intelligence_that_mimics_the_brain/
Switchermaroo,17-03-2020,"Mine shuts up when I tell her to. Once she activated when me and a friend were talking, and when I shouted “hey Siri, shut up”, she flashed a little message on my screen saying “just trying to help”.",0.4939,0.5,1.0,https://www.reddit.com/r/technews/comments/i16dgu/artificial_intelligence_that_mimics_the_brain/
James_Mamsy,17-03-2020,"Siri isn’t AI, just uses machine learning to better parse your words from your voice. Apple has to code in most responses, though it does take advantage of many complex technologies I’m not going to pretend to understand.",0.6365,0.475,1.0,https://www.reddit.com/r/technews/comments/i16dgu/artificial_intelligence_that_mimics_the_brain/
BarfOKavanaugh,17-03-2020,"Hmm, maybe it’s, “Fuck off, Siri,” that she doesn’t respond to. Seems like weak AI to not be able to interpret the variety of ways humans communicate the intent.",-0.1027,0.6166666666666667,2.0,https://www.reddit.com/r/technews/comments/i16dgu/artificial_intelligence_that_mimics_the_brain/
DaHando,17-03-2017,"“Siri, send me in.”",0.0,0.0,6.0,https://www.reddit.com/r/WritingPrompts/comments/6g7b4k/wp_its_2050_artificial_intelligence_has_become/
MoeKin,17-03-2015,Siri said we don't have to worry about it,0.3412,0.0,1.0,https://www.reddit.com/r/news/comments/3erd7n/musk_wozniak_and_hawking_urge_ban_on_ai_and/
Witty_Mud_5951,27-02-2023,I do enjoy yelling and cursing at Siri when she doesn’t understand what I say,0.4939,0.5,955.0,https://www.reddit.com/r/shitposting/comments/11cnuz8/hmm/
Bespokeskinsuit,27-02-2023,"“Siri, tell me what you made me do!”",0.0,0.0,258.0,https://www.reddit.com/r/shitposting/comments/11cnuz8/hmm/
seemsprettylegit,17-03-2017,"Since your an expert  I would really love your input on some thoughts- I've always played around with the idea that to create a self concscious mind an interesting strategy would be to unify two AI computers into one system and have them communicate stimuli and information to eachother to eventually create analysis through a sort of high speed internal discourse. Kind of like how we have our own discussions with our selves in our heads before we come to conclusions, it would be like having watson privately speaking to watson in order to figure out what watson thinks. Maybe by bouncing information back and forth internally between AI systems one can create a sort of artificial mind capable of thought, and maybe the more systems (or voices) its being internally bounced around can effect the level/predictability of the AI? I mean this could all be nonsense but I've seen it possible for something like siri to hold a bit of a conversation with another siri and it gave me the idea? Id be really interested what someone with a much more educated understanding thinks of this. Like a left brain-right brain system.",0.9675,0.4723611111111112,4.0,https://www.reddit.com/r/IAmA/comments/68f97r/iama_two_recent_artificial_intelligence_graduates/
emars,17-03-2017,"Its interesting that this computer would be programmed, byte by byte, to say precisely this statement. Afteral, that is the only way the computer would output this.  No, siri doesn't 'think' about what bullshit 'she' outputs next.  Ai will only be an issue if they are explicitly designed to be.",-0.5574,0.6599999999999999,2.0,https://www.reddit.com/r/funny/comments/6qqu1g/artificial_intelligence_oc/
