,Name,views,duration,date,description,link
373,"A.I. - Psybient, Psychill, Downtempo Mix","133,371","1 hour, 1 minute",2 years ago,Solar Fields - Detection 52:50 https://amzn.to/2OW3G9u Video Source: Artificial Intelligence (2001) Movie (Buy From Amazon ...,https://www.youtube.com/watch?v=HQzjirwOWnU
374,"Apocalypse of AI wars: Natural vs Artificial Intelligence, 19 Keys with Red Pill","262,722","2 hours, 33 minutes",2 weeks ago,19 Keys presents High Level Conversations to bring you into the high frequency of speech and communication to elevate your ...,https://www.youtube.com/watch?v=9mf20XoMSmA
375,Character Special | सीआईडी | CID | Artificial Intelligence के जाल से Team CID ने किया इन्हे Rescue!,"2,398,617",Unknown,10 months ago,Team CID has reached the location where people are being used as lab rats for Artificial Intelligence and with great valor Officers ...,https://www.youtube.com/watch?v=XYJbasP66zw
376,What is Artificial Intelligence | BS Artificial Intelligence | BSAI | What is A.I,"29,662","12 minutes, 47 seconds",2 years ago,#BS_AI# #Educational_Videoes# #Career_Counselling#,https://www.youtube.com/watch?v=9MbT1F_0ge4
377,Artificial Intelligence Class 9 Unit 4 | Introduction to Python - Why Python?,"58,719",Unknown,1 year ago,"✓ In this video, ✔️ Class: 9th ✔️ Subject: Artificial Intelligence ✔️ Chapter: Introduction to Python (Unit 4) ✔️ Topic Name: ...",https://www.youtube.com/watch?v=sfmCTs_SdtI
378,How Machine Learning and Artificial Intelligence use in Civil Engineering | Tutort Academy,"1,312","4 minutes, 3 seconds",7 months ago,"In this 5 minutes video, we are going to explain How Machine Learning and Artificial Intelligence use in Civil Engineering.",https://www.youtube.com/watch?v=ZJNIbzk74J0
379,Tonight Showbotics: Jimmy Meets Sophia the Human-Like Robot,"34,112,606","8 minutes, 5 seconds",5 years ago,"Jimmy Fallon demos amazing new robots from all over the world, including an eerily human robot named Sophia that plays ...",https://www.youtube.com/watch?v=Bg_tJvCA8zw
380,I built LEGO using Artificial Intelligence…,"906,873","9 minutes, 5 seconds",1 month ago,"Today I used an A.I. app called Dall-e to generate famous characters, animals, and cool builds. These turned out super cursed, ...",https://www.youtube.com/watch?v=EBLVAMuaAwA
381,"Artificial Intelligence helped humans find 40,000 ring galaxies. #ai #artificialintelligence","3,565",Unknown,7 months ago,Unknown,https://www.youtube.com/shorts/YJ-vA3dkVNg
382,Budget 2023 | '3 Centres of Excellence for Artificial Intelligence To Be Set Up': FM Sitharaman,"1,967","5 minutes, 55 seconds",1 month ago,Republic TV is India's no.1 English news channel since its launch. It is your one-stop destination for all the live news updates from ...,https://www.youtube.com/watch?v=at-h2jGU36o
383,Artificial Intelligence in Tamil in 7 mins | Zeedup | Real time examples,"10,210","7 minutes, 59 seconds",3 years ago,Artificial Intelligence in Tamil in 7 mins | Zeedup | Real time examples www.zeedup.com.,https://www.youtube.com/watch?v=6dyTDY6Ir4I
384,Retail Traders Are Beating The Stock Market With Artificial Intelligence,"2,486","14 minutes, 54 seconds",2 months ago,"Retail traders are beating the stock market using BOTS, artificial intelligence and market data to make informed trading decisions!",https://www.youtube.com/watch?v=NItU6PEoO7A
385,resolution in FOL | Artificial intelligence | Lec-36 | Bhanu Priya,"203,670",Unknown,3 years ago,steps involved in resolution in artificial intelligence.,https://www.youtube.com/watch?v=C_iqWGOhvak
386,"What is Artificial Intelligence In 2023 | Types,Trends  Future of AI | AI Fully Explained In 4 Mins",unknown,Unknown,Unknown,artificialintelligence #artificialintelligencetechnology #futureofartificialintelligence #AI.,https://www.youtube.com/watch?v=vEWKAdW_6L4
387,What Does Artificial Intelligence Think About Scalpers?,572,"2 minutes, 19 seconds",1 month ago,"James here to give you guys a very special video scripted from ARTIFICIAL INTELLIGENCE! That's right, this was brought to you ...",https://www.youtube.com/watch?v=BzTAADKnKEc
388,#ONPASSIVE #ECOSYSTEM ARTIFICIAL INTELLIGENCE - Bill Must,"3,422","1 minute, 4 seconds",1 day ago,ONPASSIVE #OFounders #BillMust #Burjkhalifa #ONPASSIVE is the Emerging IT Company that renders information technology ...,https://www.youtube.com/watch?v=REAhFKgLfgU
389,Japan Releases Fully Performing Female Robots,"897,493","9 minutes, 16 seconds",6 months ago,"There has been a rise in the use of artificial intelligence, such as smart TVs and speakers and smart robots, in our daily lives.",https://www.youtube.com/watch?v=K5yJvUMJ7Ng
390,Natural Language Processing in Artificial Intelligence in Hindi | NLP with Demo and Examples,"403,120",Unknown,3 years ago,Natural Language Processing(NLP): How Human communicate with each other Computer should replicate the same thing ...,https://www.youtube.com/watch?v=bPpwZxasJo0
391,A.I. Artificial Intelligence (The Stolen Child),"6,938",Unknown,9 years ago,Spielberg's Artificial Intelligence remains halfway between Science Fiction and a Fairy Tale. David (Haley Joel Osment) plays a ...,https://www.youtube.com/watch?v=YUUs7ezHmfk
392,CLASS 10: Introduction to Artificial Intelligence | AI 417 | CBSE 2023 | Aakash Singh,"30,883",Unknown,8 months ago,Artificial Intelligence made easy - Welcome to the new Channel! Syllabus ...,https://www.youtube.com/watch?v=ltQigQ3Nkf4
393,Artificial Intelligence’s emergence in the music industry,152,"3 minutes, 13 seconds",3 days ago,Add 'music' to the list of industries being disrupted by artificial intelligence. Streaming services such as Spotify and Apple have ...,https://www.youtube.com/watch?v=XW8-AGW0mSA
394,Elon Musk Is An Artificial Intelligence Robot!,"2,427",Unknown,1 month ago,"Entrepreneur and investor Elon Reeve Musk. He is the owner and CEO of Twitter, Inc., the founder of The Boring Company, the ...",https://www.youtube.com/shorts/9Mo_M21lN6Y
395,AI- Artificial Intelligence #shorts #youtube,213,"1 minute, 1 second",1 month ago,Why AI become most important technology in the world? Don't you know? find here #technology #technews #tech #engineer ...,https://www.youtube.com/shorts/s2xDHmksOgk
396,Artificial Intelligence || Seminar 2021,"3,024","13 minutes, 12 seconds",1 year ago,"Science fiction has certainly familiarized the world with the concept of artificial intelligence. But outside of Hollywood, what is AI ...",https://www.youtube.com/watch?v=IV5xKnJPziU
397,Shocking NEW Footage Of Female Pleasure Robots!,"470,415","10 minutes, 3 seconds",7 months ago,"The fear of the female is projected onto technology as a result of this feminization, and thus the fear of artificial intelligence ""was ...",https://www.youtube.com/watch?v=2cMU_R5HQt8
398,Could Artificial Intelligence ever Surpass Humans?,"7,301","9 minutes, 13 seconds",11 months ago,The battle between artificial intelligence and human intelligence has been going on for a while not and AI is clearly coming very ...,https://www.youtube.com/watch?v=nIHGoJ3kYJE
399,Artificial intelligence is taking over the world | The Robot | Gumball | Cartoon Network,"313,323","4 minutes, 1 second",2 months ago,"Gumball, the amusing blue cat with a giant head and his best buddy Darwin, a pet goldfish who sprouted legs, step up the hilarity ...",https://www.youtube.com/watch?v=-usnZifPO5I
400,An Artificial intelligence lawyer for Kenya | Making access to justice entirely automatic,625,"13 minutes, 40 seconds",1 year ago,SwitchTV #FullcirclewithMwikali #Law #AI.,https://www.youtube.com/watch?v=1wCy9ofcynU
401,The Marvels of Artificial Intelligence  🤖,116,Unknown,7 months ago,How far is Artificial Intelligence from mirroring humans? To know more about Artificial Intelligence stream on DocuBay. WATCH ...,https://www.youtube.com/shorts/SZOhzgvzYk4
402,Is the Rise of Artificial Intelligence (AI) Good or Bad News for Alphabet Stock? | $GOOGL $GOOG,361,"6 minutes, 17 seconds",1 month ago,Artificial Intelligence has been taking the world by storm since the launch of ChatGPT. Alphabet is launching its own AI-infused ...,https://www.youtube.com/watch?v=CjurW8ztOb4
403,Future of Artificial intelligence by Michio Kaku | Robodoc | Future of AI | Prof Michio Kaku,unknown,Unknown,Unknown,This video is professor kaku interview about future of artificial intelligence and it's impact on life style ahead.,https://www.youtube.com/watch?v=WkiKfK3RnNk
404,Google Artificial Intelligence - a ChatGPT Killer?,205,Unknown,1 month ago,This YouTube video discusses the potential impact of Google's Artificial Intelligence technology on the future of chatbots and ...,https://www.youtube.com/shorts/7cAjVdnUmi8
405,"Artificial Intelligence, AI, emerging technologies in global business environment, mba, bba","18,616","14 minutes, 13 seconds",10 months ago,"Industry 4.0 : Meaning, Nature : https://youtu.be/o_nP6-Cy8X0 Digital Transformation : https://youtu.be/vdrjCtvlhYQ Artificial ...",https://www.youtube.com/watch?v=wiscimXGqxg
406,artificial intelligence vs human intelligence how to defeat,521,Unknown,5 months ago,new artificial intelligence vs human intelligence how to defeat DISCLAIMER: Our channel is purely made for entertainment ...,https://www.youtube.com/shorts/OtTioc-G3K8
407,Artificial Intelligence Can Tell Studios Which Movies To Make,308,Unknown,1 month ago,A.I. can tell movie studios which films to greenlight. It can tell which actors for which roles and what directors should helm each ...,https://www.youtube.com/shorts/HxyiAF1D36s
408,Engineering in Artificial Intelligence || Eligibility || Course || Avg Salary #shorts #studentkhabri,596,Unknown,1 month ago,Edited By - Rahul Bharti Goswami.,https://www.youtube.com/shorts/EyUy64yLKZ8
409,Dietitian Eats a Meal Plan Made by Artificial Intelligence (Is AI & ChatGPT Smarter than Humans?!),unknown,Unknown,Unknown,"Hey everyone I'm Abbey Sharp welcome to Abbey's Kitchen. In todays video, we will be talking about what an AI generated diet ...",https://www.youtube.com/watch?v=XslkOncDunc
410,Can artificial intelligence take the job of Veterinary Doctors and Animal care givers?,51,"6 minutes, 5 seconds",1 month ago,Artificial intelligence is taking over most industries including veterinary medicine and animal care. This video outlines fields in ...,https://www.youtube.com/watch?v=7A7ZTZyoHhU
411,Now use Artificial Intelligence to automate your content creation #chatgpt #openai #ai,170,"1 minute, 1 second",2 months ago,Unknown,https://www.youtube.com/shorts/GpAS21lHkSY
412,5 ways Artificial intelligence Can Make You Rich,"8,828","4 minutes, 15 seconds",5 months ago,ai #artificial intelligence.,https://www.youtube.com/watch?v=aERMkp0SE5o
413,How This Guy Uses A.I. to Create Art | Obsessed | WIRED,"2,276,356","10 minutes, 33 seconds",3 years ago,"Instead, he uses large collections of data and machine learning algorithms to create mesmerizing and dynamic installations.",https://www.youtube.com/watch?v=I-EIVlHvHRM
414,10 Incredible Uses of Artificial Intelligence(AI) and Machine Learning Today,"221,054",Unknown,7 months ago,Welcome back to Future Tech Stack. A lot of people are talking about artificial intelligence and machine learning. In this video ...,https://www.youtube.com/watch?v=_Rs80XA76FM
415,Artificial Intelligence transforming Facility Management Systems  | iOmniscient | BuildingAI,728,"3 minutes, 20 seconds",2 years ago,"Today with the developments in Artificial Intelligence, buildings are increasingly 'smarter' and 'intelligent'. In this video, we can ...",https://www.youtube.com/watch?v=0pwzEwvQO3k
416,Artificial Intelligence Class 9 Unit 2 | AI Project Cycle - Overview,"105,549",Unknown,1 year ago,"======================================================= ✓ In this video, ✔️ Class: 9th ✔️ Subject: Artificial ...",https://www.youtube.com/watch?v=momzkuLMtao
417,What is ChatGPT: the Artificial Intelligence Chatbot - IN FOCUS | UPSC Current affairs |Drishti IAS,"302,884",Unknown,3 months ago,"Artificial Intelligence (AI) research company OpenAI announced ChatGPT, a prototype dialogue-based AI chatbot capable of ...",https://www.youtube.com/watch?v=BWGejNNjsXc
418,Artificial Intelligence(AI) Career || What is AI?  || Salary || Job Profile || #shorts,313,Unknown,1 month ago,"********** Keywords artificial intelligence,artificial intelligence career,artificial intelligence career path,career in artificial ...",https://www.youtube.com/shorts/Bv7eMjrgIM8
419,What is State Space Search | Introduction to Problem Solving in Artificial Intelligence,"516,687","10 minutes, 47 seconds",3 years ago,A state-space defined as a set of all possible states of a problem. A State Space Search representation allows for the formal ...,https://www.youtube.com/watch?v=E5jVBqe59EE
420,INSANE Artificial Intelligence Combined With Robot Technology!,"7,271",Unknown,1 month ago,exoskeleton #wearabletech #wearabletechnology #humanity #human #humans #wonderful #industrial #medical #military #ai ...,https://www.youtube.com/shorts/Z-9KGBedtCA
421,Best 5 AI Research Tools  - Artificial Intelligence Tools That Better Than ChatGPT!,"2,157","11 minutes, 26 seconds",2 weeks ago,"In this informative video, we take a deep dive into the world of AI research tools and explore how they can be used to develop and ...",https://www.youtube.com/watch?v=uqMSVdZ5OhQ
422,Artificial Intelligence PPT,381,Unknown,4 months ago,Artificial Intelligence PPT https://studymafia.org/artificial-intelligence-ai-seminar-pdf-report-and-ppt #ppt #pptfree ...,https://www.youtube.com/shorts/C9pksmwUIo4
423,Artificial Intelligence & Automation,"16,546","12 minutes, 51 seconds",4 years ago,"Artificial Intelligence, or AI as it is more commonly known, and automation is this weeks discussion point for SOE. After visiting ...",https://www.youtube.com/watch?v=_h9BgyGv4Mc
424,Artificial intelligence,"377,649",Unknown,1 year ago,shorts #robot.,https://www.youtube.com/shorts/KLz0VpxlVTA
425,Kai-Fu Lee - Artificial Intelligence and Business,"11,785",Unknown,5 years ago,"Kai-Fu Lee is a venture capitalist, technology executive, writer, and computer scientist. He is currently based in Beijing, China.",https://www.youtube.com/watch?v=OojaXyvksFc
426,Is Google’s New AI As Smart As A Human? 🤖,"159,845","6 minutes, 14 seconds",6 months ago,"We would like to thank our generous Patreon supporters who make Two Minute Papers possible: Aleksandr Mashrabov, Alex ...",https://www.youtube.com/watch?v=ICQIx_C8mHo
427,Belwm platform with artificial Intelligence trading robot / Investment platform / Passive income,"38,839","9 minutes, 20 seconds",6 months ago,Registration link: https://h5.belwm.com/#/pages/reg/index?invite_code=33789140 ✓Support WhatsApp: ...,https://www.youtube.com/watch?v=iPHwTisFJog
428,End of An Artist's Career? A.I. Creates Art for You! - Complete Guide,"6,181,935",Unknown,7 months ago,"... the INSANE world of AI Art and Midjourney, and learn how you can get started with generating art using Artificial Intelligence.",https://www.youtube.com/watch?v=704brywiyfw
429,Artificial Intelligence in Public Relations & Marketing with Kris Ruby,264,Unknown,1 month ago,K﻿ey Takeways: How to leverage AI marketing tools to build your brand & update your digital media assets How to write AI ...,https://www.youtube.com/watch?v=obBL5IegA1s
430,Why Artificial intelligence (ROBOTS) won't replace DOCTORS | FUTURISTIC,514,"8 minutes, 49 seconds",10 months ago,"ROBOTS can do anything but they'll never be able to replace DOCTORS. What a surgeon can do, will never be easy for a ROBOT ...",https://www.youtube.com/watch?v=wynmF3mZtjs
431,Ameca conversation - Artificial Intelligence News #ameca #humanoidrobot #ai #robot,569,Unknown,5 months ago,ameca #ai #humanoidrobot This #ameca demo couples automated speech recognition with GPT 3 - a large language model that ...,https://www.youtube.com/shorts/ALM6B74PJK4
432,B.Tech in Artificial Intelligence B.Sc Artificial Intelligence | Career | Top Colleges in Tamilnadu,"17,631","9 minutes, 22 seconds",1 year ago,B.Tech in Artificial Intelligence / B.Sc in Artificial Intelligence | Career | Top Colleges in Tamilnadu In this video I have explained ...,https://www.youtube.com/watch?v=O6TxRRW2-Pw
433,Artificial Intelligence Class 10 - Syllabus Overview 2022-23,"66,437","6 minutes, 6 seconds",1 year ago,"✓ In this video, ✔️ Class: 10th ✔️ Subject: Artificial Intelligence ✔️ Topic Name: Syllabus Overview | Class 10 Computer ...",https://www.youtube.com/watch?v=U7BSo_1IVs4
434,Will there be Human-Level Artificial Intelligence by 2030?,unknown,Unknown,Unknown,"Artificial Intelligence has been improving rapidly these past few years, and it's now becoming obvious according to the top AI ...",https://www.youtube.com/watch?v=VvaU6nl4ILA
435,A Star algorithm | Example | Informed search | Artificial intelligence | Lec-21 | Bhanu Priya,"466,367","6 minutes, 38 seconds",3 years ago,a star algorithm: Informed search in artificial intelligence with example.,https://www.youtube.com/watch?v=PzEWHH2v3TE
436,Certainty Factor  in Artificial Intelligence Example-1,"8,674","14 minutes, 15 seconds",4 years ago,Unknown,https://www.youtube.com/watch?v=dTU67cQFumg
437,Cross-industry innovation in Artificial Intelligence in Bavaria,"1,970,154",Unknown,1 year ago,Bavaria is fast becoming one of Europe's leading centres for cross-industry innovation in Artificial Intelligence. Visit our website ...,https://www.youtube.com/watch?v=kij5nxP4hpo
438,"Four approaches of AI(Artificial Intelligence).Acting Humanly Rationally,Thinking Humanly Rationally","18,388","4 minutes, 12 seconds",4 years ago,"This video describe about the Four Approaches of Artificial Intelligence . These are Thinking Humanly , Thinking Rationally ...",https://www.youtube.com/watch?v=962CPdBTgNg
439,AlphaGo - The Movie | Full award-winning documentary,"33,167,926","1 hour, 30 minutes",2 years ago,"On March 9, 2016, the worlds of Go and artificial intelligence collided in South Korea for an extraordinary best-of-five-game ...",https://www.youtube.com/watch?v=WXuK6gekU1Y
440,Elon Musk on the Dangers of Artificial Intelligence,"1,486","9 minutes, 8 seconds",1 month ago,Elon Musk on the Dangers of Artificial Intelligence Are we dabbling in dangerous waters by advancing artificial intelligence?,https://www.youtube.com/watch?v=9-kpN2sVWqM
441,8-Puzzle Problem in Artificial Intelligence without Heuristic | All Imp Points | Must Watch,"339,189","11 minutes, 5 seconds",3 years ago,How to Solve 8 Puzzle problem using Uninformed Search algo like Breadth First Search. All imp points related to time complexity ...,https://www.youtube.com/watch?v=_CrEYrcImv0
442,Artificial Intelligence Will Take Over Humanity?,"6,696",Unknown,1 month ago,Source: Joe Rogan Experience.,https://www.youtube.com/shorts/4nSP3M1RzAM
443,Karachi Airport Artificial intelligence system,133,Unknown,2 months ago,#karachiairport #karachi #karachinews #pakistanairport #shortfeed.,https://www.youtube.com/shorts/FSV8Ma7At3g
444,Artificial Intelligence Project Ideas | Artificial Intelligence Training | Edureka,"135,583","14 minutes, 52 seconds",1 year ago,#edureka #aicertificationtraining #edurekaartificialintelligence #topaiprojectideas #artificialintelligence #projectideas ...,https://www.youtube.com/watch?v=7V_AebZFlpo
445,How Artificial Intelligence Became Elon Musk's Biggest Fear,944,"8 minutes, 29 seconds",1 month ago,Artificial intelligence is too amazing to be ignored at this moment. It is excitingly fast and smart. Many experts are still trying to ...,https://www.youtube.com/watch?v=PJFCHneWUf4
446,"Artificial Intelligence (Should You Fear Them?) #artificialintelligence, #AI",69,Unknown,4 months ago,Many folks fear that Artificial Intelligence (AI's) will be the end to humans. The tech community has long-debated the possible risks ...,https://www.youtube.com/shorts/M14lIrwA-54
447,Game changer - artificial intelligence AI #shorts,"2,134",Unknown,2 months ago,"Game changer - artificial intelligence AI #shorts Speakers: -Matthew Grob, Executive Vice-President and Chief Technology Officer, ...",https://www.youtube.com/shorts/Qni_VrUTS-g
448,Top Artificial Intelligence Systems in the World,"4,764","9 minutes, 10 seconds",2 months ago,Artificial intelligence software is in high demand. As the demand for software grew so did the demand for Hardware that supported ...,https://www.youtube.com/watch?v=Edk0Iu3mPuI
449,Propositional Logic in Artificial Intelligence in Hindi | Knowledge Representation | All Imp Points,"430,875","12 minutes, 20 seconds",3 years ago,"This logic is synonymous with sentential logic, provides ways and means of combining or changing the propositions to create a ...",https://www.youtube.com/watch?v=6490tKrGEic
450,Elon Musk talks about artificial intelligence destroying humanity,"3,372",Unknown,1 month ago,Unknown,https://www.youtube.com/shorts/4hr0nFxFyi4
451,Bank of England Experiments With Artificial Intelligence and Ripple Labs' Blockchain Solutions,220,Unknown,1 month ago,"In 2017, the Bank of England set up an experimental simulation using artificial intelligence and the Linqto portfolio company ...",https://www.youtube.com/watch?v=7M2p1die6Yg
452,Artificial Intelligence: What is Deep Learning with Real World examples |Future of Deep Learning AI,82,"3 minutes, 58 seconds",6 months ago,We discuss Deep Learning in relation to #artificialintelligence and Machine Learning. Deep learning can be considered as a ...,https://www.youtube.com/watch?v=OcXQl9Khhm0
453,Deepmind artificial intelligence @ FDOT14,"286,646","4 minutes, 41 seconds",8 years ago,"Smartphone bad audio quality Deepmind technology wrecking old Atari games, presented by neuroscientist and game ...",https://www.youtube.com/watch?v=EfGD2qveGdQ
454,Artificial Intelligence | Gareth Southwell | Thoughts of Our Times | Malayalam | English EduHelp,"40,988","14 minutes, 33 seconds",1 year ago,"In this extract, the author discusses how the notion of artificial intelligence has changed what it means to be human.",https://www.youtube.com/watch?v=RYHc5UHD4WI
455,【YUSHI入場曲】YUSHI Entrance Theme【YUSHI／Artificial Intelligence】,"184,901","3 minutes, 25 seconds",1 year ago,"This song is an entrance song for YUSHI, who is active in RIZIN. #会場使用編集 #YUSHI入場曲 #プロレス格闘技テーマ曲三昧 ...",https://www.youtube.com/watch?v=vsVk_nlP2UY
456,ARTIFICIAL INTELLIGENCE COUNTRY DISRUPTION 215,2,"3 minutes, 18 seconds",1 month ago,Join our crew in https://www.candinagroup.com/crew Contact us selection@candinagroup.com More information in: ...,https://www.youtube.com/watch?v=ZiV_KqJKrM4
457,SECRET Artificial Intelligence Project - Google's Plan for AI Supremacy,"13,370","9 minutes, 23 seconds",1 year ago,Google is secretly working on some of the most advanced and crazy-sounding Artificial Intelligence Systems in the world. Some of ...,https://www.youtube.com/watch?v=OpkPifHMqUo
458,WHAT IF THE ANKI COZMO ROBOT SEE A SCORPION? ARTIFICIAL INTELLIGENCE VS SCORPION,"16,659","6 minutes, 10 seconds",3 months ago,For those who want to support our project here is our: ✔️PayPal: ilad4you@icloud.com ✔️Patreon: ...,https://www.youtube.com/watch?v=OkH3ofebQ34
459,Philosophical Thoughts on Artificial Intelligence 🧠 🤖,174,Unknown,3 months ago,"A short excerpt from our video on AI generated imagery with prompt engineering. ""To teach is to foster growth. But to train is simply ...",https://www.youtube.com/shorts/1F0LPTyyFJ0
460,Artificial Intelligence Digital Fluency Bcom 1st year Notes in Kannada NEP Syllabus 2022 University,"37,395","8 minutes, 10 seconds",1 year ago,learn digital fluency skills at qpk digital fluency kannada question paper karnataka digital fluency digital Fluency meaning in ...,https://www.youtube.com/watch?v=ikRZexPulbU
461,"HERE-AI, Virtual replica created with generative artificial intelligence.",42,"2 minutes, 16 seconds",1 month ago,HERE-AI integrates the latest AI models to replicate the expressions and image of a deceased person. After a meticulous training ...,https://www.youtube.com/watch?v=d4n5eT4jAyA
462,"Best Artificial Intelligence[AI] Courses on Courses, Best Artificial Intelligence[AI] Online Courses",232,Unknown,9 months ago,Best Artificial Intelligence[AI] Courses on Coursera:- ...,https://www.youtube.com/shorts/zpPhhnNS4cE
463,Artificial Intelligence (AI) in Agriculture | The Future of Modern Smart Farming with IoT,"6,048","6 minutes, 53 seconds",5 days ago,"Welcome to our video on ""Artificial Intelligence (AI) in Agriculture | The Future of Modern Smart Farming with IoT."" In this video, we ...",https://www.youtube.com/watch?v=_tijHjup-gM
464,INSANE Robot Technology Combined With Artificial Intelligence!,"1,451",Unknown,1 month ago,exoskeleton #wearabletech #wearabletechnology #humanity #human #humans #wonderful #industrial #medical #military #ai ...,https://www.youtube.com/shorts/8k6xk0u8BR4
465,Artificial Intelligence: 6 What is state space ?,"92,152","4 minutes, 34 seconds",6 years ago,state space can be defined as set of all possible states for a given problem is known as state space of the problem searching is ...,https://www.youtube.com/watch?v=k6WN6RqiwOA
466,EP-12 | Tesla Artificial Intelligence ROBOT #OneMinuteShow #ChiraghBaloch,108,Unknown,6 months ago,Unknown,https://www.youtube.com/shorts/dSs3tXdtiuk
467,Using Artificial Intelligence to Make Me a Faster Runner?,596,"6 minutes, 22 seconds",1 month ago,✉️ - parkermaxyt@gmail.com. Here are some of my favorite running products: My daily trainer: https://amzn.to/3ySxdE5 BOA ...,https://www.youtube.com/watch?v=6EFWZymfv-Y
