,Name,views,duration,date,description,link
187,The Best ARTIFICIAL INTELLIGENCE Movies (Trailers),"60,365",Unknown,1 month ago,Included in this compilation are 00:00 The Best ARTIFICIAL INTELLIGENCE Movies 00:03 Ex Machina 02:21 Blade Runner 04:38 ...,https://www.youtube.com/watch?v=nDScvAxBOA8
188,I Typed the Bible Into an Artificial Intelligence Art Generator. Here's What Happened,"1,561,430",Unknown,2 months ago,I'm getting ahead of myself here. Artificial intelligence art generation is a controversial topic and it should be. I've been toying with ...,https://www.youtube.com/watch?v=s0AqlK_gCbU
189,Humanoid Robot Pepper | Artificial Intelligence News,220,Unknown,4 months ago,Pepper is the arena's first social humanoid robotic capable of apprehend faces and primary human emotions. Pepper became ...,https://www.youtube.com/shorts/TV9hnMlaG54
190,Supervised vs Unsupervised vs Reinforcement Learning | Machine Learning Tutorial | Simplilearn,"97,068","6 minutes, 27 seconds",2 years ago,"In this video, you will learn about Supervised vs Unsupervised vs Reinforcement Learning. You will understand the definition of ...",https://www.youtube.com/watch?v=1FZ0A1QCMWc
191,AI And Machine Learning Full Course | Artificial Intelligence & Machine Learning Course |Simplilearn,"163,515","9 hours, 48 minutes",1 year ago,Artificial Intelligence Engineer Program (Discount Coupon: YTBE15): ...,https://www.youtube.com/watch?v=wnqkfpCpK1g
192,Artificial Intelligence - Vibes,"63,886","5 minutes, 52 seconds",12 years ago,Drum n bass track from Artificial Intelligence...enjoy =] (V Recordings) free download as usual: http://www.breakbeat.co.uk/ find AI ...,https://www.youtube.com/watch?v=Dhe82eP7xsk
193,Elon Musk on Dangers of Artificial Intelligence!,114,Unknown,4 months ago,"Elon Musk is one of the world's most famous entrepreneurs, and he's also very concerned about the potential dangers of artificial ...",https://www.youtube.com/shorts/Mb_yqqmxklc
194,a Eurovision song created by Artificial Intelligence: Blue Jeans and Bloody Tears,unknown,Unknown,Unknown,"As Europe (together with Australia and Israel) are glued to their TV sets watching the 64th Eurovision song competition, we asked ...",https://www.youtube.com/watch?v=4MKAf6YX_7M
195,The History of Artificial Intelligence [Documentary],"972,506","2 hours, 34 minutes",2 years ago,This video is the culmination of documentaries that cover the history and origins of computing-based artificial intelligence. 00:00 ...,https://www.youtube.com/watch?v=R3YFxF0n8n8
196,2021's Biggest Achievements in Artificial Intelligence | Era of Artificial Intelligence | Futuristic,"10,780","6 minutes, 36 seconds",1 year ago,Artificial Intelligence has achieved so much in 2021 and it's going to give us more breakthroughs in 2022. That means Artificial ...,https://www.youtube.com/watch?v=NXPdonH_JB4
197,Rehearsals underway for artificial intelligence play,429,"1 minute, 42 seconds",1 day ago,An experimental play will be staged in Dublin tomorrow night which will involve actors performing a script generated by artificial ...,https://www.youtube.com/watch?v=7g_Vgfb-3nE
198,Chat GPT জিনিস টা কি? Artificial Intelligence এর কারণে কি আমাদের সবার চাকরি চলে যাবে? -Khalid Farhan,"664,379",Unknown,1 month ago,বিদেশ থেকে দেশে টাকা পাঠান খুব সহজে ও একদম ফ্রি তে! ডাউনলোড করুন Taptap ...,https://www.youtube.com/watch?v=xMGiGgbHNso
199,Kasger - Artificial Intelligence (Music Video),"12,768","6 minutes, 39 seconds",9 years ago,"A deep drum and bass track, hovering around the subject of artificial intelligence. This track is featured on the free 'Artificial ...",https://www.youtube.com/watch?v=z1Si75pSXNk
200,He loves artificial intelligence. Hear why he is issuing a warning about ChatGPT,"239,352","5 minutes, 44 seconds",1 month ago,"ChatGPT, the powerful new AI chatbot tool that interacts with users in an eerily convincing and conversational way, is being met ...",https://www.youtube.com/watch?v=THJysHMi81c
201,Introduction to Neural Networks with Example in HINDI | Artificial Intelligence,"615,727","11 minutes, 20 seconds",3 years ago,A Neural Network is a method in artificial intelligence that teaches computers to process data in a way that is inspired by the ...,https://www.youtube.com/watch?v=EYeF2e2IKEo
202,Cuco - Artificial Intelligence (Official Visualizer),"155,869","4 minutes, 21 seconds",7 months ago,Cuco - Artificial Intelligence (Official Visualizer) Listen to “Artificial Intelligence” from the new album “Fantasy Gateway”: ...,https://www.youtube.com/watch?v=-86zfUqS-L8
203,The first rudiments of mind in artificial intelligence | Shocking dialogue between an AI and human,"30,448",Unknown,7 months ago,0:00 Intro 1:55 Investment in IT projects 2:11 AI dialogues with humans 14:38 AI algorithm #prorobots #robots #robot ...,https://www.youtube.com/watch?v=ZCsqp6ueDbw
204,Artificial Intelligence - Mortal,"8,724","4 minutes, 31 seconds",3 years ago,Out now on Integral Records as part of The Series! Download/stream: https://fanlink.to/TheSeries Follow our Le(d)gendary Liquid ...,https://www.youtube.com/watch?v=wdH2GE9cryo
205,Some school districts are banning this artificial intelligence tool,"21,340","3 minutes, 40 seconds",1 month ago,Some educators are expressing concerns about students using the AI program ChatGPT to cheat on assignments. SUBSCRIBE to ...,https://www.youtube.com/watch?v=DNDqM1f5nQQ
206,Artificial Intelligence,431,Unknown,4 months ago,We make tech videos. On Blue Light Technology Shorts we post clips from our main channel. Stay to watch videos about ...,https://www.youtube.com/shorts/IMu7jZlcefU
207,Designing What If Cars with Artificial Intelligence,"46,396","7 minutes, 41 seconds",3 weeks ago,"Welcome to What If cars! In this series we are going to make alternative universe cars, based on my own fantasies or your request!",https://www.youtube.com/watch?v=_avhEwu0AX4
208,Ray Dalio: My View About Artificial Intelligence,286,"2 minutes, 59 seconds",1 year ago,"Raymond Thomas Dalio (born August 8, 1949) is an American billionaire investor and hedge fund manager, who has served as ...",https://www.youtube.com/watch?v=5_Xh_49BpY0
209,Joe Rogan - Elon Musk on Artificial Intelligence,"6,817,439",Unknown,4 years ago,Taken from Joe Rogan Experience #1169: https://www.youtube.com/watch?v=ycPr5-27vSI.,https://www.youtube.com/watch?v=Ra3fv8gl6NE
210,Why is Artificial intelligence Dangerous? | decoded| hindi,"1,596",Unknown,4 months ago,For Business Queries Mail us at aqibization@gmail.com For More Videos Or reel link ...,https://www.youtube.com/shorts/JTr6_J-hK98
211,AO* algorithm in AI (artificial intelligence) in HINDI | AO* algorithm with example,"391,138","13 minutes, 24 seconds",3 years ago,In this video I have explained AO* algorithm in AI (artificial intelligence) in HINDI | AO* algorithm with example. ▻Full Course of ...,https://www.youtube.com/watch?v=u_TE42-uWD0
212,Artificial Intelligence | Introduction | Lec-1| Bhanu Priya,"467,898","7 minutes, 48 seconds",3 years ago,introduction to artificial intelligence (AI) tutorial.,https://www.youtube.com/watch?v=kmeaG_BQZ7M
213,The Hidden Story Behind A.I. - Artificial Intelligence,"53,253","7 minutes, 35 seconds",5 years ago,The Hidden Message Behind A.I. Artificial Intelligence.,https://www.youtube.com/watch?v=jZgB3HZ6au4
214,What is Artificial Intelligence ? in 1 Minute | What is AI ?,"3,991","1 minute, 10 seconds",2 years ago,Watch : What is Artificial Intelligence ? in 1 Minute | What is AI ? Artificial Intelligence is the use of computer systems to perform ...,https://www.youtube.com/watch?v=VfBaFX7gVLk
215,Artificial Intelligence is dangerous | Stephen Hawking's | #shorts,"1,483",Unknown,6 months ago,Artificial Intelligence is dangerous | Stephen Hawking's | #shorts.,https://www.youtube.com/shorts/e5CoeyeC30k
216,নিউরনের যুদ্ধ  | The Unparalleled Growth of Artificial Intelligence | Chatgpt,"210,421",Unknown,3 weeks ago,নিউরনের যুদ্ধ | The unparalleled growth of Artificial Intelligence | Chatgpt #artificialintelligence #chatgpt #machine ...,https://www.youtube.com/watch?v=GwftxcJ18Jw
217,What do YOU think about AI (Artificial Intelligence) and photography?,"1,720",Unknown,3 months ago,"I used Artificial Intelligence to create some pictures. And, funny enough, I like it so much that I'm now even more of a fan of film ...",https://www.youtube.com/watch?v=pNyo9CMiq4g
218,Joe Rogan: How Good Is ChatGPT By OpenAI?! Are We Moving Too Fast With Artificial Intelligence?!,"1,372,754","7 minutes, 53 seconds",1 month ago,"Joe Rogan & Lex Fridman discuss OpenAI's chatbot, ChatGPT. They talk about how good it is at mimicking human responses and ...",https://www.youtube.com/watch?v=nJ2eyeFodl4
219,I Won a Fortnite Game Using Artificial Intelligence! (ChatGPT),"64,711","8 minutes, 55 seconds",3 months ago,TEAM! Today I Won a Fortnite Game using an AI called ChatGPT! I have a support a creator now! Use Code Reckz Want to see ...,https://www.youtube.com/watch?v=TGU727u65c4
220,What is AI - Artificial Intelligence in Telugu | Future of AI | TeluguBadi,"931,796","11 minutes, 12 seconds",4 years ago,For More Videos: ⯈Subscribe Now: https://goo.gl/vCPwXG ⯈Like our page on Facebook: https://goo.gl/bUpT1m ⯈Follow us on ...,https://www.youtube.com/watch?v=1PJsZwpwZ7k
221,First use of Artificial Intelligence in military warfare | First Human Kill of an AI Drone,"1,586","4 minutes, 52 seconds",1 year ago,Artificial Intelligence Applications in modern military warfare have become a reality. The first autonomous killer drone that killed ...,https://www.youtube.com/watch?v=u_X4DseOYQo
222,Artificial Intelligence - Perilous,"4,887","4 minutes, 36 seconds",3 years ago,Artificial Intelligence are back with another instalment of their latest project 'The Series'; Season's 3 & 4 are formatted as a full ...,https://www.youtube.com/watch?v=n5CkofSEc9k
223,"Artificial Intelligence: Past, Present, and Future","6,061",Unknown,2 months ago,"Dr. Craig Kaplan discusses Artificial Intelligence -- the past, present, and future. He explains how the history of AI, in particular the ...",https://www.youtube.com/watch?v=ZTt_GI0-wKA
224,Asking AI to Draw Artificial Intelligence #shorts,"4,205",Unknown,5 months ago,Asking AI to Draw Artificial Intelligence #shorts SUBSCRIBE and become part of the MetaSquad family! ✨ Follow Us! TikTok: ...,https://www.youtube.com/shorts/xauWKLWFsbk
225,Data Analysis with Artificial Intelligence without any Formula or Function | Just Ask Plain Question,"1,210","7 minutes, 59 seconds",3 months ago,Data Analysis with Artificial Intelligence without any Formula or Function | Just Ask Plain Question In this video you will learn how ...,https://www.youtube.com/watch?v=ZqUSHIOOLs4
226,Artificial Intelligence will Take Over These Jobs in 2022,"56,523","8 minutes, 44 seconds",1 year ago,Robots taking advantage of the newest advances in Artificial Intelligence systems are expected to make a huge dent in the job ...,https://www.youtube.com/watch?v=HhPWoqIyLfw
227,artificial intelligence 😲,"1,583",Unknown,1 month ago,___________the content of the video ______ Hi and welcome to this video about the future of artificial intelligence and its ...,https://www.youtube.com/shorts/26NxzbMeNtc
228,"The text-to-image revolution, explained","2,049,453","13 minutes, 33 seconds",9 months ago,"How programmers turned the internet into a paintbrush. DALL-E 2, Midjourney, Imagen, explained. Subscribe and turn on ...",https://www.youtube.com/watch?v=SVcsDDABEkM
229,The Terrifying Future of Artificial Intelligence,"159,903","8 minutes, 37 seconds",8 months ago,"For decades, the growth of artificial intelligence has fascinated scholars and scientists alike. Today, intelligent machines aid and ...",https://www.youtube.com/watch?v=PELnMfcYUj0
230,Artificial Intelligence - Be Clear,"4,435","4 minutes, 32 seconds",3 years ago,Be peaceful. TRACK INFO Artist : Artificial Intelligence Track : Be Clear Album : The Series Label : Integral Records Release Date ...,https://www.youtube.com/watch?v=cs5pxOQit8c
231,Will Artificial Intelligence Make Learning DAX Obsolete? | Power BI,"52,066","14 minutes, 1 second",2 weeks ago,Microsoft introduced a new feature in Power BI that can suggest DAX formulas for you. You can ask for the DAX measure you ...,https://www.youtube.com/watch?v=ZEwb3zobLUs
232,Replaced by Artificial Intelligence🤖 #artificialintelligence #futureworld #aigenerated,unknown,Unknown,Unknown,AI drawing jobs that will be replaced by artificial intelligence #artificialintelligence #futureworld #aigeneratedart #aigenerated ...,https://www.youtube.com/shorts/BZ6X1M1xaZw
233,An Artificial Intelligence Made This Painting,"130,844","8 minutes, 39 seconds",2 years ago,Let's explore the emerging world of artificial intellengence (A.I) and creativity and what it means about humanity. From paintings ...,https://www.youtube.com/watch?v=wFkFf6Zu8i4
234,YOU are training Artificial Intelligence RIGHT NOW #shorts #ai #bigtech,161,Unknown,3 months ago,Your data is used to train Artificial Intelligence right now. The Big Tech giants use the data that you create (uploaded photos and ...,https://www.youtube.com/shorts/9N2cGgP5SYk
235,Artificial Intelligence Told Me To Invent This Product (ChatGPT + DALL-E),"452,017","9 minutes, 23 seconds",2 months ago,"Unnecessary Inventions is the brainchild of product designer Matty Benedetto, where he designs & builds 2-4 brand new products ...",https://www.youtube.com/watch?v=aDoEMGUHgI0
236,What is generative artificial intelligence?,"2,232","2 minutes, 54 seconds",2 days ago,"TCS, the country's 2nd largest company by market capitalisation, has said that platforms like ChatGPT will create an 'AI co-worker' ...",https://www.youtube.com/watch?v=A2i3f6vRVeY
237,Artificial Intelligence- Take Me There feat Steo [Timeline],"20,661","5 minutes, 51 seconds",7 years ago,Grab Timeline here: https://shop.metalheadz.co.uk/download/metacd006d Facebook: ...,https://www.youtube.com/watch?v=Mx84qF8C8to
238,A.I.: Artificial Intelligence (2001) Trailer #1 | Movieclips Classic Trailers,"273,157","1 minute, 47 seconds",4 years ago,"Starring: Haley Joel Osment, Jude Law, Frances O'Connor Directed By: Steven Spielberg Synopsis: A highly advanced robotic ...",https://www.youtube.com/watch?v=pm7qlQ2E0iE
239,Educators worry about students using artificial intelligence to cheat,"147,846","6 minutes, 15 seconds",1 month ago,"Earlier this month, New York City public schools blocked access to the popular artificial intelligence tool ChatGPT. Educators are ...",https://www.youtube.com/watch?v=3L7dCa0cZS4
240,Artificial Intelligence: What it Means for YOU in 2023,"5,612","8 minutes, 27 seconds",8 days ago,An explainer-style video for marketers/entrepreneurs who may have misconceptions about what Artificial Intelligence is. We'll go ...,https://www.youtube.com/watch?v=ybIRE2B1NkQ
241,The four types of artificial intelligence (AI):,"2,508",Unknown,2 years ago,The four types of artificial intelligence (AI): #ICTMaster #artificialintelligence https://www.udemy.com/course/understanding-ict/?,https://www.youtube.com/watch?v=Rpd_FVKa09Y
242,Artificial intelligence AC for Mom Dad Room 🔥❤️ Semma Power Saving.,"1,069,811",Unknown,2 weeks ago,Subscribe for more product Reviews ♥️  ,https://www.youtube.com/shorts/4aScMurLyC0
243,Cuco - Artificial Intelligence (Sub. Español) // Lyrics,"23,628","4 minutes, 21 seconds",7 months ago,Sígueme en: Instagram: https://instagram.com/here_4u____?igshid=YmMyMTA2M2Y= Recomendaciones al DM en mi instagram.,https://www.youtube.com/watch?v=nQIgK2XC3Kg
244,BREAKTHROUGH Google Artificial Intelligence | NEW Robotics Automation Tech,"4,051","8 minutes, 37 seconds",3 months ago,AI News Timestamps: 0:00 Breakthrough Google Reinforcement Learning 2:31 New Microsoft AI 3:30 New Dual Arm Robotics ...,https://www.youtube.com/watch?v=_kY_Ca5sbBs
245,Bidirectional Search Algorithm in Artificial Intelligence in Hindi with Real Life Examples,"243,843","8 minutes, 47 seconds",3 years ago,"Bidirectional search is a graph search where unlike Breadth First search and Depth First Search, the search begins ...",https://www.youtube.com/watch?v=rEema9uQ02c
246,I Put Memes Through Artificial Intelligence...,"1,457,043","9 minutes, 48 seconds",2 months ago,"In this video, I told my twitch stream viewers to send me a bunch of memes on discord to use on tiktok for artificial intelligence, ...",https://www.youtube.com/watch?v=rOxO_ICdAmM
247,Artificial intelligence Can Control Every Move of Human  Movie Explained In Hindi/Urdu | Sci-fi,"238,429",Unknown,3 months ago,Artificial intelligence Can Control Human Every Move Movie Explained In Hindi/Urdu | Sci-fi Mystery Eagle Eye is a 2008 ...,https://www.youtube.com/watch?v=2sNLUNAs5JU
248,U.S. LEAKED: Artificial Intelligence Just Found ALIENS In SPACE,"7,225","12 minutes, 6 seconds",1 year ago,"LEAKED: Artificial Intelligence Just Found ALIENS Subscribe now for more Artificial Intelligence news, Data science news, ...",https://www.youtube.com/watch?v=GoUTwNAC16M
249,Artificial Intelligence - Pigeon Hole,"31,343","4 minutes, 33 seconds",12 years ago,Track Title: Pigeon Hole Artist: Artificial Intelligence Label: V Recordings UK Catalogue Number: PLVCD002 Released: October ...,https://www.youtube.com/watch?v=Anw07_11j9M
250,Pros and Cons of Artificial Intelligence | Drawbacks of Artificial Intelligence | pros of AI | CSS,"1,223","6 minutes, 24 seconds",11 months ago,Pros and Cons of Artificial Intelligence | Drawbacks of Artificial Intelligence | pros of AI | CSS Welcome to CSS PMS with AMNA.,https://www.youtube.com/watch?v=65ijCyZZJKI
251,I built LEGO using Artificial Intelligence…,"906,873","9 minutes, 5 seconds",1 month ago,"Today I used an A.I. app called Dall-e to generate famous characters, animals, and cool builds. These turned out super cursed, ...",https://www.youtube.com/watch?v=EBLVAMuaAwA
252,Artificial Intelligence Applications in Food Industry | Food Industry and AI | Analytics of Life,"22,665","9 minutes, 27 seconds",3 years ago,"Did you know that the world population is projected to escalate to about 9 Billion by 2050? To feed this vast number of people, the ...",https://www.youtube.com/watch?v=1St7SEprHgs
253,Twitch Chat and I Invaded a Zoo with Artificial Intelligence,"1,637,677",Unknown,2 months ago,The great battle for a zoo. Streaming live on Twitch! https://www.twitch.tv/dougdoug Full stream recording: ...,https://www.youtube.com/watch?v=3vDX8LhQalA
254,AI Technology That Will Change The World (Again),"55,223",Unknown,2 days ago,... generated by Mubert https://mubert.com/render #AI #artificialintelligence #futurism Timestamps: 0:00 Intro 0:20 How I Organize ...,https://www.youtube.com/watch?v=w5EZCkwJcus
255,30 seconds to understand Artificial Intelligence | What is AI?? |  Tech Thread #short,"1,287",Unknown,1 year ago,A perfect video to understand Artificial Intelligence in 30 seconds ----------------------------------------------------------------------------------- 30 ...,https://www.youtube.com/shorts/C3KRdPxqzPI
256,Artificial Intelligence,"123,079","6 minutes, 18 seconds",Unknown,Provided to YouTube by IIP-DDS Artificial Intelligence · Save The Robot Artificial Intelligence ℗ United Beats Records Released ...,https://www.youtube.com/watch?v=q8ndWunDL5U
257,Make $100/Day With Artificial Intelligence (Make Money Online),"8,293","10 minutes, 23 seconds",6 months ago,▭▭▭▭▭▭▭▭▭▭▭▭▭▭▭▭▭▭▭▭▭▭▭▭▭▭▭▭▭▭ TOP VIDEOS FROM JASON WARDROP CHANNEL Start A ...,https://www.youtube.com/watch?v=CWQkUTPfwLo
258,Speedrunning Castlevania Using Artificial Intelligence,"5,991",Unknown,1 month ago,#randomizer #speedrun #castlevania.,https://www.youtube.com/watch?v=rn2cZyHYoc0
259,Optimus Robot Revealed at Tesla AI Day - Artificial intelligence news #tesla #elonmusk #ai #robot,"3,420",Unknown,5 months ago,"tesla #elonmusk At 2022 Tesla AI Day, Elon Musk gave the public its first look at his company's humanoid robot nicknamed ...",https://www.youtube.com/shorts/BqxpTWW9qhg
260,Artificial Intelligence Class 10 Chapter 1 | Introduction to AI - Domains of AI:Data Science 2022-23,"49,184","13 minutes, 21 seconds",1 year ago,"✓ In this video, ✔️ Class: 10th ✔️ Subject: Artificial Intelligence ✔️ Chapter: Introduction To AI - Foundational Concepts ...",https://www.youtube.com/watch?v=csgjT73S7b4
261,Python Artificial Intelligence Tutorial - AI Full Course for Beginners in 9 Hours [2021],"870,622","8 hours, 57 minutes",2 years ago,Time Stamps ... ENJOY   3:02 - Face Detector App 2:08:42 - Self Driving Car App 4:11:47 - Smile Detector App 6:47:03 ...,https://www.youtube.com/watch?v=XIrOM9oP3pA
262,A.I. MEDITATION Created by Artificial Intelligence,unknown,Unknown,Unknown,This mindfulness meditation was designed completely by A.I. We used Artificial Intelligence to write all the affirmations using ...,https://www.youtube.com/watch?v=n5Ipt261cfA
263,Why Conservatives Need to Become Familiar with the Mechanisms of Artificial Intelligence,"2,389","6 minutes, 28 seconds",1 month ago,Media expert Kris Ruby says conservatives need to become familiar with the mechanisms of artificial intelligence and machine ...,https://www.youtube.com/watch?v=DPH3fkyk9iE
264,Recreating my photography using ARTIFICIAL INTELLIGENCE #creativephotography #aiart #openaidalle,"1,348",Unknown,6 months ago,Unknown,https://www.youtube.com/shorts/BeoMy0Q0OMs
265,Fascinating Facts About Artificial Intelligence (Ai),114,"4 minutes, 1 second",1 month ago,Unknown,https://www.youtube.com/watch?v=rQM_oRIsbTM
266,3 Key Breakthroughs That Paved the Way for Artificial Intelligence,"115,481","1 minute, 53 seconds",4 years ago,"The emergence of artificial intelligence has been made possible by three key breakthroughs. Discover why the ""AI winter"" has ...",https://www.youtube.com/watch?v=-RiiXVUrAdc
267,Artificial Intelligence with Delphi,"9,760",Unknown,6 years ago,Implementing Artificial Intelligence with Delphi video tutorial #Delphi #OpenWire.,https://www.youtube.com/watch?v=f8OQx1fwLLc
268,Unbelievable Artificial Intelligence Breakthrough (AI Cell Simulation),"19,487","8 minutes, 57 seconds",1 year ago,Artificial Intelligence Researchers just got one step closer to simulating an entire artificial lifeform inside of a computer. This time ...,https://www.youtube.com/watch?v=7X3CNk0hGh0
269,A. I. Artificial Intelligence Movie Explained In Hindi/Urdu,"2,227,466",Unknown,1 year ago,A. I. Artificial Intelligence Movie Explained Hindi/Urdu Snatch movie Explained in Hindi Hindi movie explanation Hollywood ...,https://www.youtube.com/watch?v=zspcXo5-kvE
270,Dr Muhammad Rafi Head of Artificial Intelligence Department - FAST NUCES Karachi,802,"2 minutes, 27 seconds",9 months ago,Dr Muhammad Rafi Head of Artificial Intelligence Department - FAST NUCES Karachi.,https://www.youtube.com/watch?v=r5_Cz3eGnaw
271,"The World's First ""Perfect"" Artificial Intelligence Begins To Unnerving Emergent Behavior | Sci-fi","56,323","11 minutes, 8 seconds",11 days ago,Climax Revealed | https://www.youtube.com/channel/UCUVGa_ACULlH07Jtj83fWiw GameVR ...,https://www.youtube.com/watch?v=yjaeT_2pmhY
272,Humanity’s Last Invention #artificialintelligence #technology #elonmusk #ai,"186,862",Unknown,3 weeks ago,... when artificial intelligence surpasses human intelligence and begins to upgrade itself exponentially well it'll be humankind's last ...,https://www.youtube.com/shorts/JXh352gqGvQ
273,Introduction to Game Playing in Artificial Intelligence | Learn Game Playing Algorithms with Example,"290,425","7 minutes, 7 seconds",3 years ago,This video is about Introduction to Game Playing in Artificial Intelligence | Learn Game Playing Algorithms with Example.,https://www.youtube.com/watch?v=FFzdXJ49KAI
274,Natural Language Processing - Introduction | Class 10 Artificial Intelligence 2022-23 2022-23,"37,476",Unknown,10 months ago,"✓ In this video, ✔️ Class: 10th ✔️ Subject: Artificial Intelligence ✔️ Chapter: Natural Language Processing ✔️ Topic Name: ...",https://www.youtube.com/watch?v=bmzwAYoOPVI
275,Class 10: 40 EXPECTED QUESTIONS for Boards 2023 (Part-1)|Artificial Intelligence 417 | CBSE | Aakash,"4,185",Unknown,4 days ago,Artificial Intelligence made easy - Welcome to the new Channel! Telegram Group:https://t.me/+c5gWM6PiL085M2I1 Syllabus ...,https://www.youtube.com/watch?v=Yz4Bh_lwEqU
276,Top Stocks Into Artificial Intelligence,"1,537","8 minutes, 48 seconds",1 month ago,Top Stocks Into Artificial Intelligence Everything you need to know about me: https://beacons.ai/marvingermo To Invest in Crypto: ...,https://www.youtube.com/watch?v=3ujuvBjlhCo
277,CBSE Sample Paper | CBSE Sample Paper 2023 Class 10 Artificial Intelligence | CBSE Board Exam 2023,"41,871","4 hours, 42 minutes",4 months ago,"✓ In this video, ✔️ Class: 10th ✔️ Subject: Artificial Intelligence ✔️ Topic Name: CBSE Sample Paper 2023 | CBSE Sample ...",https://www.youtube.com/watch?v=GBJp-tXteLU
278,Origin Of Artificial Intelligence | History of Artificial Intelligence | Online Learning |,"1,045","3 minutes, 26 seconds",11 months ago,Origin Of Artificial Intelligence | History of Artificial Intelligence | Online Learning | Welcome to CSS PMS with AMNA. This channel ...,https://www.youtube.com/watch?v=G-vXrlIkbgM
279,Artificial Intelligence Designed Clothes,359,Unknown,2 months ago,"Artificial Intelligence Designed Clothes About the video: Over 80 outfits were created, with the help of an artificial intelligence ...",https://www.youtube.com/shorts/ujvu4I8ZGUQ
