,Name,views,duration,date,description,link
0,What Is Artificial Intelligence? | 🔥Artificial Intelligence Course | AI In 5 Minutes | |Simplilearn,"1,166,565","5 minutes, 28 seconds",3 years ago,"This video on ""What is Artificial Intelligence?"" will help you learn Artificial Intelligence in 5 minutes and introduce you to Artificial ...",https://www.youtube.com/watch?v=ad79nYk2keg
1,How will AI change the world?,"730,358","5 minutes, 56 seconds",3 months ago,Explore the current limitations of artificial intelligence and the possibility of creating human-compatible technology. -- In the ...,https://www.youtube.com/watch?v=RzkD_rTEBYs
2,Artificial Intelligence: Last Week Tonight with John Oliver (HBO),"5,225,357",Unknown,11 days ago,"Artificial intelligence is increasingly becoming part of our lives, from self-driving cars to ChatGPT. John Oliver discusses how AI ...",https://www.youtube.com/watch?v=Sqa8Zo2XWc4
3,"Midweek Marvels: Pete Buttigieg, Marianne Williamson, Artificial Intelligence, and LOTS more","16,533",Unknown,1 day ago,"For entertainment purposes only. Just one guy's waking dream, right? During quieter moments of profound contemplation - when ...",https://www.youtube.com/watch?v=H_xReIQ8DLo
4,The Danger of AI | Scary Technology | Artificial Intelligence | Documentary,"75,913",Unknown,2 weeks ago,The Danger of AI - An examination of an alternative means to accurately poll for political opinions through an artificial intelligence ...,https://www.youtube.com/watch?v=5guiUrgcblM
5,Is artificial intelligence coming for your job?,"2,711","3 minutes, 29 seconds",1 day ago,For decades people have worried about the rise of robots coming for jobs but rarely does the reality match the concern. Subscribe ...,https://www.youtube.com/watch?v=DPyzVtMs-Vo
6,Artificial intelligence and algorithms: pros and cons | DW Documentary (AI documentary),"10,011,560",Unknown,3 years ago,Developments in artificial intelligence (AI) are leading to fundamental changes in the way we live. Algorithms can already detect ...,https://www.youtube.com/watch?v=s0dMTAQM4cw
7,Steven Spielberg Talks Artificial Intelligence with Stephen Colbert,"63,660","3 minutes, 37 seconds",2 days ago,"In this bonus scene from Stephen Colbert's interview with the director of “The Fabelmans,” Steven Spielberg says one thing ...",https://www.youtube.com/watch?v=tSoCtw5vNS0
8,How Google Is Getting Into the Artificial Intelligence Arms Race,"5,870","9 minutes, 29 seconds",1 day ago,Google Vice President for Trust and Safety Laurie Richardson joins Caroline Hyde and Ed Ludlow to discuss the steps Google is ...,https://www.youtube.com/watch?v=uFyxM0Jlc-c
9,"ChatGPT: Artificial Intelligence, chatbots and a world of unknowns | 60 Minutes","194,439","13 minutes, 22 seconds",4 days ago,"Lesley Stahl speaks with Brad Smith, president of Microsoft, and others about the emerging industry of artificial intelligence ...",https://www.youtube.com/watch?v=1wzPr4cUoMQ
10,SATAN IS THE GREATEST ARTIFICIAL INTELLIGENCE. The Current Danger Facing us is AI vs. BIBLICAL TRUTH,"114,461",Unknown,2 weeks ago,Here's my latest prophetic update on current events. The Bible clearly teaches (1 John 2:18; 4:3) that we can expect this invasion ...,https://www.youtube.com/watch?v=oz2n-rQCWzI
11,Elon Musk Predicts APOCALYPSE after ChatGPT Launch,"67,183","9 minutes, 41 seconds",1 month ago,Race has started between big tech companies and Elon Musk for who is going to bring the best artificial intelligence product to the ...,https://www.youtube.com/watch?v=s6-E5oLRtFI
12,"This intense AI anger is exactly what experts warned of, w Elon Musk.","5,188,055",Unknown,5 months ago,Thanks to Brilliant for sponsoring this video. The surprising benefits of curiosity: ...,https://www.youtube.com/watch?v=b2bdGEqPmCI
13,Google's AI Robot Terrifies Officials Before It Was Quickly Shut Down,"1,300,635",Unknown,1 month ago,"For copyright contact: stienlemane2379(at)gmail.com Welcome to Futureunity, where we explore the fascinating world of science, ...",https://www.youtube.com/watch?v=-cxoGm_Okmo
14,"Generative AI Is About To Reset Everything, And, Yes It Will Change Your Life | Forbes","526,344",Unknown,3 weeks ago,"Whether you like it or not, generative AI like ChatGPT and Stable Diffusion are about to change not only how you work, but how ...",https://www.youtube.com/watch?v=WY518YRfs5M
15,What Is Artificial Intelligence? | Artificial Intelligence (AI) In 10 Minutes | Edureka,"1,123,274","11 minutes, 16 seconds",3 years ago,------------------------------------------------------------------------------------ Instagram: https://www.instagram.com/edureka_learning/ ...,https://www.youtube.com/watch?v=oV74Najm6Nc
16,Artificial Intelligence Indicator PREDICTS The Future ( Zero Loss ),"7,452","8 minutes, 19 seconds",1 day ago,"In this video, we will be exploring a cutting-edge TradingView indicator that uses machine learning and artificial intelligence to ...",https://www.youtube.com/watch?v=7dp9kC2jUIA
17,This is Why MEN Are Falling in LOVE With Artificial Intelligence  | Dr. Jordan Peterson,"3,361","4 minutes, 3 seconds",1 day ago,"In this video, Jordan Peterson shares a shocking truth about the future of AI relationships between men and machines.",https://www.youtube.com/watch?v=AzG8A0c-uU8
18,Elon Musk MOST SHOCKING INTERVIEW With AI!,"348,128","8 minutes, 21 seconds",4 months ago,"Artificial Intelligence has come a long way. Artificial Intelligence is termed as Narrow AI today, with its limited abilities. However ...",https://www.youtube.com/watch?v=dUhvvoVtpVE
19,Artificial Intelligence.,"155,678",Unknown,6 days ago,"Let's talk about Artificial Intelligence, what it is, how it works and where it might be taking us. We'll try and see if as an investor you ...",https://www.youtube.com/watch?v=_iMItrc0ChU
20,The danger of AI is weirder than you think | Janelle Shane,"2,640,576","10 minutes, 30 seconds",3 years ago,"The danger of artificial intelligence isn't that it's going to rebel against us, but that it's going to do exactly what we ask it to do, says ...",https://www.youtube.com/watch?v=OhCzX0iLnOc
21,Can Drunk people Defeat Artificial Intelligence at Chess? | Ok Tested,"11,773","11 minutes, 45 seconds",1 hour ago,Everyone is talking about Artificial intelligence so we thought of challenging AI with our three drunk musketeers. Checkmate!,https://www.youtube.com/watch?v=IPOG-tSSqE8
22,Boston Dynamics' amazing robots Atlas and Handle,"21,235,967","7 minutes, 19 seconds",3 years ago,"Boston Dynamics' amazing robots Atlas and Handle ATLAS® The world's most dynamic humanoid robot, Atlas is a research ...",https://www.youtube.com/watch?v=uhND7Mvp3f4
23,Lo que necesitas aprender para realizar controles IOT desde Cero - Internet de las Cosas,"10,944",Unknown,1 year ago,"El internet de las cosas ""IoT"", es un campo muy amplio y hay varios programas, SDK's, API, plataformas, etc... que les permiten ...",https://www.youtube.com/watch?v=DnwFsyRXbwo
24,Diferencias entre Inteligencia Artificial vs Machine Learning vs Deep Learning,"15,961","6 minutes, 17 seconds",1 year ago,Estos terminos siempre confunden. En este video aclaro las diferencias y su relación con la ciencia de datos. Espero que te ...,https://www.youtube.com/watch?v=7WTEWyn9zfU
25,¿Qué es y cómo funciona la INTELIGENCIA ARTIFICIAL?,"635,282","8 minutes, 33 seconds",1 year ago,"Qué es la inteligencia artificial? , ¿cómo funciona?, ¿se parece a una inteligencia humana? ¡Vamos a verlo! ¡Suscríbete al canal!",https://www.youtube.com/watch?v=_tA5cinv0U8
26,Artificial Intelligence (Official Video),"1,631,895","4 minutes, 1 second",1 year ago,"The robots are getting smarter, check out this album version to one of my favourite little songs. Me Profile on Spotify ...",https://www.youtube.com/watch?v=uTl8ZYImjBQ
27,Artificial Intelligence Full Course | Artificial Intelligence Tutorial for Beginners | Edureka,"2,746,758","4 hours, 52 minutes",3 years ago,Following topics are covered in this video: 00:00 Introduction 02:27 History Of AI 06:45 Demand For AI 08:46 What Is Artificial ...,https://www.youtube.com/watch?v=JMUxmLyrhSk
28,"Artificial Intelligence, then vs. now","91,824",Unknown,3 days ago,the miracles of technology (this video was not written by AI) Twitter: https://twitter.com/ManCarrying Our second channel: ...,https://www.youtube.com/watch?v=KzvgUxTUQZ8
29,Use of Artificial intelligence generates questions about the future of art,"31,191","8 minutes, 38 seconds",7 days ago,"Artificial intelligence is everywhere and part of our conversations about education, politics and social media. It's also a hot topic in ...",https://www.youtube.com/watch?v=2HYemjTSxp8
30,Google Just Shut Down It's Artificial Intelligence After It Revealed This,"1,064,746","10 minutes, 38 seconds",4 months ago,"For copyright contact: stienlemane2379(at)gmail.com Welcome to Futureunity, where we explore the fascinating world of science, ...",https://www.youtube.com/watch?v=w-Q9PWz_8sM
31,What Is Artificial Intelligence? | 🔥Artificial Intelligence Course | AI In 5 Minutes | |Simplilearn,"1,166,565","5 minutes, 28 seconds",3 years ago,"This video on ""What is Artificial Intelligence?"" will help you learn Artificial Intelligence in 5 minutes and introduce you to Artificial ...",https://www.youtube.com/watch?v=ad79nYk2keg
32,How will AI change the world?,"730,358","5 minutes, 56 seconds",3 months ago,Explore the current limitations of artificial intelligence and the possibility of creating human-compatible technology. -- In the ...,https://www.youtube.com/watch?v=RzkD_rTEBYs
33,Demons manifested through Artificial Intelligence (AI) - Sam Shamoun,unknown,"8 minutes, 2 seconds",14 hours ago,"christianity #demons #chatgpt #samshamoun Diving deep into the discussion on the manifestation of demons through AI, ...",https://www.youtube.com/watch?v=Yt14Wq7PXBc
34,ADA CARDANO Price Prediction Done By ARTIFICIAL INTELLIGENCE!,"2,134","3 minutes, 48 seconds",16 hours ago,ADA CARDANO Price Prediction Done By ARTIFICIAL INTELLIGENCE! WHERE IS THE PRICE OF CARDANO HEADING NEXT?,https://www.youtube.com/watch?v=0-xADccFDCs
35,A.I. Artificial Intelligence - Official® Trailer [HD],"2,068,904","1 minute, 10 seconds",9 years ago,"Release Date: June 29, 2001 It's the mid-21st century and man has developed a new type of computer that is aware of its own ...",https://www.youtube.com/watch?v=_19pRsZRiz4
36,AI ప్రపంచాన్ని అంతం చేస్తుందా? || HOW ARTIFICIAL INTELLIGENCE WORK? || iNews,"1,246","6 minutes, 14 seconds",5 hours ago,AI ప్రపంచాన్ని అంతం చేస్తుందా? || HOW ARTIFICIAL INTELLIGENCE WORK? || iNews #inews ...,https://www.youtube.com/watch?v=SQfE2pCq5rU
37,Finance & Audit Automation with Data Analytics & Artificial Intelligence,109,"3 hours, 6 minutes",9 hours ago,Unknown,https://www.youtube.com/watch?v=zjbJyHUkmys
38,B.Tech Artificial Intelligence & DataScience|No.1 Course of 2023|Top 10 TNEA 2023 Colleges List|DP,975,"14 minutes, 31 seconds",3 hours ago,dineshprabhu #artificialintelligence #datascience #tnea2023 #btech #btechArtificialIntelligence&datascience #btechAids #cse ...,https://www.youtube.com/watch?v=EL3s9wRmwNs
39,THE USER FRIENDLY ARTIFICIAL INTELLIGENCE ECOSYSTEM BY #ONPASSIVE - Bill Must,"1,022",Unknown,22 hours ago,ONPASSIVE #OFounders #BillMust #Burjkhalifa #ONPASSIVE is the Emerging IT Company that renders information technology ...,https://www.youtube.com/watch?v=h7jo7scB5c8
40,CSE481 - Artificial Intelligence Lecture 2,unknown,"1 hour, 34 minutes",3 hours ago,Unknown,https://www.youtube.com/watch?v=5Mn-ToR9fGI
41,What is Artificial Intelligence? | ChatGPT | The Dr Binocs Show | Peekaboo Kidz,"239,258","5 minutes, 42 seconds",1 month ago,What is Artificial Intelligence? | AI | ChatGPT | AI System | Artificial Intelligence | Robot | Chatbot | Computer | Computer-Controlled ...,https://www.youtube.com/watch?v=ttIOdAdQaUE
42,SHAQ's BIG AI Play! | Artificial Intelligence,230,"10 minutes, 27 seconds",15 hours ago,Shaquille O'Neal's BIG AI Play! Shaq the successful businessman is worth over $400 Million Dollars and Invests in companies he ...,https://www.youtube.com/watch?v=DKYNkMu5QLE
43,"The Craze and Foundation of Artificial Intelligence - Davidy Ly, CEO of Iveda Solutions",14,"9 minutes, 1 second",2 hours ago,"Sully Sullivan and Mike Costa talk with David Ly, CEO & Founder of Iveda Solutions. David talks about the craze of AI and the ...",https://www.youtube.com/watch?v=j_QqhxQzp_o
44,The Future is Now: How Artificial Intelligence is Our World 🌎,unknown,"3 minutes, 55 seconds",47 minutes ago,"In this video, we explore the incredible ways in which Artificial Intelligence (AI) is transforming our world. Through the story of a ...",https://www.youtube.com/watch?v=_GXFp12EKIE
45,Midjourney: Art in the Age of Artificial Intelligence,131,"6 minutes, 35 seconds",3 hours ago,Welcome to the mid-journey update on AI art! Midjourney AI Art is a creative exploration of the intersection between art and ...,https://www.youtube.com/watch?v=L0NBQzy39EQ
46,What Is Artificial Intelligence? How Should AI Be Regulated Without Hobbling Innovation?,344,Unknown,16 hours ago,"Over the last several years, rapid strides have been made in Artificial Intelligence. Regulations though have not kept pace. The AI ...",https://www.youtube.com/watch?v=w-eQVDxdzqg
47,Artificial Intelligence based Disease Detection Without Human Touch,unknown,"2 minutes, 15 seconds",23 minutes ago,Artificial Intelligence based disease detection without human touch is a revolutionary technique in the field of healthcare.,https://www.youtube.com/watch?v=TIRdJyf6SB0
48,What college students think of Artificial Intelligence | IIT Delhi,162,Unknown,3 hours ago,Unknown,https://www.youtube.com/shorts/qdHqwEi6xu0
49,How Artificial Intelligence is Changing Our World: Can We Keep Up? | Ep 673,"2,248",Unknown,2 days ago,"Artificial intelligence (AI) is transforming our world at an unprecedented pace, but can humanity keep up?",https://www.youtube.com/watch?v=-PztBI2lG54
50,The AI Singularity Is Already Here.. (Artificial Intelligence Singularity) Technological Singularity,"79,305","12 minutes, 58 seconds",1 month ago,"What if the AI Singularity actually happened? Robots are seemingly already smarter than us, in this video we explain the ...",https://www.youtube.com/watch?v=JT5q7u7xxNU
51,Big Ideas 2023 | Artificial Intelligence: Creating the Assembly Line for Knowledge Workers,"19,450","11 minutes, 55 seconds",4 days ago,"Generative AI made waves this year, from DALL-E-2 to ChatGPT. These tools are improving the productivity of knowledge ...",https://www.youtube.com/watch?v=TogDlICXfAU
52,The Dangers Of Superintelligence (Artificial Intelligence.),"2,906",Unknown,11 days ago,The Dangers Of Superintelligence (Artificial Intelligence.),https://www.youtube.com/watch?v=vsty2r189QI
53,What is AI? Artificial Intelligence Explained,"288,085","3 minutes, 31 seconds",1 year ago,Java Placement Course : https://www.youtube.com/watch?v=yRpLlJmRo2w&list=PLfqMhTWNBTe3LtFWcvwpqTkUSlB32kJop ...,https://www.youtube.com/watch?v=rJ1Qao09CFI
54,SINGULARITY TIMELINE | ARTIFICIAL INTELLIGENCE + AGI + ASI (2023 - 2100¹⁰⁰),"337,314","10 minutes, 39 seconds",2 months ago,AI News Timestamps: 0:00 Introduction 0:20 2023 OpenAI Releases GPT-4 Artificial Intelligence 1:12 2026 Artificial General ...,https://www.youtube.com/watch?v=P5HNeahRYDM
55,Elon Musk MOST SHOCKING INTERVIEW With AI!,"348,128","8 minutes, 21 seconds",4 months ago,"Artificial Intelligence has come a long way. Artificial Intelligence is termed as Narrow AI today, with its limited abilities. However ...",https://www.youtube.com/watch?v=dUhvvoVtpVE
56,The Great Arms Race of Artificial Intelligence - Losing Our Grip On Reality,"53,805",Unknown,2 weeks ago,"Over the past few years, in the shadow of exponentially developing technology... Humanity has come to a crossroads where ...",https://www.youtube.com/watch?v=USH9xtxz-vU
57,Planned Economies And Artificial Intelligence: A short rant | Mia Mulder,"63,803",Unknown,8 days ago,Adamandeve.com Code: MIA 50% off 1 item + free shipping in the US and Canada. Some restrictions apply ChatGPT is changing ...,https://www.youtube.com/watch?v=NRepEvmCCIg
58,Elon Musk on Artificial Intelligence Implications and Consequences,"19,302",Unknown,3 months ago,Elon Musk on Artificial Intelligence Implications and Consequences The prediction marks a significant revision of previous ...,https://www.youtube.com/watch?v=sAUpoJixwZg
59,What is artificial intelligence? - BBC News,"379,795","1 minute, 58 seconds",7 years ago,The BBC's quick guide to artificial intelligence. Subscribe to BBC News HERE http://bit.ly/1rbfUog Check out our website: ...,https://www.youtube.com/watch?v=fvtrRGmv7aU
60,Jordan Peterson's Disturbing Warning About AI and ChatGPT...,"722,818","5 minutes, 40 seconds",2 months ago,"Jordan Peterson's Disturbing Warning About AI and ChatGPT... Jordan Peterson recently spoke on the power of AI, particularly the ...",https://www.youtube.com/watch?v=mUkTz_1uzSs
61,Jordan Peterson’s Thoughts on Artificial Intelligence,"141,015","10 minutes, 31 seconds",1 month ago,#JordanPeterson #JordanBPeterson #DrJordanPeterson #DrJordanBPeterson #DailyWirePlus #podcast #news.,https://www.youtube.com/watch?v=k0lOL5Q58Ls
62,How China Is Using Artificial Intelligence in Classrooms | WSJ,"2,756,168","5 minutes, 44 seconds",3 years ago,A growing number of classrooms in China are equipped with artificial-intelligence cameras and brain-wave trackers. While many ...,https://www.youtube.com/watch?v=JMLsHI8aV0g
63,What is Artificial Intelligence With Full Information? – [Hindi] – Quick Support,"1,127,863","10 minutes, 50 seconds",2 years ago,WhatisArtificialIntelligence #QuickSupport #Innovation What is Artificial Intelligence With Full Information? – [Hindi] – Quick ...,https://www.youtube.com/watch?v=iyb38dzetRk
64,learning AI and ChatGPT isn’t that hard,"202,545",Unknown,9 days ago,"No matter where you are in your journey, you can start learning machine learning and Artificial Intelligence. In this video ...",https://www.youtube.com/watch?v=JJCq21Dc-Us
65,Warp Records - Artificial Intelligence (Full Album),"50,097",Unknown,2 months ago,The Dice Man - Polygon Window 00:00 - 05:12 Musicology - Telefone 529 05:12 - 09:22 Autechre - Crystel 09:22 - 14:00 I.A.O ...,https://www.youtube.com/watch?v=jaysR-sashY
66,NEW Artificial Intelligence TradingView Indicator Never Loses,"184,224","8 minutes, 3 seconds",1 month ago,"This video is related to AI Trading, Trading Bot, Trading Robot, ChatGPT, Artificial Intelligence Trading, Scalping Trading Strategy, ...",https://www.youtube.com/watch?v=vz5VEd9eJFU
67,"Epicuros - Artificial Intelligence vol.2 (PsyChill, Electronica, New Age)","204,945","1 hour, 30 minutes",8 years ago,"""It's too bad she won't live! But then again, who does? "" ― Gaff Mixcloud: ...",https://www.youtube.com/watch?v=FN9WmeF7F60
68,This Artificial Intelligence Just Found That Our DNA Holds A Secret Message Inside Of It,"34,099","13 minutes, 42 seconds",13 days ago,"This artificial intelligence just found that our DNA holds a secret message inside of it. Today, we take a look at what our DNA holds ...",https://www.youtube.com/watch?v=uJgWOdB-W0c
69,Artificial Intelligence can NEVER be Sentient?! #technology #artificialintelligence #ai,"6,901,657",Unknown,2 months ago,... called the Chinese room a famous thought experiment created by John Searle to criticize the idea of strong artificial intelligence ...,https://www.youtube.com/shorts/aO1qDzkU9o0
70,End Game - Technology | Dystopian Future | Machine Learning | Artificial Intelligence,"469,246","1 hour, 4 minutes",3 months ago,End Game - Technology - An investigation into the advancements in digital technology unique to the gaming industry. They can ...,https://www.youtube.com/watch?v=-ZeeuDrknYc
71,Artificial Intelligence scammers using voices of loved ones to target victims,"4,230","2 minutes, 32 seconds",2 days ago,The latest internet monster voice cloning is on the loose and targeting victims where scammers call and use a voice that sounds ...,https://www.youtube.com/watch?v=xRZIdepFoTM
72,क्या ARTIFICIAL INTELLIGENCE हम सभी को ख़तम करदेगा? | WIll AI Kill Us All...,"2,179,425","11 minutes, 59 seconds",1 year ago,"|Hello friends, did you know? Robots are planning to destroy all human beings in the world? Yeah, I am not kidding!! Just like in ...",https://www.youtube.com/watch?v=jqVlmaZIX4U
73,Is artificial intelligence out of control? | Start Here,"280,624","11 minutes, 14 seconds",8 months ago,Artificial intelligence is becoming “like electricity”— it's being used in almost every sector. But what exactly is it? And why are many ...,https://www.youtube.com/watch?v=PATxJ-wwcUY
74,What ChatGPT Could Mean for the Future of Artificial Intelligence,"3,716,326","14 minutes, 15 seconds",2 months ago,Taken from JRE #1919 w/Bret Weinstein: https://open.spotify.com/episode/1fCp0jGnwvxHJVPiXTfOzA?si=eb9360af79b142d7.,https://www.youtube.com/watch?v=kh5dN72GTQ8
75,What is Artificial Intelligence (or Machine Learning)?,"1,084,130","6 minutes, 15 seconds",6 years ago,"Let's break down the basics of artificial intelligence, bots, and machine learning. Besides, there's nothing that will impact ...",https://www.youtube.com/watch?v=mJeNghZXtMo
76,Artificial Intelligence,"3,292,373","11 minutes, 47 seconds",6 years ago,Both paragraphs at 5:50 were written by an AI.,https://www.youtube.com/watch?v=5J5bDQHQR1g
77,How does artificial intelligence learn? - Briana Brownell,"474,068","4 minutes, 57 seconds",1 year ago,"Explore the three major methods of machine learning, which allows computers to write their own rules to problem solve and ...",https://www.youtube.com/watch?v=0yCJMt9Mx9c
78,Why OpenAI’s ChatGPT Is Such A Big Deal,"1,361,824","12 minutes, 53 seconds",1 month ago,"In under a week, the artificial intelligence model amassed over a million users, according to OpenAI's CEO, Sam Altman. By the ...",https://www.youtube.com/watch?v=pOmpqdlVCoo
79,"What Microsoft, Google and OpenAI don't want you to know about artificial intelligence #shorts","3,517",Unknown,3 days ago,Real Vision Group Founder & CEO Raol Pal spoke with Yahoo Finance's Jared Blikre about the open-source A.I. platform Stability ...,https://www.youtube.com/shorts/tDf7PWdSA7I
80,Wife Cheats with Artificial Intelligence (ChatGPT) - SHOCKING FOOTAGE!,"20,489",Unknown,6 days ago,#SameerBhavnani #ChatGPT #LifeLessons #PositiveMessage #Inspirational.,https://www.youtube.com/watch?v=qhYWn9-IFYE
81,Artificial Intelligence - Eastern Surprise,"24,989","4 minutes, 37 seconds",8 days ago,--- » Connect with Artificial Intelligence Facebook → https://www.facebook.com/Artificialintelligenceuk Instagram ...,https://www.youtube.com/watch?v=xDdtOpRyXhI
82,Google Just SHUT DOWN It's Artificial Intelligence After It Sent Out This Chilling Message,"339,566","11 minutes, 32 seconds",3 months ago,"In the field of artificial intelligence, there are a lot of different perspectives to consider. Is it viable to build intelligent machines ...",https://www.youtube.com/watch?v=sSPKt5xNHSU
83,Cuco - Artificial Intelligence (Official Visualizer),"155,869","4 minutes, 21 seconds",7 months ago,Cuco - Artificial Intelligence (Official Visualizer) Listen to “Artificial Intelligence” from the new album “Fantasy Gateway”: ...,https://www.youtube.com/watch?v=-86zfUqS-L8
84,I tried using AI. It scared me.,"5,477,533",Unknown,3 weeks ago,"Script assistant: Laura Conlon No AI assistance was used, except where noted. ALTERNATE TITLES: Crypto and the metaverse ...",https://www.youtube.com/watch?v=jPhJbKBuNnA
85,AI is Becoming Conscious! ELON MUSK was Right About The Greatest Threat To Humanity,"1,235,396","12 minutes, 11 seconds",3 months ago,"AI i.e Artificial intelligence is getting more conscious day by day. With the arrival of Machine learning, This consciousness has ...",https://www.youtube.com/watch?v=R4iJMIgj6ZI
86,Artificial Intelligence Raises Concerns in Higher Education,174,"4 minutes, 7 seconds",2 days ago,"We explore the challenges and ethics of AI-generated essays in higher education, and efforts to promote responsible AI usage ...",https://www.youtube.com/watch?v=lmkIpBdSe5E
87,Computer Scientist Explains Machine Learning in 5 Levels of Difficulty | WIRED,"1,726,583",Unknown,1 year ago,WIRED has challenged computer scientist and Hidden Door cofounder and CEO Hilary Mason to explain machine learning to 5 ...,https://www.youtube.com/watch?v=5q87K1WaoFI
88,Testing the limits of ChatGPT and discovering a dark side,"528,568","10 minutes, 55 seconds",3 weeks ago,"As more people discover ChatGPT's artificial intelligence, KARE 11's Chris Hrapsky checks out its capabilities and limitations, and ...",https://www.youtube.com/watch?v=RdAQnkDzGvc
89,5 Mind-blowing Artificial Intelligence Tools 🤯,"1,112,005","11 minutes, 2 seconds",2 months ago,"Are you looking for ways to make your work easier, more efficient, and fun? Check out this video to learn about 5 unbelievable AI ...",https://www.youtube.com/watch?v=v6OB80Vt1Dk
90,The Future of Artificial Intelligence: Crash Course AI #20,"178,229",Unknown,3 years ago,"Today, in our final episode of Crash Course AI, we're going to look towards the future. We've spent much of this series explaining ...",https://www.youtube.com/watch?v=T7Rv4tGRlfc
91,Artificial Intelligence: it will kill us | Jay Tuck | TEDxHamburgSalon,"5,178,575",Unknown,6 years ago,"For more information on Jay Tuck, please visit our website www.tedxhamburg.de US defense expert Jay Tuck was news director ...",https://www.youtube.com/watch?v=BrNs0M77Pd4
