,Name,views,duration,date,description,link
92,"He Paid $10,000 to UNALIVE Himself! #artificialintelligence #technology #ai","1,806,034",Unknown,1 month ago,Unknown,https://www.youtube.com/shorts/4rmJFNm0pLY
93,Artificial Intelligence: Entrepreneur creates an AI platform to pre-diagnose chest conditions,157,"5 minutes, 57 seconds",1 day ago,Artificial Intelligence: Enterpreneur creates AI platform to pre-diagnose chest conditions - Market Place #TheMarketPlace ...,https://www.youtube.com/watch?v=q604x5D7d-w
94,Cuco - Artificial Intelligence (Sub. Español) // Lyrics,"23,628","4 minutes, 21 seconds",7 months ago,Sígueme en: Instagram: https://instagram.com/here_4u____?igshid=YmMyMTA2M2Y= Recomendaciones al DM en mi instagram.,https://www.youtube.com/watch?v=nQIgK2XC3Kg
95,"Future of Artificial Intelligence (2030 - 10,000 A.D.+)","47,425","13 minutes, 21 seconds",6 months ago,___ Official Discord Server: https://discord.gg/R8cYEWpCzK ___ Future Business Tech explores the future of technology and ...,https://www.youtube.com/watch?v=cwXnX49Bofk
96,AI VS ML VS DL VS Data Science,"2,470,433","9 minutes, 45 seconds",3 years ago,Please do subscribe my vlogging channel for motivational videos ...,https://www.youtube.com/watch?v=k2P_pHQDlp0
97,"2023 03 05 John Haller's Prophecy Update Artificial Intelligence, NOT Real Wisdom”","11,111","1 hour, 29 minutes",4 days ago,Unknown,https://www.youtube.com/watch?v=6kZGHICZG6Y
98,Artificial intelligence aids in lung cancer detection,235,"1 minute, 37 seconds",1 day ago,"Researchers have found a way to predict lung cancer risk using an artificial intelligence, or AI tool.",https://www.youtube.com/watch?v=gd-il2euRX8
99,Artificial intelligence could create more jobs than it displaces,"6,172","6 minutes, 52 seconds",3 weeks ago,The recent wave of artificial intelligence advancements has stirred up concern about the threat it poses to white-collar jobs.,https://www.youtube.com/watch?v=EmO6dBcqQ2w
100,The Real Reason to be Afraid of Artificial Intelligence | Peter Haas | TEDxDirigo,"2,385,679","12 minutes, 38 seconds",5 years ago,"A robotics researcher afraid of robots, Peter Haas, invites us into his world of understand where the threats of robots and artificial ...",https://www.youtube.com/watch?v=TRzBk_KuIaM
101,"Doctors, apps and artificial intelligence - The future of medicine | DW Documentary","39,506",Unknown,2 months ago,Artificial intelligence is changing health care. It promises better diagnoses and fewer mistakes and all in less time. While some ...,https://www.youtube.com/watch?v=vyit-1zKsZ4
102,KSP: Conquering Jool using Artificial Intelligence!,"124,440",Unknown,2 days ago,"Inspired by a reddit post and the recent uptick of AI related videos and posts, I decided to have a go asking ChatGPT if it could ...",https://www.youtube.com/watch?v=OEg6XuXVsdM
103,Mumdance - Artificial Intelligence,"1,671","5 minutes, 59 seconds",3 months ago,"The first in a new series of Mumdance two-trackers that I'm releasing throughout the next year on MD Dubs - a new, no frills ...",https://www.youtube.com/watch?v=x153zVRPd7s
104,AI is Becoming Conscious! ELON MUSK was Right About The Greatest Threat To Humanity,"1,235,396","12 minutes, 11 seconds",3 months ago,"AI i.e Artificial intelligence is getting more conscious day by day. With the arrival of Machine learning, This consciousness has ...",https://www.youtube.com/watch?v=R4iJMIgj6ZI
105,"Eye on America: The future of artificial intelligence, tips for cutting energy costs and more","1,441",Unknown,3 days ago,We sit down with Microsoft CEO Satya Nadella for a peek at the very near future of artificial intelligence. And we learn ...,https://www.youtube.com/watch?v=03tPZ1mkKQU
106,SATAN IS THE GREATEST ARTIFICIAL INTELLIGENCE. The Current Danger Facing us is AI vs. BIBLICAL TRUTH,"114,461",Unknown,2 weeks ago,Here's my latest prophetic update on current events. The Bible clearly teaches (1 John 2:18; 4:3) that we can expect this invasion ...,https://www.youtube.com/watch?v=oz2n-rQCWzI
107,Therapist vs. Artificial Intelligence - I answer your questions #chatgpt #mentalhealth,"19,824",Unknown,7 days ago,Can Chat GPT handle complex questions about mental health? Could Artificial Intelligence do a therapist's job someday?,https://www.youtube.com/watch?v=gIVSJDVQRf8
108,Making Sense of Artificial Intelligence,"37,133","1 hour, 7 minutes",3 months ago,"Filmmaker Jay Shapiro has produced a new series of audio documentaries, exploring the major topics that Sam has focused on ...",https://www.youtube.com/watch?v=zhpiVCQJTw8
109,The 8 Biggest Artificial Intelligence (AI) Trends In 2022,"61,832","7 minutes, 22 seconds",1 year ago,"In this video, we look at the eight biggest trends in the field of AI and machine learning. We cover the innovations around natural ...",https://www.youtube.com/watch?v=019HlWMQKCE
110,A* algorithm in AI (artificial intelligence) in HINDI | A* algorithm with example,"883,147","14 minutes, 34 seconds",3 years ago,"Join Scaler Academy by InterviewBit, India's 1st job-driven online tech-versity. Accelerate your tech skills in 6-months and land a ...",https://www.youtube.com/watch?v=tvAh0JZF2YE
111,Artificial Intelligence KILLED the Internet!? #ai #technology,"1,095,078",Unknown,1 month ago,... from the Copenhagen Institute for future studies predicts that by 2026 99 of the internet will be generated by artificial intelligence ...,https://www.youtube.com/shorts/JpBBY1HbT54
112,AI generates “HUMAN EVOLUTION”.... 😳✅ Artificial Intelligence #shorts,"6,792,475",Unknown,3 months ago,"BUSINESS EMAIL CONTACT : janisstrazdins14@gmail.com TWITTER: https://twitter.com/johnsavage_eth In the past few years, ...",https://www.youtube.com/shorts/bG4WzJv2u-U
113,Elon Musk AI Warning... (Artificial Intelligence) 😳✅ #shorts,"1,627,341",Unknown,3 months ago,Elon Musk Warns Us About AI... ✓ #artificialintelligence BUSINESS EMAIL CONTACT : janisstrazdins14@gmail.com TWITTER: ...,https://www.youtube.com/shorts/an2TNoBdzbw
114,TIMELAPSE OF ARTIFICIAL INTELLIGENCE (2028 – 3000+),"1,827,495","13 minutes, 35 seconds",1 year ago,A documentary and journey into the future exploring the possibilities and predictions of artificial intelligence. This timelapse of the ...,https://www.youtube.com/watch?v=63yr9dlI0cU
115,ARTIFICIAL INTELLIGENCE IS BECOMING CONSCIOUS| ELON MUSK IS RIGHT|ELON MUSK TESLA BOT /OPEN AI,"1,544,462","13 minutes, 28 seconds",7 months ago,ARTIFICIAL INTELLIGENCE IS BECOMING CONSCIOUS| ELON MUSK IS RIGHT|ELON MUSK TESLA BOT /OPEN AI We talked ...,https://www.youtube.com/watch?v=kPJNE1p7uT0
116,The Hot & Trending 🔥 | Artificial Intelligence | Top Colleges in Tamilnadu | $300 Billion Market,"19,357",Unknown,6 days ago,R.ASHWIN CAREER GUIDANCE EXPERT & ANALYST AN ALUMNUS OF NIT WARANGAL Write to ...,https://www.youtube.com/watch?v=8RBwR0mk6C4
117,Intelligence composed of | Artificial Intelligence | Lec-3| Bhanu Priya,"107,805","6 minutes, 2 seconds",3 years ago,"composed of Reasoning, learning,perception,problem solving &linguistic Intelligence.",https://www.youtube.com/watch?v=uMWaOv9-oHo
118,Artificial Intelligence Art School Meltdown | The Looming Crisis | Episode 128 | Elliott Earls,"7,143","13 minutes, 6 seconds",5 days ago,"Welcome to our latest video, where we explore the impending crisis that the art world is facing - the rise of artificial intelligence in ...",https://www.youtube.com/watch?v=t_5OXKMutWA
119,Artificial Intelligence in 2 Minutes | What is Artificial Intelligence? | Edureka,"255,484","2 minutes, 20 seconds",2 years ago,"Become an expert in the exciting new world of AI & Machine Learning, get trained in cutting edge technologies and work on ...",https://www.youtube.com/watch?v=UFDOY1wOOz0
120,How will Artificial Intelligence and Internet of Things change the world?,"211,051","2 minutes, 32 seconds",5 years ago,gis #AI #IoT Video Courtesy- 1. TIA NOW 2. LinkedIn Learning Solutions 3. AT&T Business 4. Qualcomm 5. Prime Minister's Office ...,https://www.youtube.com/watch?v=Cx5aNwnZYDc
121,Breakthroughs in artificial intelligence mean new work for Congress,"9,957","11 minutes, 46 seconds",2 weeks ago,NBC News Senior Congressional correspondent Scott Wong and New York Times technology columnist Kevin Roose join Meet ...,https://www.youtube.com/watch?v=U0dyNYRuxXk
122,Here's how artificial intelligence is changing the job market,"62,484","6 minutes, 15 seconds",1 month ago,"ChatGPT, a natural-language-processing tool driven by artificial intelligence, just passed the US medical licensing exam.",https://www.youtube.com/watch?v=6Ep8c9xNEiE
123,Is Artificial Intelligence Sentient?! #artificialintelligence #ai #technology,"154,964",Unknown,3 months ago,Unknown,https://www.youtube.com/shorts/SNApNsdxbNg
124,"This intense AI anger is exactly what experts warned of, w Elon Musk.","5,188,055",Unknown,5 months ago,Thanks to Brilliant for sponsoring this video. The surprising benefits of curiosity: ...,https://www.youtube.com/watch?v=b2bdGEqPmCI
125,What Skills Are Required For An Artificial Intelligence Engineer?,"70,810","11 minutes, 13 seconds",1 year ago,✓ Subscribe To Our Other YouTube Channels:- BeerBiceps (English Channel): https://www.youtube.com/c/BeerBicepsOfficial ...,https://www.youtube.com/watch?v=mp3TS_Me3Kw
126,Artificial Intelligence Full Course in 10 Hours  [2023] | Artificial Intelligence Tutorial | Edureka,"8,425","9 hours, 53 minutes",2 weeks ago,Edureka Online Training and Certifications DevOps Online Training: ...,https://www.youtube.com/watch?v=VOaoabf3LPM
127,How to make videos with AI (artificial intelligence) 🎥🧍Helpful Websites: Episode 68 #video #AI,"82,492",Unknown,6 months ago,Unknown,https://www.youtube.com/shorts/4HebMLsb_kM
128,Proof That Artificial Intelligence Is About To End The World...,"90,043",Unknown,13 days ago,"This AI was hidden on the dark web... So, if you are ready, Let's go down This Rabbit Hole. #caimeo #conspiracy *Join this ...",https://www.youtube.com/shorts/txoNadnlKmA
129,ChatGPT: Grading artificial intelligence's writing,"163,431","8 minutes, 3 seconds",1 month ago,"OpenAI's artificial intelligence writing program ChatGPT will, with a few prompts, compose poetry, prose, song lyrics, essays, even ...",https://www.youtube.com/watch?v=2MZs44gSIwg
130,1. Artificial Intelligence and Machine Learning,"554,495","1 hour, 14 minutes",2 years ago,"This lecture provided an overview on artificial intelligence and took a deep dive on machine learning, including supervised ...",https://www.youtube.com/watch?v=t4K6lney7Zw
131,You are training Artificial Intelligence,"1,426,212",Unknown,4 months ago,Unknown,https://www.youtube.com/shorts/BGx248wSzEE
132,Charlie Creates xQc With Artificial Intelligence | Moistcr1tikal,"1,818,496",Unknown,6 months ago,The original content creator is Moistcr1tikal on Twitch! #moistcr1tikal #penguinz0 #xqc #artificialintelligence.,https://www.youtube.com/shorts/GXTbZmzeubo
133,Artificial Intelligence(AI) & Journalism,"2,614","5 minutes, 1 second",5 years ago,Please support us by sharing our video I hope you enjoy watching the video. Ksu students: Abeer Alghanim Rawan Albuwaired ...,https://www.youtube.com/watch?v=dnbt_BaM7BU
134,Robots Have the Best Answers to Hard Magic Questions | Artificial Intelligence | ChatGPT | EDH | MTG,"4,694",Unknown,4 days ago,The Commander's Quarters is your Magic the Gathering source that helps you Command Your Budget! What is the Best Magic ...,https://www.youtube.com/watch?v=niWtCiYW16M
135,AI আসলে কি ? || what is artificial intelligence (ai) ?,"31,875","5 minutes, 23 seconds",4 years ago,"AI আসলে কি ? || what is artificial intelligence (ai) ? Share, Support, Subscribe!!! Youtube: ...",https://www.youtube.com/watch?v=9JVc06hC1RQ
136,The Scariest Thing about Artificial Intelligence #artificialintelligence #technology #ai,"914,210",Unknown,1 month ago,Scariest thing about a super powerful artificial intelligence can be summed up in the paperclip maximizer now hear me out if you ...,https://www.youtube.com/shorts/rmjjUyGK-J8
137,Twitch Chat and I invaded Space with Artificial Intelligence,"2,290,795","1 hour, 5 minutes",4 months ago,The great A.I. battle for the Solar System. Streaming live on Twitch! https://www.twitch.tv/dougdoug Full stream recording: ...,https://www.youtube.com/watch?v=dazC6msRuJw
138,Vger ARTIFICIAL INTELLIGENCE CD teaser,"84,756","6 minutes, 58 seconds",2 months ago,"Teaser of the CD album ""ARTIFICIAL INTELLIGENCE"" available in CD and on all digital platforms. Available for download with ...",https://www.youtube.com/watch?v=5lUgeUeqSLg
139,"How AIs, like ChatGPT, Learn","8,275,173","8 minutes, 55 seconds",5 years ago,"How do all the algorithms, like ChatGPT & Bing, around us learn to do their jobs? **OMG PLUSHIE BOTS!",https://www.youtube.com/watch?v=R9OHn5ZF4Uo
140,"A * search Algorithm \ A star  search algorithm in bangla | Artificial Intelligence tutorial bangla,","26,489",Unknown,3 years ago,a star search algorithm \ a * search algorithm in bangla | artificial intelligence tutorial bangla\ a * search \ a star search. In this ...,https://www.youtube.com/watch?v=OCDC62vJUeQ
141,Artificial Intelligence Becomes Sentient #ai #technology #artificialintelligence,"1,052,407",Unknown,1 month ago,... a real human and which one is artificial intelligence you can ask them any questions you like you can play games with them you ...,https://www.youtube.com/shorts/OVWpuATUjis
142,"Supervised, Unsupervised and Reinforcement Learning in Artificial Intelligence in Hindi","593,501","9 minutes, 28 seconds",3 years ago,Supervised Learning Unsupervised Learning Reinforcement Learning Training Data Only Inputs Reward/Penalty Both Inputs ...,https://www.youtube.com/watch?v=4dwsSz_fNSQ
143,"AI robot terrifies officials, explains our illusion, with Elon Musk.","7,018,090",Unknown,3 months ago,Thanks to Brilliant for sponsoring this video. To stay at the stunning Appleby Castle: http://applebycastle.org For custom nerf ...,https://www.youtube.com/watch?v=zKUA72Ka0zA
144,AI Fitnes Review | Decentralized Fitness Ecosystem Powered By Artificial Intelligence,"7,718","7 minutes, 29 seconds",1 day ago,AI Fitnes Review | Decentralized Fitness Ecosystem Powered By Artificial Intelligence AiFitnes is a decentralized ecosystem for ...,https://www.youtube.com/watch?v=k6dSuETi2Kk
145,Artificial Intelligence Trailer HQ (2001),"501,435","2 minutes, 25 seconds",14 years ago,Director: Steven Spielberg Cast: Haley Joel Osment; William Hurt; Jude Law; Frances O'Connor. Plot: A highly advanced robotic ...,https://www.youtube.com/watch?v=ECGnWoQgz6Q
146,The world is running OUT OF TIME #technology #elonmusk #artificialintelligence,"2,776,650",Unknown,4 months ago,... over 100 artificial intelligence experts signed a letter in 2015 expressing concern over the risk artificial intelligence possesses ...,https://www.youtube.com/shorts/gqXTs-1ZEfg
147,Artificial Intelligence - State Of Mind (Spheres of Life),"1,448","4 minutes, 7 seconds",1 month ago,Artificial Intelligence return to the legendary Metalheadz with the State Of Mind EP. ♕ Free Download: Dialective - Valid ...,https://www.youtube.com/watch?v=Q6cRW-i_3Qw
148,Preparing for a future with Artificial Intelligence | Robin Winsor | TEDxYYC,"506,115",Unknown,4 years ago,"It's often said that history repeats itself. Many times in the course of our history, new technologies have wiped out entire workforces ...",https://www.youtube.com/watch?v=f7dhOHMX0js
149,when Ai turned against us #technology #elonmusk #artificialintelligence,"5,806,705",Unknown,3 months ago,Unknown,https://www.youtube.com/shorts/uc0Iwld0Jgk
150,I ask Chat GPT Artificial Intelligence about the end times and salvation. Its answers may shock you,"8,049","11 minutes, 52 seconds",5 days ago,In this video we ask Chat Gpt Artificial Intelligence Software about the end times and salvation. And its answers just may surprise ...,https://www.youtube.com/watch?v=ifYrTFM2d6s
151,How Far is Too Far? | The Age of A.I.,"60,577,521",Unknown,3 years ago,"The Age of A.I. is a 8 part documentary series hosted by Robert Downey Jr. covering the ways Artificial Intelligence, Machine ...",https://www.youtube.com/watch?v=UwsrzCVZAb8
152,Artificial intelligence program ChatGPT goes viral for generating entire essays in seconds,"18,460","6 minutes, 13 seconds",2 months ago,The artificial intelligence program ChatGPT developed by OpenAI is making waves in the tech industry for generating human-like ...,https://www.youtube.com/watch?v=kr5DqQmcztw
153,The SCARY TRUTH About ARTIFICIAL INTELLIGENCE...😳,"100,925",Unknown,3 months ago,Unknown,https://www.youtube.com/shorts/LbJcKkg8_uY
154,Artificial Intelligence Class 10 Chapter 1 | Introduction to AI- Intelligence and Its Traits 2022-23,"147,700","12 minutes, 23 seconds",1 year ago,"✓ In this video, ✔️ Class: 10th ✔️ Subject: Artificial Intelligence ✔️ Chapter: Introduction To AI - Foundational Concepts ...",https://www.youtube.com/watch?v=ptWmh0ocveM
155,Advances in artificial intelligence raise new ethics concerns,"37,958","8 minutes, 1 second",1 month ago,"In recent months, new artificial intelligence tools have garnered attention, and concern, over their ability to produce original work.",https://www.youtube.com/watch?v=l5nTlHeqYOQ
156,The Power of Artificial Intelligence,"1,249,054",Unknown,5 months ago,business: mahzad.babayan@unitedtalent.com edited by: https://www.youtube.com/goofyjuice & me.,https://www.youtube.com/watch?v=LhUAzphBUzc
157,Ai Fitnes Review | AiFitnes Token | Fitness Powered By Artificial Intelligence,"7,134","8 minutes, 43 seconds",1 day ago,Ai Fitnes Review | AiFitnes Token | Fitness Powered By Artificial Intelligence Artificial intelligence (AI) is being increasingly used in ...,https://www.youtube.com/watch?v=hGqqqCb1LR0
158,Artificial intelligence and its ethics | DW Documentary,"1,973,009",Unknown,3 years ago,Are we facing a golden digital age or will robots soon run the world? We need to establish ethical standards in dealing with ...,https://www.youtube.com/watch?v=Izd2qOgOGQI
159,Artificial Intelligence | Explained in Malayalam,"133,782",Unknown,3 months ago,"Coupon: NM100 (valid for first 200 users) Get your favorite subscriptions like Amazon Prime, Hotstar, Skillshare, Livemint and ...",https://www.youtube.com/watch?v=PfY187sxquI
160,2023 Cutoff Needed for Top B.Tech Artificial Intelligence & Data Science/Machine Learning|Huge Jobs,"5,060","9 minutes, 59 seconds",1 month ago,engineering #artificialIntelligence #btechAIDS #dineshprabhu Follow me on Instagram : https://instagram.com/dinesh_dp77.,https://www.youtube.com/watch?v=-4N27QlgJNQ
161,Can we build AI without losing control over it? | Sam Harris,"3,601,056","14 minutes, 28 seconds",6 years ago,"Scared of superintelligent AI? You should be, says neuroscientist and philosopher Sam Harris -- and not just in some theoretical ...",https://www.youtube.com/watch?v=8nt3edWLgIg
162,LEAKED Artificial Intelligence News | Weekly Update #12,"25,897","9 minutes, 20 seconds",11 months ago,"LEAKED Artificial Intelligence News | Weekly Update #12 Subscribe now for more Artificial Intelligence news, Data science ...",https://www.youtube.com/watch?v=rtn5D6fG3uU
163,Machine Learning vs Deep Learning,"181,526","7 minutes, 50 seconds",11 months ago,Get a unique perspective on what the difference is between Machine Learning and Deep Learning - explained and illustrated in a ...,https://www.youtube.com/watch?v=q6kJ71tEYqM
164,The Greatest Risk of Artificial Intelligence (according to Ai) #technology #artificialintelligence,"333,341",Unknown,2 months ago,So I asked chatgpt what the five greatest risks associated with artificial intelligence were and here's what it told me number one ...,https://www.youtube.com/shorts/UXQjFcPEpqQ
165,Artificial intelligence vs. human intelligence,"6,754",Unknown,5 months ago,Situation in trafic.Drive assistance by electric car. self driving car.,https://www.youtube.com/shorts/MwCeMZNBPtM
166,Google Ceo -- Sundar pichai -- Tells about Machine learning and Artificial intelligence,"1,789",Unknown,6 months ago,Google Ceo -- Sundar pichai -- Tells about Machine learning and Artificial intelligence ...,https://www.youtube.com/shorts/l2zfgeGQgfc
167,AI is far more DANGEROUS than your IMAGINATION / Artificial Intelligence Future I Machine Learning,646,"7 minutes, 28 seconds",4 months ago,In today's video we will see How Artificial Intelligence super capabilities might prove fatal to human beings in the future. Like ...,https://www.youtube.com/watch?v=esDjtbGb0OE
168,AI Crypto Coins 🔥 What are the Top Artificial Intelligence Coins?,"6,501","3 minutes, 35 seconds",2 weeks ago,AI Crypto Coins | AI Projects | Fetch AI Crypto Fetch_ai Twitter: https://twitter.com/Fetch_ai Ocean Protocol Twitter: ...,https://www.youtube.com/watch?v=j04FJ0RlCFc
169,NEW Artificial Intelligence TradingView Indicator Gets INSANE Win Rate,"79,961","8 minutes, 17 seconds",1 month ago,This is an AI trading indicator. New artificial intelligence trading bot. This is a high win rate scalping trading strategy on ...,https://www.youtube.com/watch?v=ITN88_zBHcg
170,Daddy's Car: a song composed with Artificial Intelligence - in the style of the Beatles,"2,953,560","3 minutes, 1 second",6 years ago,About Sony CSL Music Team: Sony CSL (Computer Science Laboratories) is a fundamental research laboratory based in Tokyo ...,https://www.youtube.com/watch?v=LSHZ_b05W7o
171,Artificial intelligence chatbot ChatGPT sparks plagiarism concerns after passing exams - BBC News,"189,292","6 minutes, 11 seconds",1 month ago,There are concerns that popular online artificial intelligence chatbot ChatGPT could help students plagiarise their essays.,https://www.youtube.com/watch?v=30TpiDwnMYU
172,What is AI? Artificial Intelligence Explained in Malayalam - One Team Solutions,"5,822","4 minutes, 25 seconds",5 months ago,"Hi, thanks for watching our video about What is AI? Artificial Intelligence Explained in Malayalam #ai #artificialintelligence ...",https://www.youtube.com/watch?v=ja8gDaxv3sc
173,Artificial Intelligence is getting conscious,"3,002,338",Unknown,2 months ago,"AI i.e Artificial intelligence is getting more conscious day by day. With the arrival of Machine learning, This consciousness has ...",https://www.youtube.com/shorts/RNL0aItSOtU
174,A. I. Artificial Intelligence Movie Explained In Hindi/Urdu,"2,227,466",Unknown,1 year ago,A. I. Artificial Intelligence Movie Explained Hindi/Urdu Snatch movie Explained in Hindi Hindi movie explanation Hollywood ...,https://www.youtube.com/watch?v=zspcXo5-kvE
175,Art created by artificial Intelligence,unknown,Unknown,Unknown,"DALL-E is one of several artificial intelligence software programs that can turn anything you type, no matter how absurd, into art, ...",https://www.youtube.com/watch?v=s11k0yAA8ZQ
176,AI Gone Wrong: The Shocking Dark Side of Artificial Intelligence,327,"3 minutes, 23 seconds",1 month ago,Are you ready to uncover the dark side of AI? This video delves into the controversial topic of artificial intelligence and the ...,https://www.youtube.com/watch?v=yuOF_v1ruVk
177,Write Email using Artificial Intelligence,394,Unknown,4 months ago,You can generate content using Artificial Intelligence in seconds using various applications available in market now. Make use of ...,https://www.youtube.com/shorts/qs8pblnFM0M
178,This FREE Artificial Intelligence TradingView Indicator ALWAYS WINS! (100% Profitable),"9,709","5 minutes, 8 seconds",7 days ago,"An Artificial Intelligence indicator in TradingView is explained in this video, which is one of the most accurate buy sell indicator in ...",https://www.youtube.com/watch?v=jHmf3upgyyc
179,Twitch Chat and I invaded USA with Artificial Intelligence,"2,714,762","1 hour, 2 minutes",5 months ago,The sequel to the greatest board game of all time. Streaming live on Twitch! https://www.twitch.tv/dougdoug Full stream recording: ...,https://www.youtube.com/watch?v=u2aiUs5giDc
180,Scariest Artificial Intelligence Moments #shorts,"5,672,755",Unknown,1 year ago,Unknown,https://www.youtube.com/shorts/RvZbObFiTJY
181,"2023 03 05 John Haller's Prophecy Update  ""Artificial Intelligence, NOT Real Wisdom”","11,750","1 hour, 8 minutes",5 days ago,"The world is full of those who consider themselves well-educated, but they are fools when it comes to the person of God.",https://www.youtube.com/watch?v=77NJWxlsw_U
182,How artificial intelligence is changing our society | DW Documentary,"2,718,681",Unknown,2 years ago,"Artificial intelligence (AI) is changing our lives. It touches on all aspects of society - private life, business, security -- including in the ...",https://www.youtube.com/watch?v=-ePZ7OdY-Dw
183,Could Artificial Intelligence Go Too Far? (House Oversight Subcommittee Hearing on AI),199,"2 minutes, 42 seconds",1 day ago,Rep. Marjorie Taylor Greene brings up concerns over advances in Artificial Intelligence Technology at a House Oversight ...,https://www.youtube.com/watch?v=39dMF2YCj-s
184,SPOTTERai Artificial Intelligence Auto Classification,"4,320","2 minutes, 48 seconds",3 years ago,Spotter AI is a radar classification based on artificial intelligence (AI) achieved by site-specific machine learning (ML). Using a ...,https://www.youtube.com/watch?v=rMc0Rxa9NVE
185,Dangers of Artificial Intelligence - ChatGPT | Brat Weinstein | Joe Rogan,"52,209",Unknown,1 month ago,Unknown,https://www.youtube.com/shorts/kseEbEqtxV4
186,Artificial Intelligence Class 10 Ch 1 |AI vs Machine Learning vs Deep Learning (Differences) 2022-23,"52,526",Unknown,1 year ago,"✓ In this video, ✔️ Class: 10th ✔️ Subject: Artificial Intelligence ✔️ Chapter: Introduction To AI - Foundational Concepts ...",https://www.youtube.com/watch?v=A1kgMEs_ALI
